movie_title,movie_summary,release_date,genres,indicative_rating,running_time,domestic_gross,international_gross,total_gross,domestic_opening,domestic_distributor
Avengers: Endgame (2019),"After the devastating events of Avengers: Infinity War, the universe is in ruins. With the help of remaining allies, the Avengers assemble once more in order to reverse Thanos' actions and restore balance to the universe.",2019-04-24,Action Adventure Sci-Fi,PG-13,181,858373000.0,1941066100.0,2799439100,357115007.0,Walt Disney Studios Motion Pictures
The Lion King (2019),"After the murder of his father, a young lion prince flees his kingdom only to learn the true meaning of responsibility and bravery.",2019-07-11,Adventure Animation Drama Family Musical,PG,118,543638043.0,1118382776.0,1662020819,191770759.0,Walt Disney Studios Motion Pictures
Frozen II (2019),"Anna, Elsa, Kristoff, Olaf and Sven leave Arendelle to travel to an ancient, autumn-bound forest of an enchanted land. They set out to find the origin of Elsa's powers in order to save their kingdom.",2019-11-20,Adventure Animation Comedy Drama Family Fantasy Musical,PG,103,477373578.0,976309898.0,1453683476,130263358.0,Walt Disney Studios Motion Pictures
Spider-Man: Far from Home (2019),"Peter Parker, the beloved superhero Spider-Man, faces four destructive elemental monsters while on holiday in Europe. Soon, he receives help from Mysterio, a fellow hero with mysterious origins.",2019-06-28,Action Adventure Comedy Fantasy Sci-Fi,PG-13,129,391283774.0,741414082.0,1132723226,92579212.0,Sony Pictures Releasing
Captain Marvel (2019),Carol Danvers becomes one of the universe's most powerful heroes when Earth is caught in the middle of a galactic war between two alien races.,2019-03-06,Action Adventure Sci-Fi,PG-13,123,426829839.0,704586607.0,1131416446,153433423.0,Walt Disney Studios Motion Pictures
Joker (2019),"Arthur Fleck, a party clown and a failed stand-up comedian, leads an impoverished life with his ailing mother. However, when society shuns him and brands him as a freak, he decides to embrace the life of chaos in Gotham City.",2019-10-02,Crime Drama Thriller,R,122,335477657.0,743480625.0,1078958629,96202337.0,Warner Bros.
Star Wars: Episode IX - The Rise of Skywalker (2019),The surviving Resistance faces the First Order once again.,2019-12-18,Action Adventure Fantasy Sci-Fi,PG-13,141,515202542.0,561819830.0,1077022372,177383864.0,Walt Disney Studios Motion Pictures
Toy Story 4 (2019),"When a new toy called ""Forky"" joins Woody and the gang, a road trip alongside old and new friends reveals how big the world can be for a toy.",2019-06-20,Adventure Animation Comedy Family Fantasy,G,100,434038008.0,639803386.0,1073841394,120908065.0,Walt Disney Studios Motion Pictures
Aladdin (2019),"Aladdin, a kind thief, woos Jasmine, the princess of Agrabah, with the help of Genie. When Jafar, the grand vizier, tries to usurp the king, Jasmine, Aladdin and Genie must stop him from succeeding.",2019-05-22,Adventure Comedy Family Fantasy Musical Romance,PG,128,355559216.0,698744784.0,1054304000,91500929.0,Walt Disney Studios Motion Pictures
Jumanji: The Next Level (2019),"In Jumanji: The Next Level, the gang is back but the game has changed. As they return to rescue one of their own, the players will have to brave parts unknown from arid deserts to snowy mountains, to escape the world's most dangerous game.",2019-12-04,Action Adventure Comedy Fantasy,PG-13,123,320314960.0,481378969.0,801693929,59251543.0,Sony Pictures Releasing
Fast & Furious Presents: Hobbs & Shaw (2019),Lawman Luke Hobbs and outcast Deckard Shaw form an unlikely alliance when a cyber-genetically enhanced villain threatens the future of humanity.,2019-07-01,Action Adventure Thriller,,137,173956935.0,586775991.0,760732926,60038950.0,Universal Pictures
Ne Zha (2019),"Born with unique powers, a boy is recruited to fight demons and save the community that fears him.",2019-07-26,Action Adventure Animation Fantasy Thriller,,110,3695533.0,722529938.0,726225471,1015755.0,Well Go USA Entertainment
The Wandering Earth (2019),"With the sun dying out, a group of brave astronauts set out to find new planet for the whole human race.",2019-01-31,Action Adventure Sci-Fi Thriller,,125,5971413.0,694021099.0,699992512,1685287.0,CMC Pictures
How to Train Your Dragon: The Hidden World (2019),"When Hiccup discovers Toothless isn't the only Night Fury, he must seek the Hidden World, a secret Dragon Utopia before a hired tyrant named Grimmel finds it first.",2019-01-03,Action Adventure Animation Comedy Drama Family Fantasy,PG,104,160945505.0,379042054.0,539987993,55022245.0,Universal Pictures
Maleficent: Mistress of Evil (2019),"Maleficent and her goddaughter Aurora begin to question the complex family ties that bind them as they are pulled in different directions by impending nuptials, unexpected allies, and dark new forces at play.",2019-10-16,Adventure Drama Family Fantasy Romance,PG,119,113929605.0,377800484.0,491730089,36948713.0,Walt Disney Studios Motion Pictures
It: Chapter Two (2019),"Twenty-seven years after their first encounter with the terrifying Pennywise, the Losers Club have grown up and moved away, until a devastating phone call brings them back.",2019-09-04,Drama Fantasy Horror,R,169,211622525.0,261500000.0,473123154,91062152.0,Warner Bros.
"My People, My Country (2019)","An anthology film consist of 7 short stories directed by several different directors, which are based on 7 moments since the founding of the People's Republic of China.",2019-09-25,Drama History,,154,2356683.0,447708310.0,450064993,876001.0,CMC Pictures
Pokémon: Detective Pikachu (2019),"In a world where people collect Pokémon to do battle, a boy comes across an intelligent talking Pikachu who seeks to be a detective.",2019-05-03,Adventure Comedy Family Mystery Sci-Fi,PG,104,144174568.0,305888070.0,450063166,54365242.0,Warner Bros.
The Secret Life of Pets 2 (2019),"Continuing the story of Max and his pet friends, following their secret lives after their owners leave them for work or school each day.",2019-05-24,Adventure Animation Comedy Family,PG,86,158980250.0,272184209.0,431164459,46652680.0,Universal Pictures
The Captain (2019),"When the windshield of his commercial airplane shatters at 30,000 feet in the air, a pilot and his flight crew work to ensure the safety of the passengers and land the plane.",2019-09-30,Action Adventure Drama Family Thriller,,111,706572.0,417156973.0,417863545,324769.0,Well Go USA Entertainment
Alita: Battle Angel (2019),"A deactivated cyborg's revived, but can't remember anything of her past and goes on a quest to find out who she is.",2019-02-05,Action Adventure Sci-Fi Thriller,PG-13,122,85838210.0,319142333.0,404980543,28525613.0,Twentieth Century Fox
Godzilla: King of the Monsters (2019),"The crypto-zoological agency Monarch faces off against a battery of god-sized monsters, including the mighty Godzilla, who collides with Mothra, Rodan, and his ultimate nemesis, the three-headed King Ghidorah.",2019-05-29,Action Adventure Fantasy Sci-Fi,PG-13,132,110500138.0,276800000.0,387300138,47776293.0,Warner Bros.
1917 (2019),"April 6th, 1917. As an infantry battalion assembles to wage war deep in enemy territory, two soldiers are assigned to race against time and deliver a message that will stop 1,600 men from walking straight into a deadly trap.",2019-12-25,Action Drama War,R,119,159227644.0,286836708.0,446064352,576216.0,Universal Pictures
Once Upon a Time... in Hollywood (2019),"As Hollywood's Golden Age is winding down during the summer of 1969, television actor Rick Dalton and his stunt double Cliff Booth endeavor to achieve lasting success in Hollywood while meeting several colorful characters along the way.",2019-07-25,Comedy Drama,R,161,142502728.0,249602348.0,392105159,41082018.0,Sony Pictures Releasing
Shazam! (2019),A newly fostered young boy in search of his mother instead finds unexpected super powers and soon gains a powerful enemy.,2019-04-03,Action Adventure Comedy Fantasy,PG-13,132,140480049.0,227318962.0,367799011,53505326.0,Warner Bros.
Dumbo (2019),"A young elephant, whose oversized ears enable him to fly, helps save a struggling circus, but when the circus plans a new venture, Dumbo and his friends discover dark secrets beneath its shiny veneer.",2019-03-27,Adventure Family Fantasy,PG,112,114766307.0,238518314.0,353284621,45990748.0,Walt Disney Studios Motion Pictures
John Wick: Chapter 3 - Parabellum (2019),"John Wick is on the run after killing a member of the international assassins' guild, and with a $14 million price tag on his head, he is the target of hit men and women everywhere.",2019-05-15,Action Crime Drama Thriller,R,130,171015687.0,157333700.0,328349908,56818067.0,Lionsgate
Crazy Alien (2019),"A monkey trainer whose act goes wrong after an alien crash lands on Earth and injures his monkey. Desperate to perform the act, he attempts to train the alien instead, but is punished after the alien regains his powers.",2019-02-05,Comedy Sci-Fi,,116,,327598891.0,327598891,,
Knives Out (2019),"When renowned crime novelist Harlan Thrombey is found dead at his estate just after his 85th birthday, the inquisitive and debonair Detective Benoit Blanc is mysteriously enlisted to investigate.",2019-11-21,Comedy Crime Drama Mystery Thriller,PG-13,130,165363234.0,147534686.0,312897920,26769548.0,Lionsgate
Terminator: Dark Fate (2019),"An augmented human and Sarah Connor must stop an advanced liquid Terminator from hunting down a young girl, whose fate is critical to the human race.",2019-10-23,Action Adventure Sci-Fi,R,128,62253077.0,198866215.0,261119292,29033832.0,Paramount Pictures
Parasite (2019),Greed and class discrimination threaten the newly formed symbiotic relationship between the wealthy Park family and the destitute Kim clan.,2019-05-30,Drama Thriller,R,132,53847897.0,208757704.0,262616458,393216.0,Neon
Us (2019),"In order to get away from their busy lives, the Wilson family takes a vacation to Santa Cruz, California. At night, four strangers break into Adelaide's childhood home. The family is shocked to find out that the intruders look like them.",2019-03-20,Horror Mystery Thriller,R,116,175084580.0,80982569.0,256071218,71117625.0,Universal Pictures
Pegasus (2019),An old-time racing champion tries to come back to the race track.,2019-01-31,Comedy Sport,,98,,255863112.0,255863112,,
Men in Black: International (2019),The MIB tackle a mole in their organization.,2019-06-12,Action Adventure Comedy Sci-Fi,PG-13,114,80001807.0,173888894.0,253890701,30035838.0,Sony Pictures Releasing
X-Men: Dark Phoenix (2019),"Jean Grey begins to develop incredible powers that corrupt and turn her into a Dark Phoenix, causing the X-Men to have to decide if her life is worth more than all of humanity.",2019-06-05,Action Adventure Sci-Fi,PG-13,113,65845974.0,186597000.0,252442974,32828348.0,Twentieth Century Fox
Glass (2019),"Security guard David Dunn uses his supernatural abilities to track Kevin Wendell Crumb, a disturbed man who has twenty-four personalities.",2019-01-16,Drama Horror Sci-Fi Thriller,PG-13,129,111048468.0,135950571.0,246999039,40328920.0,Universal Pictures
The Bravest (2019),Chinese firefighters struggle to contain a huge fire after an oil pipeline explodes.,2019-08-01,Action Drama,PG-13,118,290217.0,244889345.0,245179562,110375.0,Sony Pictures Releasing
Annabelle Comes Home (2019),"While babysitting the daughter of Ed and Lorraine Warren, a teenager and her friend unknowingly awaken an evil spirit trapped in a doll.",2019-06-23,Horror Mystery Thriller,R,106,74152591.0,157100000.0,231252591,20269723.0,Warner Bros.
Better Days (2019),"While she copes with the pressures of her final examinations, a bullied teenage girl forms an unlikely friendship with a mysterious young man who protects her from her assailants.",2019-06-27,Crime Drama Romance Thriller,,135,1921657.0,225391987.0,227313644,989536.0,Well Go USA Entertainment
Ford v Ferrari (2019),American car designer Carroll Shelby and driver Ken Miles battle corporate interference and the laws of physics to build a revolutionary race car for Ford in order to defeat Ferrari at the 24 Hours of Le Mans in 1966.,2019-11-13,Action Biography Drama Sport,PG-13,152,117624357.0,108675123.0,226299480,31474958.0,Twentieth Century Fox
Little Women (2019),"In 19th century Massachusetts, the March sisters--Meg, Jo, Beth, and Amy--on the threshold of womanhood, go through many ups and downs in life and endeavor to make important decisions about their futures.",2019-12-25,Drama Romance,PG,135,108101214.0,224002569.0,332103783,16755310.0,Sony Pictures Releasing
The Addams Family (2019),The Addams family face-off against a crafty reality-TV host while also preparing for their extended family to arrive for a major celebration.,2019-10-11,Animation Comedy Family Fantasy Horror,PG,86,100723831.0,103670352.0,204394183,30300007.0,United Artists Releasing
Rocketman (2019),"The musical fantasy about Elton John's breakthrough years, from his time as a prodigy at the Royal Academy of Music through his influential and enduring musical partnership with Bernie Taupin.",2019-05-24,Biography Drama Music Musical,R,121,96368160.0,98952240.0,195320400,25725722.0,Paramount Pictures
Downton Abbey (2019),The Crawleys and their servants prepare to host King George V and Queen Mary at Downton Abbey.,2019-09-12,Drama Romance,PG,122,96853865.0,97840860.0,194694725,31033665.0,Focus Features
Weathering with You (2019),"Set during a period of exceptionally rainy weather, high-school boy Hodaka Morishima runs away from his troubled rural home to Tokyo and befriends an orphan girl who can manipulate the weather.",2019-07-19,Animation Drama Fantasy Romance,PG-13,112,8056636.0,184296344.0,192352980,1808533.0,GKIDS
The Lego Movie 2: The Second Part (2019),"It's been five years since everything was awesome and the citizens are facing the huge new threat of Lego Duplo, invaders from outer space, wrecking everything faster than they can rebuild.",2019-02-06,Adventure Animation Comedy Family Fantasy Musical Sci-Fi,PG,107,105956290.0,93646912.0,199603202,34115335.0,Warner Bros.
Sheep Without a Shepherd (2019),"Desperate measures are taken by a man who tries to save his family from the dark side of the law, after they commit an unexpected crime.",2019-12-13,Crime Drama Thriller,,112,,191602146.0,191602146,,
The White Storm 2: Drug Lords (2019),"A wealthy businessman tries to take down a drug kingpin that he used to work with, while a policeman tries to find justice without breaking the law.",2019-07-05,Action Crime,,99,609461.0,188786919.0,189396380,244795.0,CMC Pictures
Abominable (2019),Three teenagers must help a Yeti return to his family while avoiding a wealthy man and a zoologist who want him for their own needs.,2019-09-19,Adventure Animation Comedy Family Fantasy,PG,97,61270390.0,129034382.0,190304772,20612100.0,Universal Pictures
Ip Man 4: The Finale (2019),The Kung Fu master travels to the U.S. where his student has upset the local martial arts community by opening a Wing Chun school.,2019-11-29,Action Biography Drama History,,107,3956031.0,172389935.0,176345966,737718.0,Well Go USA Entertainment
Gemini Man (2019),An over-the-hill hitman faces off against a younger clone of himself.,2019-10-02,Action Sci-Fi Thriller,PG-13,117,48546770.0,124922746.0,173469516,20552372.0,Paramount Pictures
Spies in Disguise (2019),"When the world's best spy is turned into a pigeon, he must rely on his nerdy tech officer to save the world.",2019-11-29,Action Adventure Animation Comedy Drama Family Sci-Fi Thriller,PG,102,66757013.0,104859751.0,171616764,13354798.0,Twentieth Century Fox
Hustlers (2019),"Inspired by the viral New York Magazine article, ""Hustlers"" follows a crew of savvy former strip-club employees who band together to turn the tables on their Wall Street clients.",2019-09-12,Comedy Crime Drama,R,110,104963598.0,52600000.0,157563598,33181361.0,STX Entertainment
The Climbers (2019),The four members of the China Everest Climbing Commando confront the most difficult mount. The first four failures have cost them too much physical strength until the wind and snow stop the gap.,2019-09-30,Action Adventure Drama History,,125,487157.0,156405709.0,156892866,156096.0,Well Go USA Entertainment
Escape Room (2019),Six strangers find themselves in a maze of deadly mystery rooms and must use their wits to survive.,2019-01-02,Action Adventure Horror Mystery Sci-Fi Thriller,PG-13,99,57005601.0,98706476.0,155712077,18238172.0,Sony Pictures Releasing
Yesterday (2019),A struggling musician realizes he's the only person on Earth who can remember The Beatles after waking up in an alternate reality where they never existed.,2019-06-26,Comedy Fantasy Music Romance,PG-13,116,73286650.0,81322206.0,154608856,17010050.0,Universal Pictures
The Angry Birds Movie 2 (2019),The flightless birds and scheming green pigs take their feud to the next level.,2019-08-02,Action Adventure Animation Comedy Family,PG,97,41667116.0,106124931.0,147792047,10354073.0,Sony Pictures Releasing
Angel Has Fallen (2019),"Mike Banning is framed for the attempted assassination of the President, and now must evade his own agency, and the FBI, as he tries to uncover the real threat.",2019-08-21,Action Thriller,R,121,69030436.0,77631541.0,146661977,21380987.0,Lionsgate
Ad Astra (2019),"Astronaut Roy McBride undertakes a mission across an unforgiving solar system to uncover the truth about his missing father and his doomed expedition that now, 30 years later, threatens the universe.",2019-09-18,Adventure Drama Mystery Sci-Fi Thriller,PG-13,123,50188370.0,77273502.0,127461872,19001398.0,Twentieth Century Fox
Midway (2019),"The story of the Battle of Midway, told by the leaders and the sailors who fought in it.",2019-10-08,Action Drama History War,PG-13,138,56846802.0,70543587.0,127390389,17897419.0,Lionsgate
The Upside (2017),A comedic look at the relationship between a wealthy man with quadriplegia and an unemployed man with a criminal record who's hired to help him.,2019-01-10,Comedy Drama,PG-13,126,108252517.0,17603663.0,125856180,20355000.0,STX Entertainment
Last Christmas (2019),"Kate is a young woman subscribed to bad decisions. Working as an elf in a year-round Christmas store is not good for the wannabe singer. However, she meets Tom there. Her life takes a new turn--that seems too good to be true.",2019-11-07,Comedy Drama Fantasy Romance,PG-13,103,35150750.0,88295422.0,123446172,11441055.0,Universal Pictures
The Curse of La Llorona (2019),"Ignoring the eerie warning of a troubled mother suspected of child endangerment, a social worker and her own small kids are soon drawn into a frightening supernatural realm.",2019-04-11,Horror Mystery Thriller,R,93,54733739.0,68500000.0,123233739,26347631.0,Warner Bros.
Looking Up (2019),"When his space shuttle flight has an accident, an astronaut remembers the lessons his father taught him growing up.",2019-07-18,Drama,,147,84267.0,122910316.0,122994583,36541.0,China Lion Film Distribution
Zombieland: Double Tap (2019),"Columbus, Tallahassee, Wichita, and Little Rock move to the American heartland as they face off against evolved zombies, fellow survivors, and the growing pains of the snarky makeshift family.",2019-10-09,Action Comedy Horror,R,99,73123082.0,49687317.0,122810399,26803104.0,Sony Pictures Releasing
Dora and the Lost City of Gold (2019),Teenage explorer Dora leads her friends on an adventure to save her parents and solve the mystery behind a lost city of gold.,2019-08-08,Action Adventure Comedy Family Fantasy Mystery,PG,102,60477943.0,60119165.0,120597108,17431588.0,Paramount Pictures
Extreme Job (2019),"A police undercover operation takes a delicious, unexpected turn.",2019-01-23,Action Comedy Crime,,111,1565885.0,118366848.0,119932733,42587.0,CJ Entertainment
Wonder Park (2019),The imagination of a wildly creative girl comes alive in an amusement park.,2019-03-12,Adventure Animation Comedy Drama Family Fantasy,PG,85,45216793.0,74342317.0,119559110,15853646.0,Paramount Pictures
P Storm (2019),"William Luk, goes undercover as a prisoner to investigate correctional officers who are receiving bribes.",2019-04-04,Action Crime,Not Rated,96,326711.0,117665016.0,117991727,104071.0,CMC Pictures
Detective Conan: The Fist of Blue Sapphire (2019),After being recovered from a pirate ship sunk in the nineteenth century off the coast of Singapore.,2019-04-12,Action Adventure Animation Crime Family Mystery Romance,,109,,115448200.0,115448200,,
The Gentlemen (2019),"An American expat tries to sell off his highly profitable marijuana empire in London, triggering plots, schemes, bribery and blackmail in an attempt to steal his domain out from under him.",2019-12-19,Action Crime,R,113,36471795.0,78700000.0,115175729,10651884.0,STX Entertainment
Pet Sematary (2019),"Dr. Louis Creed and his wife, Rachel, relocate from Boston to rural Maine with their two young children. The couple soon discover a mysterious burial ground hidden deep in the woods near their new home.",2019-04-03,Horror Mystery Thriller,R,100,54724696.0,58393530.0,113118226,24502775.0,Paramount Pictures
Boonie Bears: Blast Into the Past (2019),Boonie bears and bareheaded Qiang blast into primitive times and experience a period of exciting and breathtaking time in a primitive tribe.,2019-02-05,Adventure Animation Fantasy,,90,,112367881.0,112367881,,
Good Boys (2019),"Three 6th-grade boys ditch school and embark on an epic journey while carrying accidentally stolen drugs, being hunted by teenage girls, and trying to make their way home in time for a long-awaited party.",2019-08-14,Adventure Comedy,R,90,83140306.0,28033292.0,111173598,21402605.0,Universal Pictures
Scary Stories to Tell in the Dark (2019),"Pennsylvania, 1968. After playing a joke on a school bully, Stella and her friends decide to sneak into a haunted house that once belonged to the powerful Bellows family, unleashing dark forces that they will be unable to control.",2019-08-07,Adventure Horror Mystery,PG-13,108,68947075.0,35598430.0,104545505,20915346.0,Lionsgate
Line Walker 2: Invisible Spy (2019),"After they uncover evidence that there is corruption in the police force, three police officers in Hong Kong try to discover which of them can be trusted.",2019-08-07,Action Crime Thriller,,98,296751.0,99185276.0,99482027,96991.0,Well Go USA Entertainment
The Hustle (2019),Two con women - one low rent and the other high class - team up to take down the men who have wronged them.,2019-05-08,Comedy Crime,PG-13,93,35417038.0,61992741.0,97409779,13007709.0,United Artists Releasing
The New King of Comedy (2019),A young woman who is dreaming and striving to pursue the actors' dream despite being an extra and stand-in.,2019-02-05,Comedy Drama,,90,,95618308.0,95618308,,
Adoring (2019),Star-studded holiday ensemble comedy about pets and their owners lives.,2019-12-31,Drama Family Romance,,108,,94975692.0,94975692,,
Five Feet Apart (2019),"Stella spends most of her time in the hospital as a cystic fibrosis patient. Her life is full of routines, boundaries and self-control -- all of which get put to the test when she meets Will, a charming boy who has the same illness.",2019-03-14,Drama Romance,PG-13,116,45729221.0,46830689.0,92559910,13190286.0,Lionsgate
Crawl (2019),Gigantic alligators swarm around a young woman and her father as floodwaters engulf their home.,2019-07-10,Action Horror Thriller,R,87,39014193.0,52527904.0,91542097,12005210.0,Paramount Pictures
Rambo: Last Blood (2019),Rambo must confront his past and unearth his ruthless combat skills to exact revenge in a final mission.,2019-09-18,Action Crime Thriller,R,89,44819352.0,46671001.0,91490353,18872919.0,Lionsgate
Jojo Rabbit (2019),"A young German boy in the Hitler Youth, whose hero and imaginary friend is the country's dictator, is shocked to discover that his mother is hiding a Jewish girl in their home.",2019-10-18,Comedy Drama War,PG-13,108,33370906.0,60227274.0,93598180,349555.0,Fox Searchlight Pictures
Serial (Bad) Weddings 2 (2019),"Claude and Marie Verneuil face a new crisis: their four daughters' spouses--David, Rachid, Chao, and Charles--have decided to leave France for various reasons. Here they imagine their lives elsewhere.",2019-01-30,Comedy,,99,,87761988.0,87761988,,
One Piece: Stampede (2019),Pirates from around the world gather at the Pirates Expo to join the hunt for Gol D. Roger's lost treasure.,2019-08-09,Action Adventure Animation Fantasy,,101,1298528.0,80276282.0,81574810,357740.0,FUNimation Entertainment
A Dog's Way Home (2019),A female dog travels four hundred miles in search of her owner throughout a Colorado wilderness.,2019-01-09,Adventure Drama Family,PG,96,42004346.0,38703788.0,80708134,11251263.0,Sony Pictures Releasing
A Dog's Journey (2019),A dog finds the meaning of his own existence through the lives of the humans he meets.,2019-05-03,Adventure Comedy Drama Family Fantasy,PG,109,22782371.0,56088708.0,78871103,8030085.0,Universal Pictures
Cold Pursuit (2019),A grieving snowplow driver seeks revenge against the drug dealers who killed his son.,2019-02-07,Action Comedy Crime Drama Thriller,R,119,32138862.0,44280893.0,76419755,11030233.0,Lionsgate
Cats (2019),A tribe of cats called the Jellicles must decide yearly which one will ascend to the Heaviside Layer and come back to a new Jellicle life.,2019-12-20,Comedy Drama Family Fantasy Musical,PG,110,27166770.0,48392155.0,75558925,6619870.0,Universal Pictures
A Madea Family Funeral (2019),"A joyous family reunion becomes a hilarious nightmare as Madea and the crew travel to backwoods Georgia, where they find themselves unexpectedly planning a funeral that might unveil unsavory family secrets.",2019-02-28,Comedy Drama,PG-13,109,73257045.0,1490680.0,74747725,27062332.0,Lionsgate
