movie_title,movie_summary,release_date,genres,running_time,domestic_gross,international_gross,total_gross,domestic_opening,domestic_distributor
Guantanamera (1995),"It is a satire about life in Cuba. The members of a funeral procession and some truck drivers who need to take the same route begin to talk about God and the world and they end up discovering that life for both groups has many similarities and many differences, depending on the point of view.",1997-07-04,Comedy Drama,105,903840,,903840,8851.0,Lionsgate
"Fast, Cheap & Out of Control (1997)","An exploration of the careers of four unrelated professionals: a lion tamer, a robotics expert, a topiary gardener, and a naked mole rat specialist.",1997-10-03,Documentary,80,878960,,878960,23665.0,Sony Pictures Classics
The Winter Guest (1997),"A recent widow, who is determined to leave Scotland for Australia with her son, gets an unexpected visit from her aging mother.",1997-12-25,Drama,108,870290,,870290,20533.0,Fine Line Features
Anna Karenina (1997),Anna (Marceau) is a wife and mother who has an affair with the handsome Count Vronsky (Bean). Based on the novel by Tolstoy.,1997-04-04,Drama Romance,108,858553,,858553,75268.0,Warner Bros.
Children of the Revolution (1996),"Few knew that Stalin spent his last night in the arms of a young Australian woman. Few still knew that their ""love-child"" brought Australia to the brink of civil war. Until now.",1997-05-01,Comedy Drama Romance,101,838368,,838368,31562.0,Miramax
Dirty Dancing (1987),"Spending the summer at a Catskills resort with her family, Frances ""Baby"" Houseman falls in love with the camp's dance instructor, Johnny Castle.",1987-08-21,Drama Music Romance,100,64577242,150000000.0,214577242,3900000.0,Vestron Pictures
Kiss or Kill (1997),"After a robbery scam that goes bad, lovers Nikki and Al take off into the Australian outback, pursued by the police and a malevolent footballer named Zipper Doyle, and meet a number of offbeat characters.",1997-11-14,Crime Drama Thriller,96,796681,5047.0,801728,,October Films
Prisoner of the Mountains (1996),"Two Russian soldiers, one battle-seasoned and the other barely into his boots and uniform, are taken prisoner by an anxious Islamic father from a remote village hoping to trade them for his captured son.",1997-01-31,Drama War,99,790078,131808.0,921886,17205.0,Orion Classics
Box of Moonlight (1996),"An engineer finds his first gray hair, takes 6 days off from wife, son and work, rents a car and meets different people.",1997-07-25,Comedy Drama,112,782641,,782641,,Trimark Pictures
Happy Together (1997),A couple take a trip to Argentina but both men find their lives drifting apart in opposite directions.,1997-10-10,Drama Romance,96,320319,1218494.0,1539811,,Kino International
