movie_title,movie_summary,release_date,genres,indicative_rating,running_time,domestic_gross,international_gross,total_gross,domestic_opening,domestic_distributor
The Knight of Shadows: Between Yin and Yang (2019),"A legendary demon hunter (Jackie Chan), tracking down beasts that enter the human dimension, assisted by a lawman protégé and a motley group of friendly monsters.",2019-02-05,Action Adventure Family Fantasy Romance War,,109,,22936257.0,22936257,,
Black and Blue (2019),A rookie New Orleans police officer is forced to balance her identity as a black woman after she witnesses two corrupt cops committing murder.,2019-10-23,Action Thriller,R,108,22055313.0,685748.0,22741061,8376846.0,Screen Gems
Late Night (2019),A late night talk show host suspects that she may soon lose her long-running show.,2019-06-07,Comedy Drama,R,102,15499454.0,6887101.0,22386555,246305.0,Amazon Studios
Unplanned (2019),"All Abby Johnson ever wanted to do was help women. As one of the youngest Planned Parenthood clinic directors in the nation, she believed in a woman's right to choose. Until the day she saw something that changed everything.",2019-03-29,Biography Drama,R,109,19005109.0,2580217.0,21585326,6382298.0,Pure Flix Entertainment
Crazy Romance (2019),"A love story between Jae Hoon, who couldn't let go of his ex-girlfriend, and Sun Young, who is splitting up with her boyfriend. The couple got trouble and were hurt by love.",2019-10-02,Comedy Drama Romance,,115,,21386368.0,21386368,,
Shaft (2019),"JJ Shaft, a cyber security expert with a degree from MIT, enlists his family's help to uncover the truth behind his best friend's untimely death.",2019-06-14,Action Comedy Crime Mystery,R,111,21360215.0,,21360215,8901419.0,Warner Bros.
Hotel Mumbai (2018),The true story of the Taj Hotel terrorist attack in Mumbai. Hotel staff risk their lives to keep everyone safe as people make unthinkable sacrifices to protect themselves and their families.,2019-03-14,Action Drama History Thriller,R,123,9651611.0,11664216.0,21315827,88065.0,Bleecker Street Media
Integrity (2019),The chief investigator of ICAC Chan King Chi's childhood friend Hui Chik Yiu does a spy job in the smuggler company even after he mysteriously fleets to Australia.,2019-02-05,Crime Drama Mystery,,114,,21290004.0,21290004,,
The Secret Mission (2019),"During the Japanese occupation, two men travel across the country compiling the first Korean language dictionary.",2019-01-09,Comedy Drama History,,135,,21083522.0,21083522,,
This Is Tomas (2019),"Leo promises his girlfriend, Fer to spend the day with her brother, Tomás. But he ends up taking him to a wedding where he'll play for a big shot producer. They'll discover how special is Tomás, even when everything goes wrong.",2019-07-26,Comedy Drama,,87,,20084169.0,20084169,,
The Specials (2019),"The story of two men, educators of children and adolescents with autism.",2019-10-23,Comedy Drama,,114,,19387647.0,19387647,,
Always Miss You (2019),"Xinyi believes she's finally found a good man; going all in on this new and potentially life changing relationship. But when her teenage crush re-enters her life, she has to decide who to pick - and who will pick her.",2019-05-01,Romance,Not Rated,98,91884.0,18923581.0,19015465,46720.0,China Lion Film Distribution
An Officer and a Spy (2019),"In 1894, French Captain Alfred Dreyfus is wrongfully convicted of treason and sentenced to life imprisonment at Devil's island.",2019-06-27,Drama History Thriller,,132,,18925109.0,18925109,,
Crayon Shin-chan: Honeymoon Hurricane - The Lost Hiroshi (2019),"The Nohara family members take a vacation to Australia for rarely happened annular solar eclipse, in the name of dad and mom's honeymoon postponement. It is really an exciting and adventurous trip.",2019-04-19,Action Adventure Animation Family,,100,,18738951.0,18738951,,
Greta (2018),A young woman befriends a lonely widow who's harboring a dark and deadly agenda toward her.,2019-02-28,Drama Mystery Thriller,R,98,10532219.0,8120888.0,18653107,4481910.0,Focus Features
