movie_title,movie_summary,release_date,genres,indicative_rating,running_time,domestic_gross,international_gross,total_gross,domestic_opening,domestic_distributor
Grease (1978),"Good girl Sandy Olsson and greaser Danny Zuko fell in love over the summer. When they unexpectedly discover they're now in the same high school, will they be able to rekindle their romance?",1978-06-16,Comedy Musical Romance,PG,110,190071103,206200000.0,396271103,8941717.0,Paramount Pictures
Superman (1978),"An alien orphan is sent from his dying planet to Earth, where he grows up to become his adoptive home's first and greatest superhero.",1978-12-15,Action Adventure Sci-Fi,PG,143,134478449,166000000.0,300478449,7465343.0,Warner Bros.
National Lampoon's Animal House (1978),"At a 1962 college, Dean Vernon Wormer is determined to expel the entire Delta Tau Chi Fraternity, but those troublemakers have other plans for him.",1978-07-28,Comedy,,109,141600000,7219.0,141607219,276538.0,Universal Pictures
Every Which Way But Loose (1978),The San Fernando Valley adventures of trucker turned prize-fighter Philo Beddoe and his pet orangutan Clyde.,1978-12-20,Action Comedy,,114,85196485,,85196485,10272294.0,Warner Bros.
Heaven Can Wait (1978),"A Los Angeles Rams quarterback, accidentally taken away from his body by an overanxious angel before he was meant to die, returns to life in the body of a recently murdered millionaire.",1978-06-28,Comedy Fantasy Romance Sport,,101,81640278,,81640278,3652486.0,Paramount Pictures
Hooper (1978),"Aging Hollywood stuntman Sonny Hooper wants to prove that he's still got what it takes to be a great professional in this risky, under-recognized line of work.",1978-07-28,Action Comedy,,99,78000000,,78000000,,Warner Bros.
Jaws 2 (1978),Police chief Brody must protect the citizens of Amity after a second monstrous shark begins terrorizing the waters.,1978-06-16,Adventure Horror Thriller,,116,81766007,106118000.0,187884007,9866023.0,Universal Pictures
Revenge of the Pink Panther (1978),"To prove that he still is strong and powerful, Philippe Douvier decides to kill Clouseau. Once news of his ""death"" has been announced, Clouseau tries to take advantage of it and goes undercover with Cato to find out who tried to kill him.",1978-07-19,Comedy Crime Mystery,,99,49579269,,49579269,,United Artists
The Deer Hunter (1978),An in-depth examination of the ways in which the Vietnam War impacts and disrupts the lives of several friends in a small steel mill town in Pennsylvania.,1978-12-08,Drama War,,183,48979328,95051.0,49080312,,Universal Pictures
Halloween (1978),"Fifteen years after murdering his sister on Halloween night 1963, Michael Myers escapes from a mental hospital and returns to the small town of Haddonfield, Illinois, to kill again.",1978-10-25,Horror Thriller,,91,47160000,11716.0,47173315,,Compass International Pictures
Foul Play (1978),"A San Francisco librarian picks up a hitchhiker whose car has broken down, which leads to her being stalked and hunted by shady individuals. A cop she briefly met during a function eventually comes to her rescue.",1978-07-19,Comedy Mystery Thriller,,116,44999621,,44999621,,Paramount Pictures
The End (1978),Slapstick black comedy about a man (Reynolds) who finds that he hasn't much longer to live and has bungled his attempts at suicide.,1978-05-10,Comedy Drama,,100,44917151,,44917151,,United Artists
Up in Smoke (1978),"Stoner musicians Pedro DePacas and Anthony ""Man"" Stoner unknowingly smuggle a van - made entirely of marijuana - from Mexico to Los Angeles with incompetent Police Sergeant Stedenko hot on their trail.",1978-08-11,Comedy Music,,86,44364244,,44364244,,Paramount Pictures
Midnight Express (1978),"Billy Hayes, an American college student, is caught smuggling drugs out of Turkey and thrown into prison.",1978-10-27,Biography Crime Drama Thriller,,121,35000000,,35000000,,Columbia Pictures
Coming Home (1978),"In 1968 California, a woman whose husband is a Marine officer fighting in Vietnam falls in love with a former high school classmate who suffered a paralyzing combat injury in the war.",1978-02-15,Drama Romance War,,127,32653905,141.0,32654046,,United Artists
The Lord of the Rings (1978),The Fellowship of the Ring embark on a journey to destroy the One Ring and end Sauron's reign over Middle-earth.,1978-11-15,Adventure Animation Fantasy,,132,30471420,,30477175,626649.0,United Artists
House Calls (1978),"Charley is a surgeon who's recently lost his wife. He embarks on a tragicomic romantic quest with woman after woman until he meets up with Ann, a singular woman closer to his own age, who immediately and unexpectedly captures his heart.",1978-01-01,Comedy Drama Romance,,98,28460702,,28460702,,Universal Pictures
Damien: Omen II (1978),"Damien the Antichrist, now about to turn thirteen years old, finally learns of his destiny under the guidance of an unholy disciple of Satan. Meanwhile dark forces begin to eliminate all those who suspect the child's true identity.",1978-06-09,Horror,,107,26518355,,26518355,3880880.0,Twentieth Century Fox
Invasion of the Body Snatchers (1978),"When strange seeds drift to earth from space, mysterious pods begin to grow and invade San Francisco, replicating the city's residents one body at a time.",1978-12-22,Horror Sci-Fi,,115,24946533,182.0,24949050,1298129.0,United Artists
Convoy (1978),"Truckers form a mile-long ""convoy"" in support of a trucker's vendetta with an abusive sheriff - Based on the country song of the same title by C.W. McCall.",1978-06-28,Action Drama,,110,22765081,,22765081,,Metro-Goldwyn-Mayer (MGM)
The Wiz (1978),"When Harlem schoolteacher Dorothy is miraculously whisked away to an urban fantasy land called Oz, she goes in search of the Wiz, a wizard who can help her get back to Manhattan, along with the Scarecrow, the Tin Man and the Cowardly Lion.",1978-10-01,Adventure Family Fantasy Musical,,134,21049053,,21049647,,Universal Pictures
F.I.S.T. (1978),A rebellious Cleveland warehouse worker rises through the ranks of a trucking industry union to become union president but his organized crime links cause his eventual downfall.,1978-04-26,Crime Drama Thriller,,145,20388920,,20388920,,United Artists
Sgt. Pepper's Lonely Hearts Club Band (1978),"A small-town band hits it big, but it must battle a nefarious plot in the music industry.",1978-07-21,Adventure Comedy Fantasy Musical,,113,20378470,,20378470,,Universal Pictures
Eyes of Laura Mars (1978),"Fashion photographer Laura Mars, whose photographs contain violent images, develops the ability to see through a killer's eyes. Those around her include her driver Tommy, her manager Donald, her ex-husband Michael, and policeman John.",1978-08-02,Mystery Thriller,,104,20000000,41.0,20000041,,Columbia Pictures
The One and Only (1978),"Henry Winkler portrays an outrageously self-confident but out-of-work actor, a young man who dreams of stardom and leaves college to pursue fame and fortune.",1978-02-02,Comedy Romance,,97,16928137,,16928137,,Paramount Pictures
Return from Witch Mountain (1978),"Tia and Tony visit Los Angeles, but he's quickly kidnapped by an evil scientist, leaving her to desperately search for him.",1978-03-10,Adventure Family Fantasy Sci-Fi,,95,16393000,,16393000,,Walt Disney Studios Motion Pictures
Corvette Summer (1978),"High school graduate Kenneth W. Dantley Junior and Vanessa, a hooker-in-training, try to track down his custom-made newly-stolen Corvette.",1978-06-02,Adventure Comedy,,105,15514367,,15514367,,Metro-Goldwyn-Mayer (MGM)
The Greek Tycoon (1978),"A fictionalized account of the Greek shipping magnate, Onassis, and his meeting and subsequent marriage to the widow of assassinated U.S. president, Jacqueline Kennedy.",1978-01-01,Drama,,107,14672713,,14672713,,Universal Pictures
Death on the Nile (1978),"As Hercule Poirot enjoys a luxurious cruise down the Nile, a newlywed heiress is found murdered on board. Can Poirot identify the killer before the ship reaches the end of its journey?",1978-09-29,Crime Drama Mystery,,140,14560084,8717.0,14569266,,Paramount Pictures
The Buddy Holly Story (1978),"The story of the life and career of the early rock and roll singer, from his meteoric rise to stardom, to his marriage and untimely death.",1978-05-19,Biography Drama Music,,114,14363400,,14363400,,Columbia Pictures
The Big Fix (1978),An ex-'60s radical now working as a private eye is hired by an old flame to investigate a political smear campaign. The case becomes more dangerous as it unfolds.,1978-10-01,Comedy Mystery Thriller,,108,13062708,,13062708,,Universal Pictures
The Other Side of the Mountain: Part II (1978),"Jill and mom return to Bishop, renting trucker John's place during a summer getaway years post-tragedy. Jill fights her instant attraction to John, but they ultimately connect, past hurts complicating their romance.",1978-01-01,Biography Drama Romance,,100,11565678,,11565678,,Universal Pictures
Moment by Moment (1978),"Trisha Rawlings, a Beverly Hills socialite, suffers from loneliness following separation from her womanizing husband Stu. Strip, a young drifter, becomes infatuated with her and develops a May/December relationship with her.",1978-12-22,Drama Romance,,105,10963824,,10963824,,Universal Pictures
Interiors (1978),"Three sisters find their lives spinning out of control in the wake of their parents' sudden, unexpected divorce.",1978-08-02,Drama,,92,10432366,,10432366,,United Artists
Straight Time (1978),The difficulties of a career burglar to reinsert himself after being released on parole.,1978-03-17,Crime Drama,,114,9900000,,9900000,,Warner Bros.
Comes a Horseman (1978),"A brave and proud woman struggles for her land, finding help and something more in unexpected way.",1978-10-25,Drama Romance Western,,118,9585769,,9585769,,Metro-Goldwyn-Mayer (MGM)
American Hot Wax (1978),"The story of the rise and fall of Alan Freed, the pioneering New York City radio disc jockey who was instrumental in introducing and popularizing rock 'n' roll music in the 1950s.",1978-03-17,Drama History Music,,91,7932571,,7932571,,Paramount Pictures
The Brink's Job (1978),"A fictional retelling of the infamous Boston Brink's Company robbery on January 17th, 1950, of $2.7M, which cost the American taxpayers $29M to apprehend the culprits, with only $58,000 recovered.",1978-12-08,Comedy Crime Drama History,PG,104,7909950,,7909950,,Universal Pictures
Goin' South (1978),"Due to the lack of men after the Civil War, a western town allows a young bachelorette who lives alone to save a thief from hanging by marrying him. They must deal with his old gang, the Sheriff, the railroad, a gold mine, and each other.",1978-10-06,Comedy Romance Western,,108,7435671,,7435671,,Paramount Pictures
King of the Gypsies (1978),"In the criminal and violent world of modern-day Gypsies based in New York City, their 'king' Zharko Stepanowicz passes his leadership to his unwilling grandson, leaving the skipped father resentful.",1978-12-20,Crime Drama,,112,7325177,,7325177,,Paramount Pictures
Force 10 from Navarone (1978),"During World War II, several oddly assorted military experts are teamed in a mission to raid and destroy a bridge vital to enemy strategy.",1978-12-22,Action Drama War,,118,7230000,,7230000,,American International Pictures (AIP)
Paradise Alley (1978),"Three Italian-American brothers, living in the slums of 1940's New York City, try to help each other with one's wrestling career using one brother's promotional skills and another brother's con-artist tactics to thwart a sleazy manager.",1978-09-22,Drama,,107,7185518,,7185518,,Universal Pictures
The Bad News Bears Go to Japan (1978),"A small-time hustler takes the pint-sized baseball team to Japan for a match against the country's best Little League baseball team, sparking off a series of adventures and mishaps.",1978-06-02,Comedy Family Sport,,91,7092495,,7092495,,Paramount Pictures
International Velvet (1978),Velvet's orphaned niece Sarah follows her dream of Olympic glory with her horse Arizona Pie.,1978-07-12,Drama Family Sport,PG,127,7009238,,7009238,,Metro-Goldwyn-Mayer (MGM)
Blue Collar (1978),"When three automotive factory workers who're struggling financially try to steal from their own labor union, they discover corruption, and reluctantly decide to use this information for blackmail.",1978-02-10,Crime Drama,,114,6521083,,6521083,,Universal Pictures
Pretty Baby (1978),A preteen girl lives as a prostitute in New Orleans in 1917.,1978-04-05,Drama,,110,5786368,,5786368,,Paramount Pictures
Gray Lady Down (1978),A Navy Captain uses his experimental Snark to reach a nuclear submarine stuck on an ocean ledge.,1978-01-01,Adventure Drama History Thriller,,111,5438927,,5438927,,Universal Pictures
Brass Target (1978),"In 1945, General Patton sends Germany's confiscated gold reserves to Frankfurt, but the Army train is robbed by plotters who also hire a Swiss hitman to kill the General.",1978-12-22,Action Drama Mystery Thriller War,,111,5011158,,5011158,354797.0,Metro-Goldwyn-Mayer (MGM)
Caravans (1978),"In 1948, at the U.S. embassy in Zadestan, a young diplomat is ordered to find the missing daughter of an influential U.S. Senator.",1978-11-02,Action Adventure History,,127,3930501,,3930501,,Universal Pictures
Days of Heaven (1978),A hot-tempered farm laborer convinces the woman he loves to marry their rich but dying boss so that they can have a claim to his fortune.,1978-09-13,Drama Romance,,94,3446749,39689.0,3492909,,Paramount Pictures
Our Winning Season (1978),"The story follows three teenagers through their senior year of high school in the 1960s, focusing on the star athlete of the group.",1978-06-02,Drama,,92,1997705,,1997705,,American International Pictures (AIP)
I Wanna Hold Your Hand (1978),"In 1964, six teenagers from New Jersey run off to see The Beatles perform on The Ed Sullivan Show in the hope of meeting their idols. However, they don't have tickets. Along the way, they learn new things about friendship and growing up.",1978-01-01,Comedy Music Romance,,104,1944682,,1944682,,Universal Pictures
Skateboard (1978),"A Hollywood agent finds himself in debt to a powerful bookie. To make a fast buck, he creates a team of exceptionally talented skateboarders and enters them in a downhill race. If they win, they will get $20,000.",1978-02-01,Drama Sport,,97,1318823,,1318823,,Universal Pictures
Uncle Joe Shannon (1978),"Self-destructive after the deaths of his wife and child in a fire, a trumpet player befriends a crippled youngster and together they battle obstacles through each other's encouragement.",1978-12-15,Drama,,108,494797,,494797,,United Artists
Nunzio (1978),"Protected by his brother, a mentally impaired Brooklynite pretends he's Superman and becomes a hero.",1978-05-12,Drama,,85,52195,,52195,,Universal Pictures
The Last Waltz (1978),A film account and presentation of the final concert of The Band.,1978-04-26,Biography Documentary Music,,117,322313,18833.0,363707,,United Artists
