movie_title,movie_summary,release_date,genres,indicative_rating,running_time,domestic_gross,international_gross,total_gross,domestic_opening,domestic_distributor
Aladdin (1992),A kind-hearted street urchin and a power-hungry Grand Vizier vie for a magic lamp that has the power to make their deepest wishes come true.,1992-11-13,Adventure Animation Comedy Family Fantasy Musical Romance,,90,217350219,286700000.0,504050219,196664.0,Walt Disney Studios Motion Pictures
Batman Returns (1992),"While Batman deals with a deformed man calling himself the Penguin wreaking havoc across Gotham with the help of a cruel businessman, a female employee of the latter becomes the Catwoman with her own vendetta.",1992-06-19,Action Crime Fantasy,PG-13,126,162924631,104010057.0,266941512,45687711.0,Warner Bros.
Home Alone 2: Lost in New York (1992),"Kevin is separated from his family again when he accidentally boards a flight to New York City during a Christmas trip to Miami. However he crosses paths with the same burglars, who now plan to rob a toy store on Christmas eve.",1992-11-20,Adventure Comedy Crime Family,PG,120,173585516,185409334.0,358994850,31126882.0,Twentieth Century Fox
Lethal Weapon 3 (1992),Martin Riggs and Roger Murtaugh pursue a former LAPD officer who uses his knowledge of police procedure and policies to steal and sell confiscated guns and ammunition to local street gangs.,1992-05-15,Action Crime Thriller,R,118,144731527,177000000.0,321731527,33243086.0,Warner Bros.
A Few Good Men (1992),A military lawyer intends to prove that two US Marines charged with murdering a fellow Marine were only following their base commander's orders.,1992-12-11,Drama Thriller,R,138,141340178,101900000.0,243240178,15517468.0,Columbia Pictures
Sister Act (1992),"When a nightclub singer is forced to take refuge from the mob in a convent, she ends up turning the convent choir into a soulful chorus complete with a Motown repertoire, until the sudden celebrity of the choir jeopardizes her identity.",1992-05-29,Comedy Family Music,PG,100,139605150,92000000.0,231605150,11894587.0,Walt Disney Studios Motion Pictures
The Bodyguard (1992),"A former Secret Service agent takes on the job of bodyguard to an R&B singer, whose lifestyle is most unlike a President's.",1992-11-25,Drama Music Romance Thriller,R,129,122046449,289000000.0,411046449,16611793.0,Warner Bros.
Wayne's World (1992),Two slacker friends try to promote their public-access cable show.,1992-02-14,Comedy Music,PG-13,94,121697323,61400000.0,183097323,18122710.0,Paramount Pictures
Basic Instinct (1992),A violent police detective investigates a brutal murder that might involve a manipulative and seductive novelist.,1992-03-20,Drama Mystery Thriller,R,127,117727224,235200000.0,352927224,15129385.0,TriStar Pictures
A League of Their Own (1992),"During World War II, sisters Dottie and Kit join the first female professional baseball league and struggle to help it succeed amid their own growing rivalry.",1992-07-01,Comedy Drama Sport,PG,128,107533928,24906141.0,132440069,13739456.0,Sony Pictures Releasing
Unforgiven (1992),"Retired Old West gunslinger Will Munny reluctantly takes on one last job to avenge an injustice with the help of his old partner and a young would-be gunman calling himself ""The Schofield Kid"".",1992-08-07,Drama Western,R,130,101167799,58000000.0,159167799,15018007.0,Warner Bros.
The Hand That Rocks the Cradle (1992),"After her sex offender husband gets caught in the act and kills himself, an embittered pregnant widow loses her child, and embarks on a mission of vengeance against one of her husband's victims and the woman's family.",1992-01-10,Drama Thriller,R,110,88036683,76.0,88036759,7675016.0,Walt Disney Studios Motion Pictures
Under Siege (1992),"Ex US Navy Seal turned cook, Casey Ryback, is the only person who can stop a group of terrorists when they seize control of the US battleship The Missouri to obtain it's nuclear warheads.",1992-10-09,Action Thriller,R,103,83563139,73000000.0,156563139,15760003.0,Warner Bros.
Patriot Games (1992),"When CIA analyst Jack Ryan interferes with an IRA assassination, a renegade faction targets him and his family for revenge.",1992-06-05,Action Thriller,R,117,83351587,94700000.0,178051587,18511191.0,Paramount Pictures
Dracula (1992),Centuries old vampire Count Dracula comes to England to seduce his barrister Jonathan Harker's fiancée Mina Murray and wreak havoc in the foreign land.,1992-11-13,Fantasy Horror Romance,R,128,82522790,133339902.0,215862692,30521679.0,Columbia Pictures
White Men Can't Jump (1992),"Two basketball hustlers, black Sidney Deane and white Billy Hoyle, join forces to double their chances of winning money on the street courts as well as in a tournament.",1992-03-27,Comedy Sport,R,115,76253806,14500000.0,90753806,14711124.0,Twentieth Century Fox
The Last of the Mohicans (1992),Three Mohican trappers agree to protect the daughters of a British Colonel in the midst of the French and Indian War.,1992-09-25,Action Adventure Drama Romance War,R,112,75505856,,75506530,10976661.0,Twentieth Century Fox
Boomerang (1992),A successful executive and womanizer finds his lifestyle choices have turned back on him when his new female boss turns out to be an even bigger deviant than he is.,1992-07-01,Comedy Drama Romance,R,117,70052444,61000000.0,131052444,13640706.0,Paramount Pictures
Scent of a Woman (1992),"A prep school student needing money agrees to ""babysit"" a blind man, but the job is not at all what he anticipated.",1992-12-23,Drama,R,156,63095253,71000000.0,134095253,357468.0,Universal Pictures
The Crying Game (1992),"A British soldier kidnapped by the IRA soon befriends one of his captors, who then becomes drawn into the soldier's world.",1992-11-27,Crime Drama Romance Thriller,R,112,62548947,139.0,62549086,101107.0,Miramax
Far and Away (1992),"A young Irish couple flee to the States, but subsequently struggle to obtain land and prosper freely.",1992-05-22,Adventure Drama Romance Western,PG-13,140,58883840,78900000.0,137783840,10194520.0,Universal Pictures
"Honey, I Blew Up the Kid (1992)","The Szalinski family is back, this time hilarious disaster strikes when an experiment causes their new toddler son to grow many stories tall.",1992-07-17,Adventure Comedy Family Romance Sci-Fi,PG,89,58662452,,58662452,11083318.0,Walt Disney Studios Motion Pictures
HouseSitter (1992),"Con artist Gwen moves into Newton's empty home without his knowledge and begins setting up house, posing as his new wife.",1992-06-12,Comedy Romance,PG,102,58500635,36400000.0,94900635,9106950.0,Universal Pictures
Death Becomes Her (1992),"When a fading actress learns of an immortality treatment, she sees it as a way to outdo her long-time rival.",1992-07-31,Comedy Fantasy Horror,PG-13,104,58422650,90600000.0,149022650,12110355.0,Universal Pictures
Unlawful Entry (1992),A burglar holds a knife to Karen's throat while her husband does nothing. The couple ends up befriending the cop that comes. The friendship ends when the cop beats up the culprit. Karen isn't ready to end it. Things get ugly with the cop.,1992-06-26,Crime Drama Thriller,R,111,57138719,,57138719,10067609.0,Twentieth Century Fox
Beethoven (1992),"A slobbering St. Bernard becomes the center of attention for George and Alice Newton's loving family, who must contend with dog-napping local veterinarian Dr. Herman Varnick and his henchmen Harvey and Vernon.",1992-04-03,Comedy Drama Family,,87,57114049,90100000.0,147214049,7587565.0,Universal Pictures
Forever Young (1992),"During a cryogenics test, a pilot frozen in 1939 awakes in 1992 but time is running out, as his body starts to age rapidly.",1992-12-18,Drama Romance Sci-Fi,PG,102,55956187,72000000.0,127956187,5609875.0,Warner Bros.
Alien³ (1992),"Returning from LV-426, Ellen Ripley crash-lands on the maximum-security prison Fiorina 161, where she discovers that she has unwittingly brought along an unwelcome visitor.",1992-05-22,Action Horror Sci-Fi,R,114,55473545,104340953.0,159814498,19449867.0,Twentieth Century Fox
My Cousin Vinny (1992),"Two New Yorkers accused of murder in rural Alabama while on their way back to college call in the help of one of their cousins, a loudmouth lawyer with no trial experience.",1992-03-13,Comedy Crime,R,120,52929168,11159384.0,64088552,7416751.0,Twentieth Century Fox
Sneakers (1992),A security pro finds his past returning to haunt him when he and his unique team are tasked with retrieving a particularly important item.,1992-09-11,Comedy Crime Drama Mystery Thriller,PG-13,126,51432691,53800000.0,105232691,10031145.0,Universal Pictures
The Mighty Ducks (1992),A self-centered Minnesota lawyer is sentenced to community service coaching a rag tag youth hockey team.,1992-10-02,Comedy Drama Family Sport,PG,104,50752337,,50755845,6035133.0,Walt Disney Studios Motion Pictures
Wayne's World 2 (1993),The inseparable duo try to organize a rock concert while Wayne must fend off a record producer who has an eye for his girlfriend.,1992-03-07,Comedy Music,PG-13,95,48197805,214.0,48198019,13516699.0,Paramount Pictures
Malcolm X (1992),"Biographical epic of the controversial and influential Black Nationalist leader, from his early life and career as a small-time gangster, to his ministry as a member of the Nation of Islam and his eventual assassination.",1992-11-20,Biography Drama History,PG-13,202,48169910,,48169910,9871125.0,Warner Bros.
Single White Female (1992),A woman advertising for a new roommate finds that something very strange is going on with the tenant who decides to move in.,1992-08-14,Drama Thriller,R,107,48017402,,48017402,10212401.0,Columbia Pictures
The Distinguished Gentleman (1992),"A conman discovers during a ""job"" that US Congress is where the money is. ""Name recognition"" gets him elected. Will he develop a conscience?",1992-12-04,Comedy Crime,R,112,46666502,,46666502,10611040.0,Walt Disney Studios Motion Pictures
Medicine Man (1992),"In the beautiful and dangerous Amazon rainforest, dissimilar people must make their choices between business, science, and love.",1992-02-07,Adventure Drama Romance,,106,45500797,,45500797,8494271.0,Walt Disney Studios Motion Pictures
Passenger 57 (1992),"Airline security specialist John Cutter, finally returning to the job after his wife's death, finds himself in the middle of a hijacking by terrorists led by notorious international criminal Charles Rane.",1992-11-06,Action Crime Thriller,R,84,44065653,,44065653,10513925.0,Warner Bros.
A River Runs Through It (1992),"Two sons of a stern minister - one reserved, one rebellious - grow up in rural 1920s Montana while devoted to fly fishing.",1992-10-09,Drama,PG,123,43440294,,43440294,298277.0,Columbia Pictures
Encino Man (1992),"When they find a frozen caveman in their back yard, two high school outcasts thaw him and introduce him to modern life while he in turn gets them to actually enjoy life.",1992-05-22,Comedy,PG,88,40693477,,40693477,9866120.0,Walt Disney Studios Motion Pictures
Mo' Money (1992),"A con man, seeking to gain the affections of a woman he saw entering an office building, aquires a job in the same building working for an executive who has plans to use his skills for more than just the workplace.",1992-07-24,Action Comedy Crime Romance Thriller,R,89,40227006,,40227006,12385415.0,Columbia Pictures
Universal Soldier (1992),Soldiers who were killed in action are brought back to life in a top secret military experiment that creates superhuman warriors.,1992-07-10,Action Sci-Fi,R,102,36299898,,36299898,10057084.0,TriStar Pictures
Honeymoon in Vegas (1992),"Jack loses $65,000 in poker in Las Vegas, where he's marrying Betsy. The wedding will have to wait as the poker winner wants the weekend with Betsy to cancel the debt. She accepts. Whom will she marry?",1992-08-28,Comedy Romance Thriller,PG-13,96,35208854,,35208854,7318157.0,Columbia Pictures
The Lawnmower Man (1992),A simple man is turned into a genius through the application of computer science.,1992-03-06,Horror Sci-Fi,R,108,32100816,,32100816,7751971.0,New Line Cinema
Sleepwalkers (1992),A mother-and-son team of strange supernatural creatures move to a small town to seek out a young virgin to feed on.,1992-04-10,Fantasy Horror,R,91,30524763,,30524763,10017354.0,Columbia Pictures
The Muppet Christmas Carol (1992),"The Muppets put their spin on the tale of an elder, Christmas-hating miser who is visited by spirits who foretell his future and share secrets from his past and present, which helps change his view on life.",1992-12-11,Comedy Drama Family Fantasy Musical,,85,27381507,5892522.0,33274029,5010109.0,Walt Disney Studios Motion Pictures
3 Ninjas (1992),"Each year, three brothers visit their grandfather for the summer. He is highly skilled in ninjutsu, and for years he has trained the boys in his techniques.",1992-08-07,Action Comedy Family Sport,PG,84,29000301,,29000301,5888920.0,Walt Disney Studios Motion Pictures
Final Analysis (1992),"A psychiatrist becomes romantically involved with the sister of one of his patients, but the influence of her controlling gangster husband threatens to destroy them both.",1992-02-07,Drama Thriller,R,124,28590665,,28590665,6411441.0,Warner Bros.
Stop! Or My Mom Will Shoot (1992),A tough police sergeant's overbearing mother comes to visit him and begins to meddle in his life and career.,1992-02-21,Action Comedy,PG-13,87,28411210,42200000.0,70611210,7058590.0,Universal Pictures
Howards End (1992),"Set in the early 20th century, class distinctions and troubled relations affect the relationship between two families and the ownership of a cherished British estate known as Howards End.",1992-03-13,Drama Romance,PG,142,26126837,348226.0,26476514,52568.0,Sony Pictures Classics
Candyman (1992),"The Candyman, a murderous soul with a hook for a hand, is accidentally summoned to reality by a skeptic grad student researching the monster's myth.",1992-10-16,Horror Thriller,R,99,25792310,3587.0,25795897,5404320.0,TriStar Pictures
The Cutting Edge (1992),A temperamental figure skater and an arrogant former hockey player attempt to win the Olympic Gold Medal as a figure skating pairs team.,1992-03-27,Comedy Drama Romance Sport,,101,25105517,,25105517,4478919.0,Metro-Goldwyn-Mayer (MGM)
FernGully: The Last Rainforest (1992),"The magical inhabitants of a rainforest fight to save their home, which is threatened by logging and a polluting force of destruction called Hexxus.",1992-04-10,Adventure Animation Family Fantasy Musical,,76,24650296,8060598.0,32710894,3549338.0,Twentieth Century Fox
Hoffa (1992),"The story of the notorious American labor union figure Jimmy Hoffa, who organizes a bitter strike, makes deals with members of the organized crime syndicate and mysteriously disappears in 1975.",1992-12-25,Biography Crime Drama,R,140,24276506,5025615.0,29302121,6406012.0,Twentieth Century Fox
Leap of Faith (1992),Fake faith healer Jonas Nightingale is stranded in a small town where he finds he can't fool all of the people all of the time.,1992-12-18,Comedy Drama Romance,PG-13,108,23369283,,23369283,3222768.0,Paramount Pictures
Toys (1992),"When Lieutenant General Leland Zevo (Sir Michael Gambon) inherits a toymaking company and begins making war toys, his employees band together to stop him before he ruins the name of Zevo Toys forever.",1992-12-18,Adventure Comedy Drama Family Fantasy,PG-13,118,23278931,,23278931,4810027.0,Twentieth Century Fox
Thunderheart (1992),A young mixed-blood FBI agent is assigned to work with a cynical veteran investigator on a murder on a poverty-stricken Sioux reservation.,1992-04-03,Crime Mystery Thriller,R,119,22660758,89.0,22660847,4507425.0,TriStar Pictures
Captain Ron (1992),"A Chicagoan inherits an old yacht. He, his wife, daughter and son fly to a Caribbean island and hire a dubious Captain Ron to sail them on an adventure to Miami.",1992-09-18,Adventure Comedy,PG-13,100,22518097,,22518097,4893112.0,Walt Disney Studios Motion Pictures
The Player (1992),A hotshot Hollywood studio executive starts receiving death threats from a rejected writer.,1992-04-10,Comedy Crime Drama Thriller,R,124,21706101,,21706547,302216.0,New Line Cinema
Shining Through (1992),An American woman of Irish and Jewish-German parentage goes undercover in Nazi Germany.,1992-01-31,Drama Romance Thriller War,R,132,21633781,22204457.0,43838238,6406829.0,Twentieth Century Fox
Consenting Adults (1992),"During a joint dinner at the restaurant, the neighbors offer to exchange wives for one night. It was a joke, but only at first.",1992-10-16,Crime Drama Mystery Thriller,R,99,21591728,,21591728,5023467.0,Walt Disney Studios Motion Pictures
Raising Cain (1992),"The oncologist wife of a prominent child psychologist suspects her husband has an unhealthy scientific obsession with their child, unaware of what - or who - is really going on inside his head.",1992-08-07,Crime Drama Horror Thriller,R,92,21370057,15800000.0,37170057,6203835.0,Universal Pictures
Straight Talk (1992),"A woman ditches her small-town life for big-city Chicago, where she becomes a sensation as a radio-show host.",1992-04-03,Comedy Drama Romance,PG,91,21202099,,21202099,4575746.0,Walt Disney Studios Motion Pictures
Kuffs (1992),"George Kuffs, 21, leaves a pregnant girlfriend. He visits his brother Brad to bum money off him. Brad's shot and George IDs the killer at SFPD but to no avail. He inherits Brad's patrol district. He keeps it to get the killer.",1992-01-10,Action Comedy Crime,,102,21142815,,21142815,5651055.0,Universal Pictures
Mr. Baseball (1992),"Jack Elliot, once a great baseball player, is forced to play in Japan where his brash, egotistical ways cause friction with his new teammates and friends.",1992-10-02,Comedy Romance Sport,PG-13,108,20883046,,20883046,5240375.0,Universal Pictures
Juice (1992),"Four inner-city teenagers get caught up in the pursuit of power and happiness, which they refer to as ""the juice"".",1992-01-17,Action Crime Drama Thriller,R,95,20146880,345.0,20147225,8085915.0,Paramount Pictures
Prelude to a Kiss (1992),"A couple fall in love despite the girl's pessimistic outlook. As they struggle to come to terms with their relationship, something supernatural happens that tests it.",1992-07-10,Comedy Fantasy Romance,PG-13,105,20006730,2690961.0,22697691,5273395.0,Twentieth Century Fox
Hero (1992),A small-time criminal rescues passengers from a crashed airliner only to see another man take credit.,1992-10-02,Comedy Drama Romance,PG-13,119,19507345,,19507345,5210875.0,Columbia Pictures
Pinocchio (1940),"A living puppet, with the help of a cricket as his conscience, must prove himself worthy to become a real boy.",1940-02-09,Adventure Animation Comedy Family Fantasy Musical,G,88,84254167,37637878.0,121892045,,Walt Disney Studios Motion Pictures
Singles (1992),"A group of young adults in their twenties, who share an apartment in the city of Seattle, ponder on love and face all the challenges of adulthood.",1992-09-18,Comedy Drama Music Romance,PG-13,99,18471850,,18471850,4184875.0,Warner Bros.
Used People (1992),"At her husband's funeral, a Jewish mother encounters her late husband's Italian friend who secretly loved her. He had previously advised her husband against leaving home, causing tension between her and her two divorced daughters.",1992-12-18,Comedy Drama Romance,PG-13,115,17957265,,17957265,51955.0,Twentieth Century Fox
The Babe (1992),Babe Ruth becomes a baseball legend but is unheroic to those who know him.,1992-04-17,Biography Drama Sport,PG,115,17530973,2400000.0,19930973,5011205.0,Universal Pictures
Freejack (1992),"Bounty hunters from the future transport a doomed race car driver to New York City in 2009, where his mind will be replaced with that of a dead billionaire.",1992-01-17,Action Crime Sci-Fi Thriller,R,110,17129026,,17129026,6736243.0,Warner Bros.
Pet Sematary II (1992),"A teenage boy and his father move to his recently-deceased mother's hometown, where they encounter the ancient Native American cemetery with the power to raise the dead.",1992-08-28,Fantasy Horror Thriller,R,100,17092453,,17092453,4825100.0,Paramount Pictures
Deep Cover (1992),A uniformed police officer is recruited by the DEA to infiltrate a drug smuggling ring looking to expand its operation.,1992-04-17,Action Crime Thriller,R,107,16639799,,16639799,3451356.0,New Line Cinema
Buffy the Vampire Slayer (1992),Flighty teenage girl Buffy Summers learns that she is her generation's destined battler of vampires.,1992-07-31,Action Comedy Fantasy Horror,PG-13,86,16624456,,16625256,4515541.0,Twentieth Century Fox
Pure Country (1992),"Dusty gets tired of all the smoke and light effects, wonders what happened to doing it the way that made him famous and happy. Takes a walk to find what seems to be missing and finds himself and his music again.",1992-10-23,Drama Music Romance Western,PG,112,15164458,,15164458,2739680.0,Warner Bros.
Ladybugs (1992),"To climb the corporate ladder to success, a guy agrees to coach the company's all-girls soccer team with the help of his secret weapon: his fiancee's son.",1992-03-27,Comedy Sport,PG-13,90,14796494,,14796494,5180414.0,Paramount Pictures
School Ties (1992),"In 1955, a star quarterback from a working-class family is given an opportunity to attend an elite New England preparatory school, but he is conflicted about whether or not to tell his Protestant classmates that he is Jewish.",1992-09-18,Drama,PG-13,106,14715067,,14715067,3020071.0,Paramount Pictures
City of Joy (1992),"An American doctor, a British nurse, and an illiterate Indian farmer unite to transform a Calcutta ghetto in this uplifting, inspirational movie starring Patrick Swayze and Pauline Collins.",1992-04-17,Crime Drama,PG-13,132,14683921,,14683921,3405890.0,TriStar Pictures
Memoirs of an Invisible Man (1992),"After a freak accident, a company executive turns completely invisible, goes on the run, and becomes hunted by a treacherous CIA official while trying to cope with his new reality.",1992-02-28,Comedy Romance Sci-Fi Thriller,,99,14358033,,14358033,4601954.0,Warner Bros.
Rapid Fire (1992),"When student Jake Lo witnesses a killing, he finds himself caught between two feuding drug lords. Betrayed and set up by the federal agents, the only person he can trust is Ryan, a Chicago cop who reminds Jake of his deceased father.",1992-08-21,Action Crime Drama Thriller,R,95,14356479,,14356479,4815850.0,Twentieth Century Fox
Cool World (1992),"When Jack Deebs was behind bars he found escape by creating Cool World, a cartoon series featuring a vixen named Holli Would. However, the flesh proves weaker than ink as Holli takes human form in Las Vegas.",1992-07-10,Animation Comedy Fantasy,PG-13,102,14110589,,14110589,5556451.0,Paramount Pictures
Mr. Saturday Night (1992),"The life of Buddy Young, a comic legend in flashbacks but an old man looking for work in the present.",1992-09-25,Comedy Drama,R,119,13351357,,13351357,4514027.0,Columbia Pictures
The Great Mouse Detective (1986),"Basil, the rodent Sherlock Holmes, investigates the kidnapping of a toy maker and uncovers its link to his archenemy, Professor Ratigan.",1986-07-04,Adventure Animation Family Musical Mystery,,74,38625550,,38625550,3220225.0,Walt Disney Studios Motion Pictures
Class Act (1992),A valedictorian and a juvenile delinquent have their school records switched and begin to be treated like the other.,1992-06-05,Comedy,PG-13,98,13272113,,13272113,3421827.0,Warner Bros.
Trespass (1992),"Two firemen in a burning building get a treasure map - stolen gold church items are hidden in a closed down factory in St. Louis. Once there, they're trapped in by a black gang considering it their territory.",1992-12-25,Action Thriller,R,101,13249535,,13249535,5012910.0,Universal Pictures
Enchanted April (1991),"Four English women, after World War I, who are unhappy with their lives, and their time away on vacation in a beautiful Italian villa.",1992-07-31,Drama,PG,95,13200170,,13200170,73041.0,Miramax
American Me (1992),"A Mexican-American Mafia kingpin is released from prison, falls in love for the first time, and grows introspective about his gangster lifestyle.",1992-03-13,Biography Crime Drama Romance,R,125,13086430,,13086430,3378100.0,Universal Pictures
Hellraiser III: Hell on Earth (1992),An investigative reporter must send the newly unbound Pinhead and his legions back to Hell.,1992-09-11,Horror,R,97,12534961,,12534961,3208009.0,Miramax
A Stranger Among Us (1992),"Emily, a tough NYPD cop, is sent to an orthodox Jewish community to investigate a missing person plus $720,000 in missing diamonds. To solve what becomes a murder case, she has to join the community.",1992-07-17,Crime Drama Mystery Romance,PG-13,110,12282994,,12282994,2886082.0,Walt Disney Studios Motion Pictures
Rock-A-Doodle (1991),"In order to defeat the wicked Grand Duke of Owls, a young boy, transformed into a cat, teams up with a group of barnyard animals to find the rooster who can raise the sun.",1992-04-03,Adventure Animation Comedy Family Music Musical,,74,11657385,,11657385,2603286.0,The Samuel Goldwyn Company
Jennifer 8 (1992),A policeman fears a blind woman is a killer's next target.,1992-11-06,Crime Drama Mystery Thriller,R,124,11390479,,11390479,3619666.0,Paramount Pictures
Whispers in the Dark (1992),"Eve tells her shrink, Ann, about kinky sex with a man. Ann learns that it's the same man, she's been seeing lately. Eve finds out and explodes. A murder follows.",1992-08-07,Drama Mystery Thriller,R,103,11124511,,11124511,3177158.0,Paramount Pictures
Stay Tuned (1992),A husband and wife are sucked into a hellish television set and must survive the gauntlet of twisted versions of shows in which they find themselves.,1992-08-14,Adventure Comedy Fantasy,PG,88,10736401,,10736401,3532540.0,Warner Bros.
Glengarry Glen Ross (1992),An examination of the machinations behind the scenes at a real estate office.,1992-10-02,Crime Drama Mystery,R,100,10725228,,10726612,2104402.0,New Line Cinema
