movie_title,movie_summary,release_date,genres,indicative_rating,running_time,domestic_gross,international_gross,total_gross,domestic_opening,domestic_distributor
Jonas Brothers: The 3D Concert Experience (2009),"A 3-D concert film of the 2008 Jonas Brothers ""Burning Up"" concert tour, as well as documentary footage on the lives of the three brothers.",2009-02-27,Biography Documentary Music,,76,19162740.0,4024220.0,23186960,12510374.0,Walt Disney Studios Motion Pictures
Imagine That (2009),"A financial executive who can't stop his career downspiral is invited into his daughter's imaginary world, where solutions to his problems await.",2009-06-12,Comedy Drama Family Fantasy,PG,107,16123323.0,6861871.0,22985194,5503519.0,Paramount Pictures
Armored (2009),"A newbie guard for an armored truck company is coerced by his veteran coworkers to steal a truck containing $42 million. But a wrinkle in their supposedly foolproof plan divides the group, leading to a potentially deadly resolution.",2009-10-02,Action Crime Mystery Thriller,PG-13,88,15988876.0,6953345.0,22942221,6511128.0,Screen Gems
A Perfect Getaway (2009),Two pairs of lovers on a Hawaiian vacation discover that psychopaths are stalking and murdering tourists on the islands.,2009-08-06,Drama Mystery Thriller,R,98,15515460.0,7440084.0,22955544,5948555.0,Universal Pictures
Dorian Gray (2009),"A corrupt young man somehow keeps his youthful beauty eternally, but a special painting gradually reveals his inner ugliness to all.",2009-09-11,Drama Fantasy Mystery Thriller,R,112,,22873653.0,22873653,,
Men in the City (2009),"The story follows six very different men and their struggles with women, family and work. Yet, they are somehow connected to each other.",2009-10-08,Comedy,,107,,22420615.0,22420615,,
Neuilly Yo Mama! (2009),Samy moves from the underdeveloped crime-ridden French suburb to the riches of Neuilly.,2009-08-12,Comedy,,90,,22243482.0,22243482,,
OSS 117: Lost in Rio (2009),Another mission of world-known French secret agent leads him to exotic Brazil.,2009-04-15,Action Adventure Comedy,,101,89375.0,21834870.0,21924245,10243.0,Music Box Films
The Rebound (2009),"In New York City, a single mom captivates her new neighbor, a much younger man.",2009-09-16,Comedy Romance,R,95,,21791288.0,21791288,,
My Girlfriend Is an Agent (2009),"Due to her continual lying, a man breaks up with his girlfriend, unaware that she is a secret agent. A few years later, they meet again without knowing that this time they both have secrets.",2009-04-22,Action Comedy Romance,,112,,21056256.0,21056256,,
Black Lightning (2009),"A Moscow college student's gift car from his parents turns out to be more than anyone expects when it flies, which he uses to become both a city guardian and a speedy floral delivery boy.",2009-12-31,Action Sci-Fi Thriller,,102,,20984902.0,20984902,,
Love Aaj Kal (2009),An old-fashioned romantic tells his personal love story to a modern man who has just broken up with his girlfriend. Has love really ever changed?,2009-07-30,Comedy Drama Romance,,128,2430083.0,18364902.0,20794985,1241762.0,Eros Worldwide
I Love You Phillip Morris (2009),"A cop turns con man once he comes out of the closet. Once imprisoned, he meets the second love of his life, whom he'll stop at nothing to be with.",2009-11-20,Biography Comedy Crime Drama Romance,R,102,2037459.0,18731447.0,20768906,112520.0,Roadside Attractions
Pandemic (2009),"Tsuyoshi Matsuoka, a doctor at a Tokyo hospital, misdiagnoses a patient's disease as a common cold. But after the patient's sudden death, he realizes that it's very serious disease, which can make a population extinct, so he struggles to find out the cause of the disease with doctor Eiko Kobayashi.",2009-01-17,Drama Sci-Fi Thriller,,138,,20712567.0,20712567,,
Pandorum (2009),"Two crew members of a spaceship wake up from hypersleep to discover that all their colleagues are missing. Despite this, it appears that they are not alone.",2009-09-11,Action Horror Mystery Sci-Fi Thriller,R,108,10330853.0,10317475.0,20648328,4424126.0,Overture Films
My Life in Ruins (2009),A disgruntled tour guide in Greece gains an unexpected new outlook on life thanks to one of the people on what she intends to be her last tour.,2009-05-27,Comedy Romance,PG-13,98,8665206.0,11793667.0,20458873,3223161.0,Fox Searchlight Pictures
Cado dalle nubi (2009),"A Southern Italian singer moves to Milan to have more chances with his career, bringing a little bit of the South with him.",2009-11-27,Comedy,,95,,20123466.0,20123466,,
Solomon Kane (2009),"A ruthless mercenary renounces violence after learning his soul is bound for hell. When a young girl is kidnapped and her family slain by a sorcerer's murderous cult, he is forced to fight and seek his redemption slaying evil.",2009-12-23,Action Adventure Fantasy Horror,R,104,,19652185.0,19652185,,
Amelia (2009),"A look at the life of legendary American pilot Amelia Earhart, who disappeared while flying over the Pacific Ocean in 1937 in an attempt to make a flight around the world.",2009-10-23,Adventure Biography Drama Romance,PG,111,14246488.0,5396598.0,19643086,3904047.0,Fox Searchlight Pictures
Drop (2009),"After dropping out of private school, Hiroshi enrolls at a public school and falls in with a pack of unruly thugs. He loves the reckless partying, smoking and boozing - but can he hang when a rivalry with a biker gang leads to countless bloody brawls?",2009-03-20,Comedy,,122,,19611028.0,19611028,,
High Security Vacation (2009),"Two prisoners, who have escaped from prison, hate each other. But subsequent circumstances make them reunite and deal with all the problems: from kids to gangsters.",2009-08-25,Adventure Comedy,,113,,19487557.0,19487557,,
Kamen Rider Decade: All Riders vs. Dai-Shocker (2009),"Nobuhiko Tsukikage, the caretaker of Tsukasa's sister, warns him that Dai Shocker plans to invade the Earth. He suggests that he should battle all of the Riders to see which one is the stronger to battle against the evil organization.",2009-08-08,Action Adventure Fantasy,,79,,19418091.0,19418091,,
The White Ribbon (2009),"Strange events happen in a small village in the north of Germany during the years before World War I, which seem to be ritual punishment. Who is responsible?",2009-09-24,Drama Mystery Thriller,R,144,2222862.0,17130726.0,19353588,59848.0,Sony Pictures Classics
Ballad (2009),A movie examining a young boy's first encounter with true fear in his endless pursuit of courage.,2009-09-05,Action Drama Romance,,127,,19380161.0,19380161,,
Cell 211 (2009),"The story of two men on different sides of a prison riot -- the inmate leading the rebellion and the young guard trapped in the revolt, who poses as a prisoner in a desperate attempt to survive the ordeal.",2009-11-06,Action Crime Drama Thriller,,113,,19305314.0,19305314,,
Taras Bulba (2009),"Set in the 16th century, this is a story about Ukraine's Cossack warriors and their campaign to defend their lands from the advancing Polish armies.",2009-04-02,Action Drama History War,,131,,18888220.0,18888220,,
