movie_title,movie_summary,release_date,genres,indicative_rating,running_time,domestic_gross,international_gross,total_gross,domestic_opening,domestic_distributor
Interstellar (2014),"When Earth becomes uninhabitable in the future, a farmer and ex-NASA pilot, Joseph Cooper, is tasked to pilot a spacecraft, along with a team of researchers, to find a new planet for humans.",2014-11-05,Adventure Drama Sci-Fi,PG-13,169,203227580.0,555462650.0,758690230,47510360.0,Paramount Pictures
Last Mile (2024),"A cardboard box explodes on Black Friday, terrorizing the nation. Erena Funado, center director for Kanto distribution warehouse, must control the situation with Kou Nashimoto.",2024-08-23,Drama,,128,,37475443.0,37475443,,
Beating Hearts (2024),"Local rebellious teenager Clotaire falls for his schoolmate Jackie, but gang violence leads him to a darker destructive path. After years apart, the star-crossed lovers discover that every path they've taken leads them back together.",2024-10-16,Crime Drama Romance,,166,,36258323.0,36258323,,
The Bikeriders (2023),"After a chance encounter, headstrong Kathy is drawn to Benny, member of Midwestern motorcycle club the Vandals. As the club transforms into a dangerous underworld of violence, Benny must choose between Kathy and his loyalty to the club.",2024-06-19,Crime Drama,R,116,21746895.0,14412249.0,36159144,9698275.0,Focus Features
I'm Still Here (2024),A woman married to a former politician during the military dictatorship in Brazil is forced to reinvent herself and chart a new course for her family after a violent and arbitrary act.,2024-11-07,Biography Drama History,PG-13,137,6233517.0,29896488.0,36130005,113706.0,Sony Pictures Classics
Mobile Suit Gundam SEED Freedom (2024),"Lacus Clyne becomes president of a peace monitoring organization, but things are not quite what they seem.",2024-03-14,Action Adventure Animation Drama Sci-Fi,,124,,36038764.0,36038764,,Fathom Events
Immaculate (2024),"Cecilia, a woman of devout faith, is warmly welcomed to the picture-perfect Italian countryside where she is offered a new role at an illustrious convent. But it becomes clear to Cecilia that her new home harbors dark and horrifying secrets.",2024-03-20,Horror Thriller,R,89,15671307.0,19668708.0,35340015,5338921.0,Neon
Monkey Man (2024),An anonymous young man unleashes a campaign of vengeance against the corrupt leaders who murdered his mother and continue to systematically victimize the poor and powerless.,2024-04-03,Action Crime Thriller,R,121,25116955.0,10154676.0,35271631,10119435.0,Universal Pictures
Harbin (2024),Follows Korean independence activists who launched a daring attack in Harbin against the Japanese to gain their country's independence.,2024-12-24,Action Biography Crime History Thriller,,108,951874.0,32517274.0,33469148,27923.0,Well Go USA Entertainment
Doraemon the Movie: Nobita's Earth Symphony (2024),"Doraemon and friends go on an adventure to meet new buddies, connect to people with music, and save the world from a crisis.",2024-01-08,Adventure Animation Comedy Drama Family Fantasy Music Sci-Fi,,115,,33399912.0,33399912,,
The Watchers (2024),"A young artist gets stranded in an extensive, immaculate forest in western Ireland, where, after finding shelter, she becomes trapped alongside three strangers, stalked by mysterious creatures each night.",2024-06-05,Fantasy Horror Mystery Thriller,PG-13,102,19071404.0,14300000.0,33371404,7003537.0,Warner Bros.
Borderlands (2024),"An infamous bounty hunter returns to her childhood home, the chaotic planet Pandora, and forms an unlikely alliance with a team of misfits to find the missing daughter of the most powerful man in the universe.",2024-08-07,Action Adventure Comedy Sci-Fi Thriller,PG-13,101,15482668.0,17534699.0,33017367,8601572.0,Lionsgate
Harold and the Purple Crayon (2024),"Inside of his book, adventurous Harold can make anything come to life simply by drawing it. After he grows up and draws himself off the book's pages and into the physical world, Harold finds he has a lot to learn about real life.",2024-08-01,Adventure Animation Comedy Family Fantasy,PG,90,17640924.0,14586931.0,32227855,6003197.0,Columbia Pictures
My Hero Academia: You're Next (2024),"Deku, Bakugo, Todoroki and the rest of U.A. High Class 1-A must face off against Dark Might and the obscure crime organisation under his control, the Gollini Family.",2024-08-02,Action Adventure Animation Sci-Fi,PG-13,110,5041781.0,27182835.0,32224616,3007027.0,Toho International
Pilot (2024),"A story about a pilot who suddenly loses his job, then unexpectedly gets rehired with a new identity.",2024-07-31,Comedy,,110,,30917972.0,30917972,,
A Strange House (2024),"Amemiya is an unpopular Youtuber who specializes in the occult. One day, his manager brings him a floor plan with an inscrutable point. With the help of Kurihara and Yuzuki, he begins to look into the plan and reveal the mystery behind.",2024-03-15,Mystery Thriller,,110,,30864331.0,30864331,,
Flow (2024),"Cat is a solitary animal, but as its home is devastated by a great flood, he finds refuge on a boat populated by various species, and will have to team up with them despite their differences.",2024-10-30,Adventure Animation Family Fantasy,PG,85,4844117.0,25986217.0,30830334,50811.0,Janus Films
Finist. The First Warrior (2025),"The mighty Finist, Belogorie's most celebrated warrior, ventures to distant Eastern territories on a perilous quest that challenges his solitary nature.",2024-12-26,Adventure Family Fantasy,,112,,30458079.0,30458079,,
Reagan (2024),"A drama based on the life of Ronald Reagan, from his childhood to his time in the oval office.",2024-08-30,Biography Drama History,PG-13,141,30047417.0,59756.0,30107173,7650720.0,Showbiz Direct
The Ministry of Ungentlemanly Warfare (2024),The British military recruits a small group of highly skilled soldiers to strike against German forces behind enemy lines during World War II.,2024-04-17,Action Comedy War,R,122,20535053.0,9233862.0,29768915,8913698.0,Lionsgate
The Dark Knight Rises (2012),"Bane, an imposing terrorist, attacks Gotham City and disrupts its eight-year-long period of peace. This forces Bruce Wayne to come out of hiding and don the cape and cowl of Batman again.",2012-07-19,Action Crime Drama Thriller,PG-13,164,448149584.0,666807044.0,1114976407,160887295.0,Warner Bros.
Chantal in Fairyland (2024),"Chantal will be involuntarily transported to a fairy tale world, fighting against witches and tyrant kings, but above all for her friendship with Zeynep.",2024-03-28,Comedy Fantasy,,118,,29663607.0,29663607,,
The Master and Margarita (2024),"A writer's novel is banned and play canceled. He then conceives a satirical novel where a devil-like character metaphorically revenges those responsible. Knowing it cannot be published, his muse Margarita pushes him to write it anyway.",2024-01-25,Drama Fantasy Horror Romance Thriller,,156,,29032417.0,29032417,,
Wicked Little Letters (2023),"When people in Littlehampton--including conservative local, Edith--begin receiving letters full of hilarious profanities, the rowdy, Irish migrant, Rose, is charged with the crime. Suspecting that something is amiss, the town's women investigate.",2024-02-23,Comedy Crime Drama History Mystery,R,100,5008179.0,22211550.0,27219729,76654.0,Sony Pictures Releasing
Juror #2 (2024),"While serving as a juror in a high-profile murder trial, a family man finds himself struggling with a serious moral dilemma, one he could use to sway the jury verdict and potentially convict or free the wrong killer.",2024-10-30,Crime Drama Mystery Thriller,PG-13,114,,27000000.0,27000000,,Warner Bros.
The Marching Band (2024),"Acclaimed conductor Thibaut has leukemia and needs a bone marrow donor. Learning he was adopted, he finds an older brother, a musician and factory worker. Their reunion sparks a fraternal, musical journey amidst the town's factory closure.",2024-11-27,Comedy Drama Music,,103,,26146934.0,26146934,,
Grand Maison Paris (2024),"Famous Japanese chef Obana opens a restaurant in Paris, seeking third Michelin star. Faces challenges as outsider, sourcing ingredients. Tensions rise with staff over ambitious menu.",2024-12-30,Drama,,111,,25407878.0,25407878,,
School of Magical Animals 3 (2024),"Children with magical animal companions at Winterstein School experience adventures spanning a forest and fashion show, encountering a snobbish cat and vegan crocodile while navigating friendship and first love.",2024-09-26,Action Adventure Family Fantasy Musical,,105,,25272566.0,25272566,,
Maria (2024),"Maria Callas, the world's greatest opera singer, lives the last days of her life in 1970s Paris, as she confronts her identity.",2024-11-28,Biography Drama Music,R,124,,25271420.0,25271420,,
The Firefighters (2024),"After drastic tragedies and changes, firefighters must see themselves helping out the entire world each day, even though in personal life and in work, going against all odds.",2024-12-04,Action Drama,,106,,25032994.0,25032994,,
A Real Pain (2024),"Mismatched cousins reunite for a tour through Poland to honor their beloved grandmother, but their old tensions resurface against the backdrop of their family history.",2024-11-01,Comedy Drama,R,90,8344978.0,16511049.0,24856027,228856.0,Searchlight Pictures
Lee (2023),"War correspondent Lee Miller travels to the front lines of World War II to embark on a mission to uncover the hidden truths of the Third Reich. But in the wake of betrayal, a reckoning will come over the truths of her own past.",2024-09-12,Biography Drama History War,R,117,2005488.0,22606985.0,24612473,713255.0,Roadside Attractions
Crayon Shin-chan: Our Dinosaur Diary (2024),"After a theme park that revives extinct dinosaurs is opened in Tokyo, Shinnosuke's pet dog, Shiro, crosses paths with a small dinosaur. The two befriend each other, but their friendship might affect the existence of the park.",2024-08-09,Adventure Animation Comedy Drama Family,,106,,24444687.0,24444687,,
The Crow (2024),"Soulmates Eric and Shelly are brutally murdered. Given a chance to save the love of his life, Eric must sacrifice himself and traverse the worlds of the living and the dead, seeking revenge.",2024-08-21,Action Crime Fantasy Horror Romance Thriller,R,111,9275659.0,14833377.0,24109036,4644666.0,Lionsgate
"Hello, Love, Again (2024)","After fighting for their love to conquer the time, distance and a global shutdown that kept them apart, Joy and Ethan meet again in Canada but realize that they have also changed a lot, individually.",2024-11-13,Drama Romance,,122,2625000.0,20256613.0,22881613,2326000.0,
Better Man (2024),"A singular profile of pop superstar Robbie Williams, chronicling his meteoric rise, dramatic fall, and remarkable resurgence.",2024-01-26,Biography Fantasy Music Musical,R,135,1983648.0,20558553.0,22542201,18259.0,Paramount Pictures International
Nintama Rantaro Dokutake Ninja-tai Saikyou no Gunshi (2024),,2024-12-20,Action Adventure Animation Comedy Family,,90,,22182456.0,22182456,,
MaXXXine (2024),"In 1980s Hollywood, adult film star and aspiring actress Maxine Minx finally gets her big break. But as a mysterious killer stalks the starlets of Hollywood, a trail of blood threatens to reveal her sinister past.",2024-07-04,Crime Horror,R,103,15097632.0,6959528.0,22057160,6705038.0,A24
Autumn and the Black Jaguar (2024),"After years in New York City, 14-year-old Autumn returns to the Amazon rainforest to save her childhood village and beloved jaguar friend.",2024-02-01,Adventure Comedy Family,PG,100,546879.0,21488058.0,22034937,102006.0,Blue Fox Entertainment
Mai (2024),"Restlessly haunted by the past, Mai is greeted by a new dawn when she reluctantly befriends the neighborhood ladies' man. But when her yesterday catches up to her today, what will become of her tomorrow?",2024-02-10,Drama Romance,,131,,21714524.0,21714524,,
Attack on Titan the Movie: The Last Attack (2024),"The fate of the world hangs in the balance as Eren unleashes the ultimate power of the Titans. With a burning determination to eliminate all who threaten Eldia, he leads an unstoppable army of Colossal Titans towards Marley.",2024-11-08,Action Adventure Animation Drama,,145,2890192.0,18487556.0,21377748,170239.0,Sony Pictures Releasing
The Room Next Door (2024),"Ingrid and Martha were close friends in their youth, when they worked together at the same magazine. After years of being out of touch, they meet again in an extreme but strangely sweet situation.",2024-10-18,Drama,PG-13,107,2519488.0,18800000.0,21319488,105013.0,Sony Pictures Classics
Unsung Hero (2024),A mother's faith stands against all odds and inspires her husband and children to hold onto theirs. Based on a remarkable true story.,2024-04-26,Drama Family,PG,113,20335239.0,811116.0,21146355,7731539.0,Lionsgate
The Last Dance (2024),"A debt-ridden wedding planner inadvertently becomes a successful funeral planner, but he must convince a traditional Taoist priest of his legitimacy to continue operating in the field.",2024-11-09,Drama,,126,,20983374.0,20983374,,
Homestead (2024),"Amid chaos, ex-Green Beret joins prepper compound; love grows, truths arise, and a community unites.",2024-12-20,Action Drama Thriller,PG-13,112,20811864.0,3520.0,20815384,6000241.0,Angel (I)
The Lord of the Rings: The War of the Rohirrim (2024),"A sudden attack by Wulf, a clever and traitorous lord of Rohan seeking vengeance for the death of his father, forces Helm Hammerhand, the King of Rohan, and his people to make a daring last stand in the ancient stronghold of the Hornburg.",2024-12-05,Action Adventure Animation Drama Fantasy,PG-13,134,9158572.0,11600000.0,20758572,4552109.0,Warner Bros.
Lyod 3 (2024),"Aleksandr is a coach of the Irkutsk hockey club. He takes to the team Sergey, a talented player with a scandalous reputation. Aleksandr's daughter, Nadya, accidentally crosses paths with Sergey, they quickly fall in love. Nadya is preparing for the main competition in her life, the Ice Cup in Moscow, and Sergey is invited to the NHL in Canada. Aleksandr doesn't believe in the sincerity of feelings and insists on breaking off the relationship. Lovers face a choice: a great sports career in different countries or personal happiness?",2024-02-14,Drama Romance Sport,,134,,20615744.0,20615744,,
Cabrini (2024),"After witnessing disease and poverty in the slums of New York, Italian immigrant Francesca Cabrini embarks on a daring journey to persuade the hostile mayor to provide housing and healthcare for hundreds of orphaned children.",2024-03-07,Biography Drama,PG-13,142,19512134.0,1078068.0,20590202,7168520.0,Angel (I)
Ordinary Angels (2024),Inspired by the incredible true story of a hairdresser who single-handedly rallies an entire community to help a widowed father save the life of his critically ill young daughter.,2024-02-23,Biography Drama,PG,118,19174421.0,1397113.0,20571534,6163600.0,Lionsgate
Guest from the Future (2024),"Kolya Gerasimov is an ordinary guy: video games, rap and hanging out with friends. The last thing he worries about is the future. Until one day he himself enters the future. And not everything is easy there.",2024-04-10,Adventure Family Sci-Fi,,141,,20115888.0,20115888,,
"La planète des singes, une odyssée de l'espèce (2024)","This investigation, rich in archives and anecdotes, explains the reasons why the saga has become a central monument of popular culture worldwide. Among other things, the power of its message.",2024-05-08,Documentary,,53,,19515102.0,19515102,,
Star Wars: Episode I - The Phantom Menace (1999),"Two Jedi escape a hostile blockade to find allies and come across a young boy who may bring balance to the Force, but the long-dormant Sith resurface to claim their former glory.",1999-05-19,Action Adventure Fantasy Sci-Fi,PG,136,487576624.0,558938030.0,1046515409,64820970.0,Twentieth Century Fox
Face Off 7: One Wish (2024),"When a 73-year-old widow is forced to depend on the care of her 5 busy adult children after an injury, she begins to question the meaning of family love.",2024-04-24,Comedy Drama,,138,,19353760.0,19353760,,
Diamanti (2024),A director calls all his favourite actresses to film a movie set in Rome in the 70s that tells the vicissitudes revolving around a prestigious tailoring.,2024-12-19,Comedy Drama,,135,,19112831.0,19112831,,Outsider Films
Golden Kamuy (2024),"In the early 20th century in Hokkaido, Japan, a treasure hunt between various parties takes place for a hidden stash of gold.",2024-01-19,Action Adventure Drama History Western,,127,,19077748.0,19077748,,
Escape (2024),Follows the struggles of a North Korean sergeant who is chased by a ruthless major after he defects.,2024-07-03,Action Adventure Thriller,,94,259242.0,18197131.0,18456373,58833.0,Well Go USA Entertainment
Doctor X: The Movie (2024),"Michiko Daimon is a freelance surgeon who never fails. She does not appear or act like a typical surgeon, but she is highly skilled. The story of her mysterious and solitary background is soon revealed and she also faces the worst crises ever. How will Michiko respond?",2024-12-06,Comedy Drama Mystery,,128,,18353324.0,18353324,,
Cocorico (2024),"The daughter of the Bouvier-Sauvage family of aristocrats is in love with the son of a Peugeot dealer. When the children announce their marriage, the aristocratic family does not agree.",2024-02-07,Comedy,,92,,18338457.0,18338457,,
10 Lives (2024),"A pampered cat takes for granted the lucky hand he has been dealt after he is rescued and loved by Rose, a kind-hearted and passionate student. When he loses his ninth life, fate steps in to set him on a transformative journey.",2024-03-21,Animation Comedy Family Fantasy,,88,,17334341.0,17334341,,
The Apprentice (2024),"A young man took over his father's real-estate business in 1970s and '80s New York, and got the helping hand of an infamous closeted gay lawyer who helped him turn this young man into a notorious legend. Based on true events.",2024-10-09,Biography Drama History,R,122,4001904.0,13297250.0,17299154,1613233.0,Briarcliff Entertainment
Twilight of the Warriors: Walled In (2024),"Follows troubled youth Chan Lok-kwun as he accidentally enters the Walled City, discovers the order amidst its chaos, and learns important life lessons along the way.",2024-05-01,Action Crime Thriller,R,126,336023.0,16759750.0,17095773,145212.0,Well Go USA Entertainment
Never Let Go (2024),A family that has been haunted by an evil spirit for years. Their safety and their surroundings come into question when one of the children questions if the evil is real.,2024-09-18,Horror Thriller,R,101,10306106.0,6292087.0,16598193,4449065.0,Lionsgate
Kinds of Kindness (2024),"A man seeks to break free from his predetermined path, a cop questions his wife's demeanor after her return from a supposed drowning, and a woman searches for an extraordinary individual prophesied to become a renowned spiritual guide.",2024-06-06,Comedy Drama Horror,R,164,5038931.0,11359578.0,16398509,377289.0,Searchlight Pictures
Emilia Pérez (2024),"It follows three remarkable women in Mexico, each pursuing their own happiness. Cartel leader Emilia enlists unappreciated lawyer Rita to help fake her death so that she can finally live authentically as her true self.",2024-08-21,Crime Drama Musical Thriller,R,132,,16317120.0,16317120,,
Monsieur Aznavour (2024),"Follows the beginnings of the iconic French-Armenian singer, songwriter and actor, Charles Aznavour, from zero to fame.",2024-10-23,Biography Drama Music,,133,,16145120.0,16145120,,
Here (2024),"A generational story about families and the special place they inhabit, sharing in love, loss, laughter, and life.",2024-10-30,Drama,PG-13,104,12237270.0,3654486.0,15891756,4875195.0,Sony Pictures Releasing
Late Night with the Devil (2023),"A live television broadcast in 1977 goes horribly wrong, unleashing evil into the nation's living rooms.",2024-03-22,Horror,R,93,10001000.0,5468415.0,15469415,2834867.0,IFC Films
Kleks Academy (2023),Teenage girl Ada ends up in mysterious Kleks Academy where crossing to the world of fairy tales and reaching boundaries of imagination is possible. She also discovers a way to find out her most hidden family secret.,2024-01-05,Fantasy,,130,,15348026.0,15348026,,
Interstellar (2014),"When Earth becomes uninhabitable in the future, a farmer and ex-NASA pilot, Joseph Cooper, is tasked to pilot a spacecraft, along with a team of researchers, to find a new planet for humans.",2014-11-05,Adventure Drama Sci-Fi,PG-13,169,203227580.0,555462650.0,758690230,47510360.0,Paramount Pictures
The Day the Earth Blew Up: A Looney Tunes Movie (2024),Porky Pig and Daffy Duck are Earth's only hope when facing the threat of alien invasion.,2024-11-07,Adventure Animation Comedy Family Sci-Fi,PG,91,8875344.0,6259229.0,15134573,3158830.0,Ketchup Entertainment
Father There is Only One 4 (2024),,2024-07-19,Comedy Family,,90,,14668098.0,14668098,,
Hijack 1971 (2024),The movie depics the story of people fighting for their lives in an extreme situation when a passenger plane is hijacked in the airspace of Korea in 1971.,2024-01-08,Action Crime Thriller,R,100,242069.0,14361315.0,14603384,80787.0,Sony Pictures Releasing
Handsome Guys (2024),"Self-proclaimed tough guys 'Jae-pil' and 'Sang-gu' move into their dream European-style house. When unwanted visitors arrive, awakening an evil spirit hitherto sealed in the basement, a dark aura begins to envelop the house.",2024-06-26,Action Comedy Horror,,101,,14439610.0,14439610,,
Small Things Like These (2024),In 1985 devoted father Bill Furlong discovers disturbing secrets kept by the local convent and uncovers shocking truths of his own.,2024-11-01,Drama History,PG-13,98,1600956.0,12812354.0,14413310,596451.0,Roadside Attractions
Megalopolis (2024),"The city of New Rome faces the duel between Cesar Catilina, a brilliant artist in favor of a Utopian future, and the greedy mayor Franklyn Cicero. Between them is Julia Cicero, with her loyalty divided between her father and her beloved.",2024-09-25,Drama Fantasy Sci-Fi,R,138,7629085.0,6758069.0,14387154,4007797.0,Lionsgate
Blue Lock: Episode Nagi (2024),Seishiro Nagi before he enters the titular Blue Lock facility.,2024-04-19,Animation Drama Sport Thriller,PG-13,91,1855384.0,12436177.0,14291561,1043969.0,Crunchyroll
Yolki 11 (2024),"Uncle Yura, serves as a security guard in an elite village, raises a mini-pig Kostya and does not like New Year at all.",2024-12-12,Adventure Comedy Drama Family Romance,,92,,14066980.0,14066980,,
Article 370 (2024),"Ahead of a major constitutional decision, special agent Zooni Haksar is tasked with a secret mission to quell violence in a conflict-ridden region.",2024-02-22,Action Drama Thriller,,158,1088790.0,12133231.0,13222021,326458.0,
Niko: Beyond the Northern Lights (2024),Niko is a flying reindeer boy whose biggest dream is to become a member of Santa's flying forces. But instead he loses Santa's sleigh and during pursuit to get it back he learns the importance of friendship and doing things your own way.,2024-11-07,Adventure Animation Family Fantasy,,86,,13162253.0,13162253,,
Thelma (2024),"When 93-year-old Thelma Post gets duped by a phone scammer pretending to be her grandson, she sets out on a treacherous quest across the city to reclaim what was taken from her.",2024-06-21,Action Comedy,PG-13,98,9002073.0,4013548.0,13015621,2303222.0,Magnolia Pictures
Afraid (2024),The Pike family is selected to test a new home device: a digital assistant called AIA. AIA learns the family's behaviors and begins to anticipate their needs. And she can make sure nothing - and no one - gets in her family's way.,2024-08-28,Horror Mystery Sci-Fi Thriller,PG-13,84,6725687.0,6252071.0,12977758,3665664.0,Sony Pictures Releasing
Letuchiy korabl (2024),"The Tsar is having his daughter Zabava marry a charmingly handsome and a handsomely charming Paul, a rich heir and a foreign fancy pants. However, it's a bit of a challenge, since Zabava wants a marriage of love, not of calculation. Her unexpected encounter with sailor Ivan, a simpleton yet an honest and endearing guy, messes up Paul's plans of snatching the crown. Deeply in love with the princess, Ivan enlists help from the residents of an enchanted forest to build a Flying Ship which would then take him and his beloved away. The brave sailor is in for serious confrontation with the sneaky Paul, who's using dark magic to bring his unwanted opponent down. However, true love is going to win this battle: with the evil mastermind punished, Ivan and Zabava step aboard the magic Flying Ship and set sail towards a new common dream of theirs.",2024-03-21,Adventure Comedy Family Fantasy Romance,,100,,12886684.0,12886684,,
Domovyonok Kuzya (2024),"The brownie escapes from the captivity of Baba Yaga in her magical world, and ends up in the apartment of the girl Natasha and her parents. Kuzya needs to find his magic chest that grants wishes. Both Natasha and the local grumpy brownie Nafanya help him in this. It turns out that Kuzya himself gave the chest to Andrey, Natasha's dad, many years ago. It would seem that the goal is already close, but in search of both Kuzya and the chest, Baba Yaga entered our world, and she has her own insidious plans.",2024-12-19,Comedy Family Fantasy,,90,,12851838.0,12851838,,
Love Lies Bleeding (2024),"Reclusive gym manager Lou falls hard for Jackie, an ambitious bodybuilder headed through town to Vegas in pursuit of her dream. But their love ignites violence, pulling them deep into the web of Lou's criminal family.",2024-03-08,Crime Drama Mystery Romance Thriller,R,104,8335797.0,4443752.0,12779549,150765.0,A24
Bonhoeffer (2024),"As the world teeters on the brink of annihilation, Dietrich Bonhoeffer joins a deadly plot to assassinate Hitler, risking his faith and fate to save millions of Jews from genocide.",2024-11-22,Biography Drama History Thriller,PG-13,133,12222383.0,472032.0,12694415,5047975.0,Angel (I)
