movie_title,movie_summary,release_date,genres,indicative_rating,running_time,domestic_gross,international_gross,total_gross,domestic_opening,domestic_distributor
Look Back (2024),"The overly confident Fujino and the shut-in Kyomoto couldn't be more different, but a love of drawing manga brings these two small-town girls together.",2024-06-28,Animation Drama,,58,2002270.0,10644047.0,12646317,690171.0,GKIDS
The Exorcism (2024),A troubled actor begins to exhibit a disruptive behavior while shooting a horror film. His estranged daughter wonders if he's slipping back into his past addictions or if there's something more sinister at play.,2024-05-30,Horror Thriller,R,95,4530418.0,8080000.0,12610418,2457041.0,Vertical Entertainment
Am I Racist? (2024),"A man investigates diversity, equity and inclusion practices, revealing absurdities through hidden social experiments.",2024-09-13,Comedy Documentary,PG-13,100,12311598.0,,12311598,4544063.0,SDG Releasing
Muroi Shinji: Not Defeated (2024),"After quitting his job as a police officer, Shinji Muroi settles into a peaceful countryside life with two young boys. However, with the arrival of a mysterious girl, a dead body which presumably murdered, is also been discovered.",2024-10-11,Crime Drama Mystery,,115,,12121760.0,12121760,,
Citizen of a Kind (2024),"After a fire destroys her laundromat, a single mother is tricked by a voice phishing scheme. She decides to investigate the criminals behind it.",2024-01-24,Action Comedy Crime Drama,,114,,11976305.0,11976305,,
The Enchanted Tinderbox (2024),"In a fairy-tale kingdom, a soldier on his way home accidentally finds a magic flint and frees the little girl Dasha, who was kidnapped and bewitched by the evil Likhodey, who was locked in it. To dispel his spell, the soldier will have to go on a dangerous journey.",2024-10-23,Adventure Family Fantasy,,105,,11737506.0,11737506,,
Sound of Hope: The Story of Possum Trot (2024),"The true story of Donna and Reverend WC Martin and their church in East Texas, in which 22 families adopted 77 children from the local foster system, igniting a movement for vulnerable children everywhere.",2024-07-04,Drama,PG-13,130,11647099.0,76403.0,11723502,3078758.0,Angel (I)
Parthenope (2024),"A woman born in the sea of Naples in 1950 searches for happiness over the long summers of her youth, falling in love with her home city and its many memorable characters.",2024-10-24,Drama Fantasy,R,137,289303.0,11361822.0,11651125,31588.0,A24
The Lord of the Rings: The Return of the King (2003),Gandalf and Aragorn lead the World of Men against Sauron's army to draw his gaze from Frodo and Sam as they approach Mount Doom with the One Ring.,2003-12-17,Adventure Drama Fantasy,PG-13,201,381878219.0,756308664.0,1138585547,72629713.0,New Line Cinema
Maison de retraite 2 (2023),"The initiative guy Milan runs a shelter for pensioners and orphans, where the elderly happily get along with the youth. But only until the day when social services close the institution through the efforts of a greedy competitor. Milan has no choice but to relocate residents to a holiday home in the south of France, where they will have to learn how to get along with its current guests.",2024-02-14,Comedy,,102,,11227393.0,11227393,,
A Million Minutes (2024),"Vera and Wolf Küper, parents to Nina and Simon, navigate work and family stress. Their world gets shaken with Nina's motor disorder diagnosis, reminding Wolf of her wish for a million minutes, just for the really nice things.",2024-02-01,Drama,,125,,11077140.0,11077140,,
Ruki vverkh! (2024),"On the eve of the big concert ""Ruki vverkh!"" An attempt is made on the life of the lead singer of the legendary group Sergey Zhukov. He manages to avoid the bullet, but what if this is not a miracle, but a cold calculation, and the shooter's goal is to intimidate the artist? Senior investigator Pavlov takes over the investigation, confident that the search for the criminal must be in Zhukov's past. He will have to uncover the mystery of the assassination attempt, remembering the history of the group and learning new facts from the musician's biography.",2024-10-10,Biography Comedy Music Mystery,,102,,11024035.0,11024035,,
Undercover (2024),"After spending several years infiltrating the circles of the Abertzale left as another young sympathizer of the terrorist group ETA, a police officer gets what she was looking for: ETA contacts her.",2024-10-11,Thriller,,118,,10870544.0,10870544,,
Alienoid: The Return to the Future (2024),Ancient Taoists travel through time and space in an effort to obtain a divine sword.,2024-01-10,Action Fantasy Sci-Fi,,122,60720.0,10763488.0,10824208,27972.0,Well Go USA Entertainment
Jung Kook: I Am Still (2024),"Jung Kook invites viewers on a journey showcasing his rise to stardom, creative process, work ethic, and challenges as a global icon, with unseen footage, interviews, and electrifying performances.",2024-09-18,Documentary Music,,90,2574318.0,8188899.0,10763217,1425748.0,Trafalgar Releasing
Cat and Dog (2024),"A cat and a dog escape their cages in the airport, their owners must work together to recover their prized pets.",2024-02-14,Comedy,,86,,10740923.0,10740923,,
Piece by Piece (2024),"A vibrant journey through the life of Pharrell Williams, told through the lens of LEGO animation.",2024-10-11,Animation Biography Comedy Family Musical,PG,93,9756635.0,966157.0,10722792,3851355.0,Focus Features
One Direction: This Is Us (2013),"A look at Niall, Zayn, Liam, Louis, and Harry's meteoric rise to fame, from their humble hometown beginnings and competing on the X-Factor, to conquering the world and performing at London's famed O2 Arena.",2013-08-28,Documentary Music,PG,92,29136885.0,45213784.0,74373188,15815497.0,TriStar Pictures
Mrs. Green Apple: The White Lounge (2024),,2024-09-13,Drama Music Musical,,89,,10337403.0,10337403,,
The Boy with Pink Trousers (2024),"The story of Andrea Spezzacatena, who, in 2012, decided to take his own life because of the continuous bullying of some classmates.",2024-11-07,Drama,,114,,10230224.0,10230224,,
All About Suomi (2024),"Suomi, wife of wealthy Shizuo Samukawa, vanishes. Five men who loved her - her current husband and four ex-husbands - gather at his mansion, each holding completely different memories of her looks and character.",2024-09-13,Drama,,114,,10176530.0,10176530,,
Muroi Shinji: Ikitsuzukeru Mono (2024),"After being drawn into a complex investigation surrounding a murder case, Shinji Muroi's house is mysteriously set on fire. Can he unravel the truth behind the crime?",2024-11-15,,,114,,10174418.0,10174418,,
Saturday Night (2024),"At 11:30pm on October 11th, 1975, a ferocious troupe of young comedians and writers changed television forever. Find out what happened behind the scenes in the 90 minutes leading up to the first broadcast of Saturday Night Live.",2024-09-27,Biography Comedy Drama History,R,109,9511315.0,543714.0,10055029,270487.0,Sony Pictures Releasing
Weddings and Wokes: A Family Dilemma (2024),"Amidst the chaos of acting dreams, career obstacles, bitcoin trading, overprotective parents, job loss, and mischievous children, a couple's Alpine wedding hangs in the balance.",2024-12-19,Comedy,,90,,9959269.0,9959269,,
Lisa Frankenstein (2024),"A coming of RAGE love story about a teenager and her crush, who happens to be a corpse. After a set of horrific circumstances bring him back to life, the two embark on a journey to find love, happiness - and a few missing body parts.",2024-02-08,Comedy Horror Romance,PG-13,101,9774285.0,153429.0,9927714,3695785.0,Focus Features
Io e te dobbiamo parlare (2024),A young girl embarks on a journey to find her lost family in a distant land.,2024-12-19,Comedy Crime,,95,,9886115.0,9886115,,
Listy do M. Pozegnania i powroty (2024),,2024-11-07,Comedy Romance,,123,,9782064.0,9782064,,
Rafadan Tayfa: Kapadokya (2024),,2024-12-27,Animation,,84,,9615904.0,9615904,,
A Smile Doesn't Lie (2024),"Unemployed man Wisi travels to Bordeaux. He meets kindhearted Marina, pretending to be undocumented to stay with her. One night, he encounters Jérôme, recently homeless after his mother's death.",2024-07-03,Comedy,,96,,9211570.0,9211570,,
