movie_title,movie_summary,release_date,genres,indicative_rating,running_time,domestic_gross,international_gross,total_gross,domestic_opening,domestic_distributor
Voyager (1991),"April 1957: Rational engineer Faber's plane crashes in Mexico. He learns that he became a dad in 1938. He takes a ship from NYC to France and meets cute, young Sabeth. Fate?",1992-01-31,Drama Romance,,117,516517,,516517,19807.0,Castle Hill Productions
Crossing the Bridge (1992),The adventures of three teenage friends in 1970s Detroit.,1992-09-11,Comedy Drama,R,103,479676,,479676,243695.0,Walt Disney Studios Motion Pictures
Danzón (1991),"Julia (Rojo) is a phone operator in Mexico City who divides her time between her job, her daughter and the danzon: a cuban dance very popular in Mexico and Central America. Every wednesday Julia does the danzon with Carmelo (Rergis) in the old ""Salon Colonia"". They've danced for years but barely know each other. One night Carmelo disappears without a trace. Feeling lonely and sad, Julia takes a train to Veracruz, where she knows Carmelo has a brother. That sudden trip will change Julia's life forever.",1992-09-25,Drama,PG-13,120,450501,,450501,9096.0,Sony Pictures Classics
Storyville (1992),"While investigating his own blackmailing, a young politician uncovers his family's deep secrets.",1992-08-26,Drama Mystery Thriller,R,113,422503,,422503,101383.0,Twentieth Century Fox
The Adjuster (1991),A family with the lack of sincerity faces a crisis.,1992-05-29,Comedy Drama,R,102,396573,,396573,10686.0,Orion Classics
Where the Day Takes You (1992),"King is a young man, but he's already a veteran of life on the streets of Los Angeles. The leader of a group of runaways, King acts as a mentor to troubled kids such as gay hustler Little J and junkie Greg.",1992-09-11,Crime Drama Thriller,R,105,390152,,390152,190961.0,New Line Cinema
Close to Eden (1991),"A curious friendship develops between Gombo, a young Mongolian shepherd living with his wife and family in a hut, deep in the wilderness of the steppes, and Sergei, a Russian worker whose truck breaks down not far from Gombo's hut.",1992-10-30,Adventure Drama Romance,PG,119,377832,,377832,,Miramax
Monster in a Box (1992),"This is the story of Spalding Gray and his attempt to write a novel. It is a first person account about writing and living, and dealing with success while trying to be successful.",1992-05-15,Comedy Drama,PG-13,87,311245,,311245,,Fine Line Features
The Panama Deception (1992),A film about the true reasons for the 1989 US invasion of Panama and big media complicity in these activities.,1992-07-31,Documentary History War,,91,309596,,309596,6563.0,Empowerment Project
Hard Promises (1991),"With only seventy-two hours to keep his future from being a bleak one, Joey pulls out all the stops to win back his ex-wife before she remarries.",1992-01-31,Comedy Drama Family Romance,,95,306319,,306319,,Columbia Pictures
Becoming Colette (1991),"The story of a girl who become the toast of Paris high-society. Through her marriage to one of France's most notorious degenerates, Colette's eyes are opened to every form of sexual depravity - shameless adventures that stir her.",1992-11-06,Biography Drama Romance,R,93,272931,,272931,12692.0,Castle Hill Productions
