movie_title,movie_summary,release_date,genres,indicative_rating,running_time,domestic_gross,international_gross,total_gross,domestic_opening,domestic_distributor
Star Wars: Episode VIII - The Last Jedi (2017),Rey develops her abilities with the help of Luke Skywalker as the Resistance prepares for battle against the First Order.,2017-12-13,Action Adventure Fantasy Sci-Fi,PG-13,152,620181382.0,714226324,1334407706,220009584.0,Walt Disney Studios Motion Pictures
Beauty and the Beast (2017),"A brave, beautiful, and brilliant young woman is imprisoned by a beast in his castle. Despite her fears, she learns to see beyond the beast's hideous exterior and realize the gentle heart of the true prince within him.",2017-03-16,Adventure Family Fantasy Musical Romance,PG,129,504481165.0,761634799,1266115964,174750616.0,Walt Disney Studios Motion Pictures
The Fate of the Furious (2017),"When a mysterious woman seduces Dominic Toretto into the world of terrorism and a betrayal of those closest to him, the crew face trials that will test them as never before.",2017-04-12,Action Crime Thriller,PG-13,136,226008385.0,1009996733,1236009236,98786705.0,Universal Pictures
Despicable Me 3 (2017),"Gru meets his long-lost, charming, cheerful, and more successful twin brother Dru, who wants to team up with him for one last criminal heist.",2017-06-14,Adventure Animation Comedy Crime Family Sci-Fi,PG,89,264624300.0,770175831,1034800131,72434025.0,Universal Pictures
Jumanji: Welcome to the Jungle (2017),"Four teenagers are sucked into a magical video game, and the only way they can escape is to work together to finish the game.",2017-12-20,Action Adventure Comedy Fantasy,PG-13,119,404540171.0,558002774,962544585,36169328.0,Sony Pictures Releasing
Spider-Man: Homecoming (2017),Peter Parker tries to stop Adrian 'The Vulture' Toomes from selling weapons made with advanced Chitauri technology while trying to balance his life as an ordinary high school student.,2017-07-05,Action Adventure Sci-Fi,PG-13,133,334952829.0,545983955,880978185,117027503.0,Sony Pictures Releasing
Wolf Warrior 2 (2017),"China's deadliest special forces operative settles into a quiet life on the sea. When sadistic mercenaries begin targeting nearby civilians, he must leave his newfound peace behind and return to his duties as a soldier and protector.",2017-07-27,Action Adventure Drama Thriller War,,123,2721100.0,867604339,870325439,219022.0,The H Collective
Guardians of the Galaxy Vol. 2 (2017),"The Guardians struggle to keep together as a team while dealing with their personal family issues, notably Star-Lord's encounter with his father, the ambitious celestial being Ego.",2017-04-25,Action Adventure Comedy Sci-Fi,PG-13,136,389813101.0,473942950,863756903,146510104.0,Walt Disney Studios Motion Pictures
Thor: Ragnarok (2017),"Imprisoned on the planet Sakaar, Thor must race against time to return to Asgard and stop Ragnarök, the destruction of his world, at the hands of the powerful and ruthless villain Hela.",2017-10-24,Action Adventure Comedy Fantasy Sci-Fi,PG-13,130,315058289.0,540243517,855301806,122744989.0,Walt Disney Studios Motion Pictures
Wonder Woman (2017),"When a pilot crashes and tells of conflict in the outside world, Diana, an Amazonian warrior in training, leaves home to fight a war, discovering her full powers and true destiny.",2017-05-30,Action Adventure Fantasy Sci-Fi War,PG-13,141,412845172.0,411125510,823970682,103251471.0,Warner Bros.
Coco (2017),"Aspiring musician Miguel, confronted with his family's ancestral ban on music, enters the Land of the Dead to find his great-great-grandfather, a legendary singer.",2017-10-27,Adventure Animation Drama Family Fantasy Music Mystery,PG,105,210460015.0,604181157,814641172,50802605.0,Walt Disney Studios Motion Pictures
Pirates of the Caribbean: Dead Men Tell No Tales (2017),Captain Jack Sparrow searches for the Trident of Poseidon to rule the sea while being pursued by old rival Captain Salazar and a crew of deadly ghosts who have escaped from the Devil's Triangle.,2017-05-24,Action Adventure Fantasy,PG-13,129,172558876.0,623363422,795922298,62983253.0,Walt Disney Studios Motion Pictures
It (2017),"In the summer of 1989, a group of bullied kids band together to destroy a shape-shifting monster, which disguises itself as a clown and preys on the children of Derry, their small Maine town.",2017-09-06,Horror,R,135,328874981.0,375367570,704242888,123403419.0,Warner Bros.
Justice League (2017),"Steppenwolf and his Parademons return after eons to capture Earth. However, Batman seeks the help of Wonder Woman to recruit and assemble Flash, Cyborg and Aquaman to fight the powerful new enemy.",2017-10-17,Action Adventure Fantasy Sci-Fi,PG-13,120,229024295.0,432302692,661326987,93842239.0,Warner Bros.
Logan (2017),"In a future where mutants are nearly extinct, an elderly and weary Logan leads a quiet life. But when Laura, a mutant child pursued by scientists, comes to him for help, he must get her to safety.",2017-03-01,Action Drama Sci-Fi Thriller,R,137,226277068.0,392902882,619180476,88411916.0,Twentieth Century Fox
Transformers: The Last Knight (2017),"A deadly threat from Earth's history reappears and a hunt for a lost artifact takes place between Autobots and Decepticons, while Optimus Prime encounters his creator in space.",2017-06-21,Action Adventure Comedy Sci-Fi Thriller,PG-13,154,130168683.0,475256474,605425157,44680073.0,Paramount Pictures
Kong: Skull Island (2017),"After the Vietnam war, a team of scientists explores an uncharted island in the Pacific, venturing into the domain of the mighty Kong and must fight to escape a primal Eden.",2017-03-08,Action Adventure Fantasy Sci-Fi,PG-13,118,168052812.0,400600000,568652812,61025472.0,Warner Bros.
The Boss Baby (2017),"A suit-wearing, briefcase-carrying baby pairs up with his 7-year old brother to stop the dastardly plot of the CEO of Puppy Co.",2017-03-23,Adventure Animation Comedy Family Fantasy,PG,97,175003033.0,352962903,527965936,50198902.0,Twentieth Century Fox
Dunkirk (2017),"Allied soldiers from Belgium, the British Commonwealth and Empire, and France are surrounded by the German Army and evacuated during a fierce battle in World War II.",2017-07-19,Action Drama History Thriller War,PG-13,106,189740665.0,343904142,533696799,50513488.0,Warner Bros.
War for the Planet of the Apes (2017),"After the apes suffer unimaginable losses, Caesar wrestles with his darker instincts and begins his own mythic quest to avenge his kind.",2017-07-11,Action Adventure Drama Sci-Fi Thriller,PG-13,140,146880162.0,343839601,490719763,56262929.0,Twentieth Century Fox
The Greatest Showman (2017),Celebrates the birth of show business and tells of a visionary who rose from nothing to create a spectacle that became a worldwide sensation.,2017-12-15,Biography Drama Musical,PG,105,174340174.0,297530628,471871490,8805843.0,Twentieth Century Fox
Kingsman: The Golden Circle (2017),"After the Kingsman's headquarters is destroyed and the world is held hostage, an allied spy organization in the United States is discovered. These two elite secret agencies must band together to defeat a common enemy.",2017-09-20,Action Adventure Comedy Crime Thriller,R,141,100234838.0,310667824,410902662,39023010.0,Twentieth Century Fox
The Mummy (2017),"An ancient Egyptian princess is awakened from her crypt beneath the desert, bringing with her malevolence grown over millennia and terrors that defy human comprehension.",2017-06-06,Action Adventure Fantasy Horror Thriller,PG-13,111,80227895.0,329003712,409231607,31688375.0,Universal Pictures
Cars 3 (2017),Lightning McQueen sets out to prove to a new generation of racers that he's still the best race car in the world.,2017-06-15,Adventure Animation Comedy Family Sport,G,102,152901115.0,231029541,383930656,53688680.0,Walt Disney Studios Motion Pictures
Fifty Shades Darker (2017),"While Christian wrestles with his inner demons, Anastasia must confront the anger and envy of the women who came before her.",2017-02-08,Drama Mystery Romance Thriller,R,118,114581250.0,266964596,381545846,46607250.0,Universal Pictures
Murder on the Orient Express (2017),"When a murder occurs on the train on which he's travelling, celebrated detective Hercule Poirot is recruited to solve the case.",2017-11-03,Crime Drama Mystery Thriller,PG-13,114,102826543.0,249967538,352794081,28681472.0,Twentieth Century Fox
xXx: Return of Xander Cage (2017),"Xander Cage, left for dead after an incident, is recruited back into action for a new assignment, leading a team of death-defying adrenaline junkies.",2017-01-18,Action Adventure Thriller,PG-13,107,44898413.0,301219864,346118277,20130142.0,Paramount Pictures
Never Say Die (2017),A male UFC boxer switches bodies with the female reporter who exposed his bribes. Now they must help each other win the championship.,2017-09-29,Comedy Fantasy Sport,,100,,334530869,334530869,,
The Lego Batman Movie (2017),"A cooler-than-ever Bruce Wayne must deal with the usual suspects as they plan to rule Gotham City, while discovering that he has accidentally adopted a teenage orphan who wishes to become his sidekick.",2017-02-02,Action Adventure Animation Comedy Family Fantasy Sci-Fi,PG,104,175936671.0,136400000,312336671,53003468.0,Warner Bros.
The Ex-File 3: Return of the Exes (2017),A couples relationship is tested by the untimely appearances of their exes!,2017-12-28,Comedy Romance,,120,838959.0,306753468,307592427,125291.0,China Lion Film Distribution
Annabelle: Creation (2017),"Twelve years after the tragic death of their little girl, a doll-maker and his wife welcome a nun and several girls from a shuttered orphanage into their home, where they become the target of the doll-maker's possessed creation, Annabelle.",2017-08-03,Horror Mystery Thriller,R,109,102092201.0,204500000,306592201,35006404.0,Warner Bros.
Wonder (2017),"Based on the New York Times bestseller, this movie tells the incredibly inspiring and heartwarming story of August Pullman, a boy with facial differences who enters the fifth grade, attending a mainstream elementary school for the first time.",2017-10-17,Drama Family,PG,113,132422809.0,182603121,315025930,27547866.0,Lionsgate
Ferdinand (2017),"After Ferdinand, a bull with a big heart, is mistaken for a dangerous beast, he is captured and torn from his home. Determined to return to his family, he rallies a misfit team on the ultimate adventure.",2017-12-13,Adventure Animation Comedy Drama Family,PG,108,84410380.0,211658819,296069199,13401586.0,Twentieth Century Fox
Split (2016),Three girls are kidnapped by a man with a diagnosed 23 distinct personalities. They must try to escape before the apparent emergence of a frightful new 24th.,2017-01-18,Horror Thriller,PG-13,117,138291365.0,140163052,278454417,40010975.0,Universal Pictures
Blade Runner 2049 (2017),"Young Blade Runner K's discovery of a long-buried secret leads him to track down former Blade Runner Rick Deckard, who's been missing for thirty years.",2017-10-04,Action Drama Mystery Sci-Fi Thriller,R,164,92071675.0,185859903,277937605,32753122.0,Warner Bros.
Kung Fu Yoga (2017),"Two professors team up to locate a lost treasure and embark on an adventure that takes them from a Tibetan ice cave to Dubai, and to a mountain temple in India.",2017-01-26,Action Adventure Comedy Family Fantasy Mystery,,107,362657.0,257391232,257753889,111979.0,Well Go USA Entertainment
Get Out (2017),"A young African-American visits his white girlfriend's parents for the weekend, where his simmering uneasiness about their reception of him eventually reaches a boiling point.",2016-02-18,Horror Mystery Thriller,R,104,176196665.0,79548492,255751443,,
Baahubali 2: The Conclusion (2017),"Amarendra Baahubali, the heir apparent to the throne of Mahishmati, finds his life and relationships endangered as his adoptive brother Bhallaladeva conspires to claim the throne.",2017-04-27,Action Drama,,167,20186659.0,233971731,254158390,10430497.0,Great India Films
Journey to the West: The Demons Strike Back (2017),A monk and his three disciples continue on their journey to battle demons.,2017-01-26,Adventure Comedy Fantasy,PG-13,109,880346.0,246704898,247585244,463883.0,Sony Pictures Releasing
Alien: Covenant (2017),"The crew of a colony ship, bound for a remote planet, discover an uncharted paradise with a threat beyond their imagination, and must attempt a harrowing escape.",2017-05-09,Horror Sci-Fi Thriller,R,122,74262031.0,166629732,240892187,36160621.0,Twentieth Century Fox
Paddington 2 (2017),"Paddington, now happily settled with the Brown family and a popular member of the local community, picks up a series of odd jobs to buy the perfect present for his Aunt Lucy's 100th birthday, only for the gift to be stolen.",2017-11-09,Adventure Comedy Family,PG,103,40907738.0,249223228,290132513,11001961.0,Warner Bros.
Youth (2017),A look at the lives of members of a Military Cultural Troupe in the 1970s.,2017-12-14,Drama Romance War,,135,1891956.0,225199334,227091290,338604.0,China Lion Film Distribution
Baby Driver (2017),"Coerced into working for a crime boss, a young getaway driver must face the music when a doomed heist threatens his life, love, and freedom.",2017-06-28,Action Crime Drama Music,R,113,107825862.0,119119225,226945087,20553320.0,TriStar Pictures
Valerian and the City of a Thousand Planets (2017),"A dark force threatens Alpha, a vast metropolis and home to species from a thousand planets. Special operatives Valerian and Laureline must race to identify the marauding menace and safeguard not just Alpha, but the future of the universe.",2017-07-20,Action Adventure Fantasy Sci-Fi,PG-13,136,41189488.0,184783852,225973340,17007624.0,STX Entertainment
Geostorm (2017),"When the network of satellites designed to control the global climate starts to attack Earth, it's a race against the clock for its creator to uncover the real threat before a worldwide Geostorm wipes out everything and everyone.",2017-10-12,Action Sci-Fi Thriller,PG-13,111,33700160.0,188200000,221900160,13707376.0,Warner Bros.
The Emoji Movie (2017),"Gene, a multi-expressional emoji, sets out on a journey to become a normal emoji.",2017-07-27,Adventure Animation Comedy Family Fantasy Sci-Fi,PG,86,86089513.0,131687133,217776646,24531923.0,Sony Pictures Releasing
A Dog's Purpose (2017),"A dog discovers the meaning of its own existence through the lives of the humans it teaches to laugh and love. Reincarnated as multiple canines over the course of five decades, the lovable pooch develops an unbreakable bond with Ethan.",2017-01-19,Adventure Comedy Drama Family Fantasy,PG,100,64508620.0,140527199,205035819,18222810.0,Universal Pictures
Smurfs: The Lost Village (2017),"A mysterious map sets Smurfette and her friends Brainy, Clumsy and Hefty on an exciting race through the Forbidden Forest, leading to the discovery of the biggest secret in Smurf history.",2017-03-29,Adventure Animation Comedy Family Fantasy,PG,90,45020282.0,152163264,197183546,13210449.0,Sony Pictures Releasing
The Shape of Water (2017),"At a top secret research facility in the 1960s, a lonely janitor forms a unique relationship with an amphibious creature that is being held in captivity.",2017-12-01,Drama Fantasy Romance Sci-Fi,R,123,63859435.0,131384029,195243464,166564.0,Fox Searchlight Pictures
Pitch Perfect 3 (2017),"Following their win at the world championship, the now separated Bellas reunite for one last singing competition at an overseas USO tour, but face a group who uses both instruments and voices.",2017-12-21,Comedy Music,PG-13,93,104897530.0,80502815,185400345,19928525.0,Universal Pictures
The Hitman's Bodyguard (2017),"Michael Bryce, a protection agent, is tasked with protecting Darius Kincaid, one of the world's most famous assassins.",2017-08-16,Action Comedy Crime Thriller,R,118,75468583.0,107960106,183431147,21384504.0,Lionsgate
Daddy's Home 2 (2017),"Having finally gotten used to each other's existence, Brad and Dusty must now deal with their intrusive fathers during the holidays.",2017-11-09,Comedy,PG-13,100,104029443.0,76584381,180613824,29651193.0,Paramount Pictures
The Post (2017),A cover-up spanning four U.S. Presidents pushes the country's first female newspaper publisher and her editor to join an unprecedented battle between press and government.,2017-12-22,Biography Drama History Thriller War,PG-13,116,81903458.0,111861206,193764664,526011.0,Twentieth Century Fox
Baywatch (2017),"Devoted lifeguard Mitch Buchannon butts heads with a brash new recruit, as they uncover a criminal plot that threatens the future of the bay.",2017-05-25,Action Comedy Crime,R,116,58060186.0,119796565,177856751,18503871.0,Paramount Pictures
John Wick: Chapter 2 (2017),"After returning to the criminal underworld to repay a debt, John Wick discovers that a large bounty has been put on his life.",2017-02-08,Action Crime Thriller,R,122,92029184.0,82319448,174348632,30436123.0,Lionsgate
Ghost in the Shell (2017),"In the near future, Major Mira Killian is the first of her kind: A human saved from a terrible crash, who is cyber-enhanced to be a perfect soldier devoted to stopping the world's most dangerous criminals.",2017-03-29,Action Crime Drama Mystery Sci-Fi Thriller,PG-13,107,40563557.0,129283388,169846945,18676033.0,Paramount Pictures
"Three Billboards Outside Ebbing, Missouri (2017)",A mother personally challenges the local authorities to solve her daughter's murder when they fail to catch the culprit.,2017-11-10,Comedy Crime Drama,R,115,54513740.0,108215581,162729321,322168.0,Fox Searchlight Pictures
Duckweed (2017),"In the near-death after an accident, a sports car driver time-travelled back to the 1990s to meet his severe father and never-seen mother in a small Chinese town.",2017-01-28,Comedy Drama Fantasy,,102,471575.0,152422689,152894264,160739.0,China Lion Film Distribution
Darkest Hour (2017),"In May 1940, the fate of World War II hangs on Winston Churchill, who must decide whether to negotiate with Adolf Hitler, or fight on knowing that it could mean the end of the British Empire.",2017-11-22,Biography Drama History War,PG-13,125,56468410.0,94378864,150847274,175006.0,Focus Features
King Arthur: Legend of the Sword (2017),"Robbed of his birthright, Arthur comes up the hard way in the back alleys of the city. But once he pulls the sword from the stone, he is forced to acknowledge his true legacy - whether he likes it or not.",2017-05-09,Action Adventure Drama Fantasy,PG-13,126,39175066.0,110000000,149175066,15371270.0,Warner Bros.
The Foreigner (2017),"A humble businessman with a buried past seeks justice when his daughter is killed in an act of terrorism. A cat-and-mouse conflict ensues with a government official, whose past may hold clues to the killers' identities.",2017-09-30,Action Crime Thriller,R,113,34393507.0,111024563,145418070,13113024.0,STX Entertainment
Power Rangers (2017),"When Earth is on the verge of an alien invasion, five teenagers, who are infused with superhuman abilities, must harness their newfound powers to battle this threat - as the Power Rangers.",2017-03-22,Action Adventure Fantasy Sci-Fi,PG-13,124,85364450.0,56972790,142337240,40300288.0,Lionsgate
Girls Trip (2017),"When four lifelong friends travel to New Orleans for the annual Essence Festival, sisterhoods are rekindled, wild sides are rediscovered, and there's enough dancing, drinking, brawling and romancing to make the Big Easy blush.",2017-07-21,Adventure Comedy Drama,R,122,115171585.0,25380774,140552359,31201920.0,Universal Pictures
American Made (2017),"The story of Barry Seal, an American pilot who became a drug-runner for the CIA in the 1980s in a clandestine operation that would be exposed as the Iran-Contra Affair.",2017-08-23,Action Comedy Crime Drama Thriller,R,115,51342000.0,83524593,134866593,16776390.0,Universal Pictures
A Bad Moms Christmas (2017),"As their own mothers drop in unexpectedly, our three under-appreciated and over-burdened moms rebel against the challenges and expectations of the Super Bowl for mothers: Christmas.",2017-11-01,Comedy,R,104,72110659.0,58449769,130560428,16759161.0,STX Entertainment
Happy Death Day (2017),"A college student must relive the day of her murder over and over again, in a loop that will end only when she discovers her killer's identity.",2017-10-12,Comedy Horror Mystery Thriller,PG-13,96,55683845.0,69795421,125479266,26039025.0,Universal Pictures
Captain Underpants: The First Epic Movie (2017),"Two overly-imaginative pranksters hypnotize their grumpy principal into thinking he's a ridiculously enthusiastic, incredibly dimwitted, underwear-themed superhero.",2017-05-31,Action Adventure Animation Comedy Family Sci-Fi,PG,89,73921000.0,51506681,125427681,23851539.0,Twentieth Century Fox
The Lego Ninjago Movie (2017),"Shunned by everyone for being the son of an evil warlord, a teenager seeks to defeat him with the help of his fellow ninjas.",2017-09-20,Action Adventure Animation Comedy Drama Family Fantasy Sci-Fi Thriller,PG,101,59364177.0,64400000,123764177,20433071.0,Warner Bros.
Secret Superstar (2017),A talented teenage singer/songwriter living amid domestic abuse becomes a YouTube sensation after a video in which she hides her identity goes viral.,2017-10-18,Drama Music,,150,,130765691,130765691,,
The Commuter (2018),An insurance salesman/ex-cop is caught up in a life-threatening conspiracy during his daily commute home.,2017-01-12,Action Mystery Thriller,PG-13,104,36343858.0,83598529,119942434,13701452.0,Lionsgate
Forever Young (2018),"The story of four generations spanning a hundred years of modern Chinese history, facing its own unique set of challenges, like corporate corruption, the cultural revolution, and one's duty to nation in time of war.",2017-11-16,Drama,,138,,119055731,119055731,,
The Dark Tower (2017),A boy haunted by visions of a dark tower from a parallel reality teams up with the tower's disillusioned guardian to stop an evil warlock known as the Man in Black who plans to use the boy to destroy the tower and open the gates of Hell.,2017-08-03,Action Adventure Drama Fantasy Sci-Fi Western,PG-13,95,50701325.0,62529753,113231078,19153698.0,Sony Pictures Releasing
Buddies in India (2017),"In an effort to save his house, a man accompanies the son of a recently deceased CEO to India to recover his will.",2017-01-27,Action Comedy,,99,293194.0,109861934,110155128,181705.0,China Lion Film Distribution
Along With the Gods: The Two Worlds (2017),"After a heroic death, a firefighter navigates the afterlife with the help of three guides.",2017-12-20,Action Adventure Drama Fantasy Thriller,,139,1908823.0,107475149,109393162,185546.0,Well Go USA Entertainment
Immortal Demon Slayer (2017),"A giant rebelled against the heavens. It was declared a devil and defeated. The immortal heart evolved into Sun Wukong. The heavens found him, and ravaged his home. He enters the heavenly kingdom, disguised as a human, seeking retribution.",2017-07-13,Action Adventure Family Fantasy,,123,,103818506,103818506,,
Jigsaw (2017),Police search for a supposed to be dead killer who forces his victims to play sadistic games of life and death.,2017-10-25,Horror Mystery Thriller,R,92,38052832.0,64900056,102952888,16640452.0,Lionsgate
Life (2017),A team of scientists aboard the ISS discover a rapidly evolving Martian predator that needs to be kept away from Earth at all costs.,2017-03-22,Horror Sci-Fi Thriller,R,104,30234022.0,70307784,100541806,12501936.0,Sony Pictures Releasing
Atomic Blonde (2017),An undercover MI6 agent is sent to Berlin during the Cold War to investigate the murder of a fellow agent and recover a missing list of double agents.,2017-07-26,Action Thriller,R,115,51687870.0,48326155,100014025,18286420.0,Focus Features
Legend of the Demon Cat (2017),"When a demon cat appears and breaks the peace of Chang'an City, causing a series of strange events, poet Bai Letian and monk Kukai join hands to investigate the death of the emperor's concubine by following the trail left by the cat.",2017-12-21,Adventure Drama Family Fantasy,,129,,97051623,97051623,,
The Shack (2017),"A grieving man receives a mysterious, personal invitation to meet with God at a place called ""The Shack.""",2017-03-01,Drama Fantasy,PG-13,132,57386418.0,39555697,96942115,16172119.0,Lionsgate
Chasing the Dragon (2017),"An illegal immigrant from Mainland China sneaks into corrupt British-colonized Hong Kong in 1963, transforming himself into a ruthless and emerging drug lord.",2017-09-29,Action Biography Crime History,,128,456854.0,87509088,87965942,138346.0,Well Go USA Entertainment
Tiger Zinda Hai (2017),RAW Agent Tiger joins forces with Zoya in order to rescue a group of nurses who are held hostage by a terrorist organisation.,2017-12-21,Action Adventure Thriller,,161,5560921.0,81759079,87320000,1787108.0,Yash Raj Films
A Taxi Driver (2017),"A widowed father and taxi driver who drives a German reporter from Seoul to Gwangju to cover the 1980 uprising, soon finds himself regretting his decision after being caught in the violence around him.",2017-08-02,Action Drama History,,137,1527829.0,84725111,86252940,331854.0,Well Go USA Entertainment
Going in Style (2017),"Desperate to pay their bills and support their loved ones, lifelong pals Willy Davis, Albert Gardner, and Joe Harding risk it all by robbing the bank that absconded with the pension money that they earned from working there for years.",2017-04-06,Comedy Crime,PG-13,96,45018541.0,40200000,85218541,11932330.0,Warner Bros.
Rings (2017),A young woman finds herself on the receiving end of a terrifying curse that threatens to take her life in 7 days.,2017-02-01,Drama Horror Mystery Romance,PG-13,102,27793018.0,55287872,83080890,13002632.0,Paramount Pictures
