movie_title,movie_summary,release_date,genres,indicative_rating,running_time,domestic_gross,international_gross,total_gross,domestic_opening,domestic_distributor
Architecture 101 (2012),"A 20-year-old architecture student, falls in love with a music student. However, he fails to confess his feelings to her, and they grow apart. 15 years later, she reappears before him and asks him to design her house.",2012-03-22,Drama Romance,,118,,26642354.0,26642354,,
Dancing Queen (2012),A husband finds himself accidentally running for Mayor of Seoul and his wife decides to become a k-pop singer,2012-01-18,Comedy Drama Family,,124,,26411266.0,26411266,,
Lesson of the Evil (2012),A popular high school teacher concocts an extreme plan to deal with the rise of bullying and bad behavior among the student body.,2012-11-10,Horror Thriller,,129,,26167224.0,26167224,,
Agneepath (2012),A young boy's father is lynched before his eyes; fifteen years later he returns home for revenge.,2012-01-26,Action Crime Drama,,174,1986748.0,24014948.0,26001696,1140464.0,Eros Worldwide
Rust and Bone (2012),"Put in charge of his young son, Alain leaves Belgium for Antibes to live with his sister and her husband as a family. Alain's bond with Stephanie, a killer whale trainer, grows deeper after Stephanie suffers a horrible accident.",2012-05-16,Drama Romance,R,120,2062027.0,23745685.0,25807712,27154.0,Sony Pictures Classics
Head Over Heels 2 (2012),Alice owns a sex shop and travels to New York to open a new business.,2012-12-28,Comedy Romance,,115,,25402893.0,25402893,,
On the Other Side of the Tracks (2012),Two mismatched cops team up to investigate the murder of a business mogul's wife.,2012-12-19,Action Comedy Crime Drama,R,96,9572.0,25100000.0,25109572,5923.0,The Weinstein Company
Helter Skelter (2012),Top star Lilico undergoes multiple cosmetic surgeries to her entire body. As her surgeries show side effect.,2012-07-14,Crime Drama Horror Thriller,,127,,25066699.0,25066699,,
The Last Tycoon (2012),"Action superstar Chow Yun-Fat portrays real-life gangster Chen Daqi as he rises to the upper echelons of power, finding himself torn between the love of two women, the murderous plots of the secret service, and the looming threat of war.",2012-12-20,Action Adventure Crime Drama,,107,,25009914.0,25009914,,
Housefull 2 (2012),A comedy of errors wherein four men help each other to fool their prospective father-in-laws creating a cascade of confusion and mayhem.,2012-04-05,Action Comedy Drama Musical Romance,,145,1791780.0,23131067.0,24922847,847132.0,Eros Worldwide
Big Miracle (2012),"In small-town Alaska, a news reporter recruits his Greenpeace-volunteer ex-girlfriend on a campaign to save a family of gray whales trapped by rapidly-forming ice in the Arctic Circle.",2012-02-02,Biography Drama Romance,PG,107,20157300.0,4582761.0,24740061,7760205.0,Universal Pictures
Sparkle (2012),"In the 1960s, three sisters form a girl group and soon become local sensations with major label interest, but fame becomes a challenge as the close-knit family begins to fall apart.",2012-08-17,Drama Music,PG-13,116,24397469.0,240331.0,24637800,11643342.0,TriStar Pictures
The Players (2012),A series of short films set around the theme of infidelity.,2012-02-29,Comedy Drama,R,109,10854.0,24618298.0,24629152,6674.0,The Weinstein Company
Liar Game: Reborn (2012),"College graduate Yu Shinomiya is invited to the Liar Game, which has been restarted by funding from new investors. She turns to her psychology professor for help, who is none other than Shinichi Akiyama, former Liar Game champion. He advises her to ignore the invitation, but afraid of the penalty fee should she do so, she decides to participate. Soon, Akiyama is issued an invitation of his own by Fukunaga, who now works for the game. Playing on Akiyama's sympathy for the naive student, Fukunaga manages to get Akiyama to participate as well. The game this time is a diabolical version of Musical Chairs. Once again, Akiyama's cunning and ingenuity is put to the ultimate test.",2012-03-03,Drama,,131,,24557172.0,24557172,,
I Want You (2012),"The sequel of Three Meters Above The Sky, starts with the return of H to his hometown where reconnecting with the past means struggle and also a new love.",2012-06-22,Drama Romance,,120,,24016152.0,24016152,,
Turkish for Beginners (2012),"After a plane crash Lena Schneider finds herself on a remote Andaman island with a teenage turk Cem, full of hormones, his religious sister and Greek Costa.",2012-03-15,Adventure Comedy,,105,,23957607.0,23957607,,
Wanderlust (2012),"Rattled by sudden unemployment, a Manhattan couple surveys alternative living options, ultimately deciding to experiment with living on a rural commune where free love rules.",2012-02-23,Comedy Romance,R,98,17450535.0,6362281.0,23812816,6526650.0,Universal Pictures
"Little Brother, Big Trouble: A Christmas Adventure (2012)","Set right before Christmas, Niko the reindeer must deal with his mom getting re-married and his being tasked with looking after his little stepbrother.",2012-10-12,Adventure Animation Comedy Family,G,79,,23785681.0,23785681,,
To the Arctic 3D (2012),A journey into the lives of a mother polar bear and her two seven-month-old cubs as they navigate the changing Arctic wilderness they call home.,2012-04-20,Documentary Short,G,40,14560838.0,9134550.0,23695388,270228.0,Warner Bros.
Hotaru the Movie: It's Only a Little Light in My Life (2012),"Hotaru Amemiya learns that her boss and now husband Seichi Takano has dreamed of vacationing in Rome like in the movie ""Roman Holiday"". Hotaru makes plans to go to Rome for their honeymoon.",2012-06-09,Drama Romance,,109,,22975341.0,22975341,,
Kon-Tiki (2012),"In 1947, with five loyal friends in tow, explorer Thor Heyerdahl sails a fragile balsa wood raft along an ancient path some 4,300 miles across the Pacific.",2012-08-24,Adventure Biography Drama History,PG-13,118,1517410.0,21325477.0,22842887,22168.0,The Weinstein Company
Fall in Love Like a Star (2015),A superstar musician falls in love with his manager and struggles to choose between his career and true love.,2012-12-03,Romance,,98,212508.0,22681632.0,22894140,,
Upside Down (2012),"Adam and Eden fell in love as teens despite the fact that they live on twinned worlds with gravities that pull in opposite directions. Ten years after a forced separation, Adam sets out on a dangerous quest to reconnect with his love.",2012-08-23,Drama Romance Sci-Fi Thriller,PG-13,109,105095.0,22082718.0,22187813,28722.0,Millennium Entertainment
Unbowed (2011),"Kim Kyung-ho is fired by his university after he questioned the validity of a math question in its entrance exam. Kim files a lawsuit against the university, but it is dismissed. Out of frustration he confronts the judge with a crossbow. Kim is arrested. He says that he did not shoot the judge but the judge insists he did.",2012-01-18,Crime Drama,,100,,22132903.0,22132903,,
Confession of Murder (2012),Lee Du-Seok publishes an autobiography describing murders he committed after the statute of limitations expires. A detective and one of the victims' mother search for the author while an anonymous person claims to be the real killer.,2012-11-08,Action Crime Mystery Thriller,,119,,21701525.0,21701525,,
StreetDance 2 (2012),"After suffering humiliation by the crew Invincible, street dancer Ash (Hentschel) looks to gather the best dancers from around the world for a rematch.",2010-05-19,Drama Music Romance,,85,,68599686.0,68599686,,
2012 (2009),A frustrated writer struggles to keep his family alive when a series of global catastrophes threatens to annihilate mankind.,2009-11-11,Action Adventure Sci-Fi,PG-13,158,166112167.0,625105659.0,791217826,65237614.0,Sony Pictures Releasing
Beasts of the Southern Wild (2012),"Faced with both her hot-tempered father's fading health and melting ice-caps that flood her ramshackle bayou community and unleash ancient aurochs, six-year-old Hushpuppy must learn the ways of courage and love.",2012-06-27,Adventure Drama Fantasy,PG-13,93,12795746.0,8312000.0,21107746,169702.0,Fox Searchlight Pictures
