movie_title,movie_summary,release_date,genres,indicative_rating,running_time,domestic_gross,international_gross,total_gross,domestic_opening,domestic_distributor
Land of the Lost (2009),"A space-time vortex sucks scientist Rick Marshall, his assistant Holly and a survivalist Will into a world populated by dinosaurs and painfully slow creatures called Sleestaks.",2009-06-04,Action Adventure Comedy Sci-Fi,PG-13,102,49438370.0,19339184.0,68777554,18837350.0,Universal Pictures
Saw VI (2009),"Agent Strahm is dead, and FBI agent Erickson draws nearer to Hoffman. Meanwhile, a pair of insurance executives find themselves in another game set by Jigsaw.",2009-10-22,Horror Mystery Thriller,R,90,27693292.0,40540862.0,68234154,14118444.0,Lionsgate
The Girl Who Played with Fire (2009),"As computer hacker Lisbeth and journalist Mikael investigate a sex-trafficking ring, Lisbeth is accused of three murders, causing her to go on the run while Mikael works to clear her name.",2009-09-18,Action Crime Drama Mystery Thriller,R,129,7638241.0,59514984.0,67153225,904998.0,Music Box Films
Precious (2009),"In New York City's Harlem circa 1987, an overweight, abused, illiterate teen who is pregnant with her second child is invited to enroll in an alternative school in hopes that she can re-route her life in a better direction.",2009-11-06,Drama,R,110,47566524.0,16083005.0,63649529,1872458.0,Lionsgate
Little Nicholas (2009),"Nicholas has every reason to keep things in life unchanged; however, when he accidentally overhears mum and dad talking about a new baby brother, his world will turn upside down. Will they abandon him to make room for the little stranger?",2009-09-30,Comedy Family,,91,,62794894.0,62794894,,
Year One (2009),"After being banished from their tribe, two hunter-gatherers encounter Biblical characters and eventually wind up in the city of Sodom.",2009-06-18,Comedy,PG-13,97,43337279.0,19020621.0,62357900,19610304.0,Sony Pictures Releasing
The Imaginarium of Doctor Parnassus (2009),"Having made a deal with the Devil himself for immortality many millennia ago, the now decrepit mystic Doctor Parnassus fights for the freedom of his only daughter's soul.",2009-09-18,Adventure Comedy Fantasy Mystery,PG-13,123,7689607.0,54119168.0,61808775,415233.0,Sony Pictures Classics
Ninja Assassin (2009),"A young ninja turns his back on the orphanage that raised him, leading to a confrontation with a fellow ninja from the clan.",2009-10-27,Action Thriller,R,99,38122883.0,23478397.0,61601280,13316158.0,Warner Bros.
500 Days of Summer (2009),"After being dumped by the girl he believes to be his soulmate, hopeless romantic Tom Hansen reflects on their relationship to try and figure out where things went wrong and how he can win her back.",2009-07-17,Comedy Drama Romance,PG-13,95,32391374.0,28409070.0,60802019,834501.0,Fox Searchlight Pictures
3 Idiots (2009),"Two friends are searching for their long lost companion. They revisit their college days and recall the memories of their friend who inspired them to think differently, even as the rest of the world called them ""idiots"".",2009-12-23,Comedy Drama,PG-13,170,6532874.0,53729962.0,60262836,1645502.0,Reliance Big Pictures
The International (2009),An Interpol agent attempts to expose a high-profile financial institution's role in an international arms dealing ring.,2009-02-12,Action Crime Drama Mystery Thriller,R,118,25450527.0,34803316.0,60253843,9331739.0,Sony Pictures Releasing
Aliens in the Attic (2009),A group of kids must protect their vacation home from invading aliens.,2009-06-26,Adventure Comedy Family Fantasy Sci-Fi,PG,86,25200412.0,32680644.0,57881056,8008423.0,Twentieth Century Fox
Vicky the Viking (2009),"The story of a young Viking boy who accompanies his father, the chief of their village, and his men on their adventures--and often is the person who uses his wit and instincts to help the men in their times of need.",2009-09-09,Action Adventure Comedy Family,,85,,56487596.0,56487596,,
Under the Sea 3D (2009),"An underwater look at the diverse coastal regions of Southern Australia, New Guinea and the Indo-Pacific areas and the impact of global warming on the oceans.",2009-02-13,Documentary Short,,41,36262926.0,19639698.0,55949788,661185.0,Warner Bros.
Dragonball Evolution (2009),"The young warrior Son Goku sets out on a quest, racing against time and the vengeful King Piccolo, to collect a set of seven magical orbs that will grant their wielder unlimited power.",2009-03-12,Action Adventure Fantasy Sci-Fi Thriller,PG,85,9362785.0,46357987.0,55720772,4756488.0,Twentieth Century Fox
Nine (2009),"Famous film director Guido Contini struggles to find harmony in his professional and personal lives, as he engages in dramatic relationships with his wife, his mistress, his muse, his agent, and his mother.",2009-01-28,Drama Musical Romance,PG-13,118,19676965.0,34327985.0,54004950,257232.0,The Weinstein Company
Arthur and the Revenge of Maltazard (2009),"Arthur answers a distress call from Princess Selenia, who is menaced by the nefarious Maltazard.",2009-11-26,Adventure Animation Family Fantasy,PG,107,,52377611.0,52377611,,
Take Off (2009),Five men go for the gold as members of Korea's national ski jumping team.,2009-07-29,Comedy Drama Sport,,137,,52172984.0,52172984,,
Pokémon: Arceus and the Jewel of Life (2009),"Arceus, creator of the world, comes to pass judgement on humanity for the theft of the Jewel of Life, but Ash Ketchum and his friends are sent back in time to discover and possible reverse the events that led to Arceus' vendetta.",2009-07-18,Action Adventure Animation Comedy Drama Family Fantasy Sci-Fi,,95,,52119081.0,52119081,,
I Can Do Bad All by Myself (2009),"When Madea catches sixteen-year-old Jennifer and her two younger brothers looting her home, she decides to take matters into her own hands.",2009-09-11,Comedy Drama,PG-13,113,51733921.0,,51733921,23446785.0,Lionsgate
Coco Before Chanel (2009),The story of Coco Chanel's rise from obscure beginnings to the heights of the fashion world.,2009-04-22,Biography Drama,PG-13,105,6113834.0,44699100.0,50812934,406768.0,Sony Pictures Classics
One Piece: Strong World (2009),"Straw Hat Pirates must save their navigator and stop the legendary Pirate, Shiki the Golden Lion from conquering East Blue.",2009-12-12,Action Adventure Animation Fantasy,,113,,49271461.0,49271461,,
Push (2009),Two young Americans with special abilities must race to find a girl in Hong Kong before a shadowy government organization called Division does.,2009-02-04,Action Sci-Fi Thriller,PG-13,111,31811527.0,17047091.0,48858618,10079109.0,Summit Entertainment
9 (2009),A rag doll that awakens in a postapocalyptic future holds the key to humanity's salvation.,2009-08-19,Action Adventure Animation Drama Fantasy Sci-Fi Thriller,PG-13,79,31749894.0,16678169.0,48428063,10740446.0,Focus Features
20th Century Boys 3: Redemption (2009),It is 2017 and a resurrected Tomodachi rules world. The prophecies of The New Book have all come true.,2009-08-29,Adventure Fantasy,,156,,48397818.0,48397818,,
The Fourth Kind (2009),"The unsolved mystery of a town in Alaska with an extraordinary number of disappearances during the past 40 years, with accusations of a federal cover up.",2009-11-05,Horror Mystery Sci-Fi Thriller,PG-13,98,25486040.0,22233754.0,47719794,12231160.0,Universal Pictures
Crazy Heart (2009),A faded country music musician is forced to reassess his dysfunctional life during a doomed romance that also inspires him.,2009-12-16,Drama Music Romance,R,112,39464306.0,7941260.0,47405566,82664.0,Fox Searchlight Pictures
Hachi: A Dog's Tale (2009),"Professor Wilson discovers a lost Akita puppy on his way home. Despite objections from his wife, Hachi endears himself to the family and grows to be Parker's loyal companion. As their bond grows deeper, a beautiful relationship unfolds.",2009-05-07,Biography Drama Family,,93,,46749646.0,46749646,,
Fantastic Mr. Fox (2009),An urbane fox cannot resist returning to his farm raiding ways and then must help his community survive the farmers' retaliation.,2009-10-22,Adventure Animation Comedy Crime Drama Family,PG,87,21002919.0,37084208.0,58091627,265900.0,Twentieth Century Fox
Rabbit Without Ears 2 (2009),"Gossip reporter Ludo hires friend Anna, who has feelings for him. He goes to Berlin, returns as seductive woman Marie. Anna becomes jealous as Marie toys with her attraction to Ludo.",2009-12-03,Comedy Romance,,124,,48039391.0,48039391,,
The Last House on the Left (2009),"After kidnapping and brutally assaulting two young women, a gang unknowingly finds refuge at a vacation home belonging to the parents of one of the victims: a mother and father who devise an increasingly gruesome series of revenge tactics.",2009-03-13,Horror Thriller,R,113,32752215.0,13243008.0,45995223,14118685.0,Universal Pictures
The Spy Next Door (2010),"Former C.I.A. spy Bob Ho takes on his toughest assignment to date: looking after his girlfriend's three kids, but things take a turn when a russian terrorist takes aim at the family",2009-10-16,Action Comedy Family,PG,94,24307086.0,38267155.0,62574241,9726056.0,Lionsgate
Nodame Cantabile: The Movie II (2010),,2009-12-19,Comedy Drama Music,,123,,86192740.0,86192740,,
Notorious (2009),"The life and death story of The Notorious B.I.G. (a.k.a. Christopher Wallace), who came straight out of Brooklyn to take the world of rap music by storm.",2009-01-16,Biography Crime Drama Music,R,122,36843682.0,7576485.0,44420671,20497596.0,Fox Searchlight Pictures
The Girl Who Kicked the Hornet's Nest (2009),"Lisbeth is recovering in a hospital and awaiting trial for three murders when she is released. Mikael must prove her innocence, but Lisbeth must be willing to share the details of her sordid experiences with the court.",2009-11-27,Crime Drama Mystery Thriller,R,147,5190196.0,39086139.0,44276335,881737.0,Music Box Films
Brothers (2009),"While on tour in Afghanistan, Sam's helicopter is shot down and he is presumed dead. Back home, it is his screw-up brother who looks after the family. Sam does return, but with a lot of excess baggage.",2009-12-04,Drama Thriller War,R,105,28544157.0,14930421.0,43474578,9527848.0,Lionsgate
The Informant! (2009),"The U.S. government decides to go after an agro-business giant with a price-fixing accusation, based on the evidence submitted by their star witness, vice president-turned-informant Mark Whitacre.",2009-09-18,Biography Comedy Crime Drama,R,108,33316821.0,8454347.0,41771168,10464314.0,Warner Bros.
The Uninvited (2009),"Anna returns home after a stint in a mental hospital, but her recovery is jeopardized by her father's new girlfriend and ghastly visions of her dead mother.",2009-01-30,Drama Fantasy Horror Mystery Thriller,PG-13,87,28596818.0,13036566.0,41633384,10325824.0,DreamWorks
Toy Story (1995),"A cowboy doll is profoundly jealous when a new spaceman action figure supplants him as the top toy in a boy's bedroom. When circumstances separate them from their owner, the duo have to put aside their differences to return to him.",1995-11-22,Adventure Animation Comedy Family Fantasy,,81,223225679.0,171210907.0,394436586,29140617.0,Walt Disney Studios Motion Pictures
Evangelion: 2.0 You Can (Not) Advance (2009),"In the face of increasingly bizarre and powerful Angel attacks, Shinji Ikari and his partner Rei Ayanami are assisted by two new pilots: the fiery Asuka Langley Shikinami and the mysterious Mari Illustrious Makinami.",2009-06-27,Action Animation Drama Sci-Fi,,112,133640.0,41231276.0,41780025,84157.0,Eleven Arts
The Concert (2009),"Thirty years ago Bolshoi Orchestra conductor Andreï Filipov was fired for hiring Jewish musicians. Now a lowly janitor, an opportunity arises to gather his old musicians to go and pose as the official Bolshoi orchestra in Paris.",2009-11-04,Comedy Drama Music,PG-13,119,657986.0,40488365.0,41146351,21742.0,The Weinstein Company
Gamer (2009),"In a future mind-controlling game, death row convicts are forced to battle in a 'Doom'-type environment. Convict Kable, controlled by Simon, a skilled teenage gamer, must survive thirty sessions in order to be set free.",2009-09-03,Action Sci-Fi Thriller,R,95,20534907.0,20293633.0,40828540,9156057.0,Lionsgate
All About Steve (2009),"Convinced that a CCN cameraman is her true love, an eccentric crossword puzzler trails him as he travels all over the country, hoping to convince him that they belong together.",2009-04-24,Comedy Romance,PG-13,99,33862903.0,6242639.0,40105542,11241214.0,Twentieth Century Fox
Astro Boy (2009),"When an android replica of a boy is rejected by his aggrieved creator, he goes off to find his own identity in an adventure that would make him the greatest hero of his time.",2009-10-10,Action Adventure Animation Comedy Drama Family Fantasy Sci-Fi,PG,94,19551067.0,20335919.0,39886986,6702923.0,Summit Entertainment
Detective Conan: The Raven Chaser (2009),"The police superintendent, disguised by black suits (IRish), checked that Conan and Shinichi are 98% identical! Conan is getting into danger...! Would that police superintendent tell Gin about this news? Rachel broke Conan's bowl!next day when Rachel went school Serena spoke about the dark knight helmet...Conan went school to hear that his clay dolphin lose its dorsal fin... Would Conan be able to stay alive as Heiji hopes inside phone when talking about ""BBQ in Kyoto""?",2009-04-18,Action Adventure Animation Crime Family Mystery Thriller,,111,,39664359.0,39664359,,
Agora (2009),"A historical drama set in Roman Egypt, concerning a slave who turns to the rising tide of Christianity in the hope of pursuing freedom while falling in love with his mistress, the philosophy and mathematics professor Hypatia of Alexandria.",2009-10-09,Adventure Biography Drama History Romance,R,127,619423.0,38837919.0,39457342,33262.0,Newmarket Films
Halloween II (2009),"Laurie Strode struggles to come to terms with her brother Michael's deadly return to Haddonfield, Illinois; meanwhile, Michael prepares for another reunion with his sister.",2009-08-28,Horror,R,105,33392973.0,6028494.0,39421467,16349565.0,Dimension Films
Cirque du Freak: The Vampire's Assistant (2009),"Teenager Darren Shan meets a mysterious man at a freak show who turns out to be a vampire. After a series of events, Darren must leave his normal life and go on the road with the Cirque du Freak, becoming a creature of the night.",2009-09-25,Action Adventure Fantasy Thriller,PG-13,119,13869515.0,25421868.0,39291383,6293205.0,Universal Pictures
Jeon Woochi (2009),"Jeon Woo-chi, an undisciplined womanizing Taoist from the Joseon era, ends up in present-day Korea causing mayhem with his knack for magic.",2009-12-23,Action Adventure Comedy Fantasy History,,136,,38682281.0,38682281,,
The Soloist (2009),A newspaper journalist discovers a homeless musical genius and tries to improve his situation.,2009-04-24,Biography Drama Music,PG-13,117,31720158.0,6612836.0,38332994,9716458.0,DreamWorks
Amalfi: Rewards of the Goddess (2009),A young Japanese woman goes missing in Rome during the Christmas season.,2009-07-18,Drama,,125,,37840539.0,37840539,,
Broken Embraces (2009),"Harry Caine, a blind writer, reaches this moment in time when he has to heal his wounds from 14 years back. He was then still known by his real name, Mateo Blanco, and directing his last movie.",2009-03-18,Drama Romance Thriller,R,127,5014305.0,32458431.0,37473982,107111.0,Sony Pictures Classics
Brooklyn's Finest (2009),Three unconnected Brooklyn cops wind up at the same deadly location after enduring vastly different career paths.,2009-06-10,Crime Drama Thriller,R,132,27163593.0,16864089.0,44027682,13350299.0,Overture Films
The Boat That Rocked (2009),"A band of rogue DJs that captivated Britain, playing the music that defined a generation and standing up to a government that wanted classical music, and nothing else, on the airwaves.",2009-04-01,Comedy Drama Music,R,135,8017917.0,28330867.0,36352467,2904380.0,Focus Features
Love Happens (2009),"A widower whose book about coping with loss turns him into a best-selling self-help guru, falls for the hotel florist where his seminar is given, only to learn that he hasn't yet truly confronted his wife's passing.",2009-09-17,Drama Romance,PG-13,109,22965110.0,13122918.0,36088028,8057010.0,Universal Pictures
Whatever Works (2009),"A middle-aged, misanthropic divorcé from New York City surprisingly enters a fulfilling, Pygmalion-type relationship with a much younger, unsophisticated Southern girl.",2009-06-19,Comedy Romance,PG-13,93,5306706.0,30713828.0,36020534,266162.0,Sony Pictures Classics
The Secret in Their Eyes (2009),"A retired legal counselor writes a novel hoping to find closure for one of his past unresolved homicide cases, and for his unreciprocated love with his superior--both of which still haunt him decades later.",2009-08-13,Drama Mystery Romance Thriller,R,129,6391436.0,28688214.0,35079650,167866.0,Sony Pictures Classics
Crank: High Voltage (2009),Chelios faces a Chinese mobster who has stolen his nearly indestructible heart and replaced it with a battery-powered ticker which requires regular jolts of electricity to keep working.,2009-04-16,Action Thriller,R,96,13684249.0,20888292.0,34572541,6963565.0,Lionsgate
Gokusen: The Movie (2009),A young teacher is given the toughest classroom in the school. Based on the TV series.,2009-07-11,Comedy Drama,,118,,34117482.0,34117482,,
The Box (2009),"With the press of a button, a wooden box bestows riches and death.",2009-10-29,Drama Mystery Thriller,PG-13,115,15051977.0,18282199.0,33334176,7571417.0,Warner Bros.
LOL (Laughing Out Loud) (2008),"When Lola's boyfriend is unfaithful to her on his summer holiday, she dumps him and flirts with his best friend as punishment. But as their class prepares to leave on an excursion to London, the relationship heats up.",2009-02-04,Comedy Romance,,103,,32764784.0,32764784,,
Fighting (2009),"In New York City, a young counterfeiter is introduced to the world of underground street fighting by a seasoned scam artist, who becomes his manager on the bare-knuckling brawling circuit.",2009-04-22,Action Crime Drama Romance Sport,PG-13,105,23091010.0,9391718.0,32482728,11024370.0,Universal Pictures
The Invention of Lying (2009),"A comedy set in a world where no one has ever lied, until a writer seizes the opportunity for personal gain.",2009-10-02,Comedy Fantasy Romance,PG-13,100,18451251.0,13955256.0,32406507,7027472.0,Warner Bros.
April Bride (2009),"A young woman is diagnosed with breast cancer but keeps the information from her boyfriend. When he finds out, he decides to plan a wedding even though she only has one month to live.",2009-05-09,Drama,,129,,32112343.0,32112343,,
Jennifer's Body (2009),A newly-possessed high-school cheerleader turns into a succubus who specializes in killing her male classmates. Can her best friend put an end to the horror?,2009-09-18,Comedy Horror,R,102,16204793.0,15351268.0,31558416,6868397.0,Twentieth Century Fox
Dance Flick (2009),"Street dancer Thomas Uncles is from the wrong side of the tracks, but his bond with the beautiful Megan White might help the duo realize their dreams as they enter in the mother of all dance battles.",2009-05-22,Action Comedy Music,PG-13,83,25662155.0,5776985.0,31439140,10643536.0,Paramount Pictures
A Serious Man (2009),"Larry Gopnik, a Midwestern physics teacher, watches his life unravel over multiple sudden incidents. Despite seeking meaning and answers amidst his turmoils, he seems to keep sinking.",2009-10-02,Comedy Drama,R,106,9228768.0,22201566.0,31431652,251337.0,Focus Features
The Stepfather (2009),"Michael Harding returns home from military school to find his mother, Susan, happily in love and living with her new boyfriend, David. As the two men get to know each other, he becomes more and more suspicious of the man who is always there to help.",2009-10-16,Mystery Thriller,PG-13,101,29062561.0,2135970.0,31198531,11581586.0,Screen Gems
Yatterman (2009),A toy shop owner/hero and his assistant/heroine battle a leather-clad vixen and her minions to prevent them from acquiring the pieces of a mystical skull.,2009-03-07,Action Adventure Comedy Fantasy Musical Sci-Fi,,111,,32897214.0,32897214,,
Natale a Beverly Hills (2009),"Broke gigolo Carlo descends on his former lover's unsuspecting family, and scheming Rocco tries to break up his old rival Marcello's wedding.",2009-12-18,Comedy,,110,,29976481.0,29976481,,
Crows Zero II (2009),Tension escalates and violence ensues when a young student unwittingly breaks a non-aggression pact between two rival high schools.,2009-04-11,Action Comedy Crime Drama Thriller,,133,,29893636.0,29893636,,
20th Century Boys 2: The Last Hope (2009),Childhood friends continue their battle against a dangerous cult.,2009-01-31,Drama Fantasy,,139,,29502213.0,29502213,,
The Young Victoria (2009),"A dramatization of the turbulent first years of Queen Victoria's rule, and her enduring romance with Prince Albert.",2009-03-06,Biography Drama History Romance,PG,105,11001272.0,18195137.0,29196409,260591.0,Apparition
New in Town (2009),"A Miami, Florida businesswoman adjusts to her new life in a small Minnesota town.",2009-01-30,Comedy Romance,PG,97,16734283.0,12276534.0,29010817,6741530.0,Lionsgate
The Unbroken (2009),"A drama based on the 1985 plane crash that caused 520 deaths, the worst aviation event in Japanese history.",2009-10-24,Drama,,202,,29000322.0,29000322,,
Shorts (2009),"A young boy's discovery of a colorful, wish-granting rock causes chaos in the suburban town of Black Falls when jealous kids and scheming adults alike set out to get their hands on it.",2009-08-06,Adventure Comedy Family Fantasy Sci-Fi,PG,89,20919166.0,8053342.0,28972508,6410339.0,Warner Bros.
Pope Joan (2009),A woman of English extraction born in the German city of Ingelheim in the ninth century disguises herself as a man and rises through the Vatican ranks.,2009-10-22,Drama History Romance,,149,,28748076.0,28748076,,
Case 39 (2009),"A social worker fights to save a girl from her abusive parents, only to discover that the situation is more dangerous than she expected.",2009-08-13,Horror Mystery Thriller,R,109,13261851.0,14928752.0,28190603,5350570.0,Paramount Vantage
Recep Ivedik 2 (2009),Recep gets a job and tries to find a wife to please his ailing grandmother.,2009-02-12,Comedy,,107,,27699692.0,27699692,,
The Road (2009),"In a dangerous post-apocalyptic world, an ailing father defends his son as they slowly travel to the sea.",2009-05-01,Drama Thriller,R,111,8117000.0,19522579.0,27639579,1502231.0,Dimension Films
Sorority Row (2009),A killer threatens to expose the fatal secret binding a group of sorority sisters.,2009-09-10,Horror Mystery,R,101,11965282.0,15240838.0,27206120,5059802.0,Summit Entertainment
Observe and Report (2009),"Bi-polar mall security guard Ronnie Barnhardt is called into action to stop a flasher from turning shopper's paradise into his personal peep show. But when Barnhardt can't bring the culprit to justice, a surly police detective is recruited to close the case.",2009-04-10,Action Comedy Crime Drama Mystery,R,86,24007324.0,2966230.0,26973554,11017334.0,Warner Bros.
An Education (2009),"A coming-of-age story about a teenage girl in 1960s suburban London, and how her life changes with the arrival of a playboy nearly twice her age.",2009-10-08,Drama,PG-13,100,12574914.0,13521938.0,26096852,159017.0,Sony Pictures Classics
Coco (2009),A well-liked self-made man becomes a royal pain when he learns he has a heart defect.,2009-03-18,Comedy Drama,,95,,25661127.0,25661127,,
Doraemon the Movie: The New Records of Nobita's Spaceblazer (2009),"The twist of hyperspace had been brought about by an accident when Nobita's room connected to Roppuru's spaceship door. Nobita who made friendship with Roppuru helps him to cultivate the wild planet where he is settled. On the planet that has far less gravity than the Earth, Nobita is like Superman. He confronts the company that hunts down resources of the planet with his toy guns.",2009-03-07,Adventure Animation Comedy Family Fantasy Sci-Fi,,103,,61482349.0,61482349,,
Mt. Tsurugidake (2009),"In 1907, a group of men climb an unconquered peak in the last unmapped region of Japan.",2009-06-13,Adventure Drama,,139,,25134437.0,25134437,,
A Single Man (2009),"An English professor, one year after the sudden death of his boyfriend, is unable to cope with his typical days in 1960s Los Angeles.",2009-12-11,Drama Romance Thriller,R,99,9176000.0,15788890.0,24964890,217332.0,The Weinstein Company
Kaiji: The Ultimate Gambler (2009),"Kaiji, a young gambler who is constantly in debt, enters a deadly gambling competition in order to wipe away his loans.",2009-10-10,Drama,,130,,24709016.0,24709016,,
If I Were You 2 (2009),"Claudio and Helena are on the verge of breaking up, until the couple experiences another strange phenomenon that looks to help them understand one another more.",2009-01-02,Comedy Fantasy,,96,,24415116.0,24415116,,
I Give My First Love to You (2009),Takuma knows that his life is shorter than the others and he feels that his demise is getting near. He chose to stay away from the girl that he loves so that she can easily move on. What he didn't know is that he is under-estimating her.,2009-10-24,Drama Romance,,122,,24051386.0,24051386,,
Mao's Last Dancer (2009),"In Maoist China, a boy is taken from his family and trained to become a dancer, but everything he knows is challenged when he is chosen to attend a ballet summer school in Houston, Texas.",2009-10-01,Biography Drama Music Romance,PG,117,4817770.0,19096961.0,23914731,199657.0,The Samuel Goldwyn Company
Dark Planet (2008),"A space traveler from the Earth of the 22th century - without wars, poverty and oppression - crashes on an unknown planet. Politically and economically that planet similar to the totalitarian human states of the 20th century.",2009-01-01,Action Adventure Sci-Fi,,115,,23772559.0,23772559,,
