movie_title,movie_summary,release_date,genres,indicative_rating,running_time,domestic_gross,international_gross,total_gross,domestic_opening,domestic_distributor
Cannery Row (1982),"Monterey, California in the 1940's. Cannery Row - the section of town where the now closed fish canneries are located - is inhabited primarily by the down and out, although many would not move away even if they could. Probably the most upstanding citizen in the area is Doc, a marine biologist who earns a living primarily by collecting and selling marine specimens for research. He is a lost soul who is looking for his place in life. He is running away from his past, one where he is trying to make amends for what he considers a past wrong. But his current life isn't totally satisfying either. He believes that his recent collection of eight baby octopi will help him define that future in conducting research on their behavior. However, he is finding that research is not as easy as he had hoped, and that he is still feeling restless. Into the area comes drifter Suzy DeSoto. She too is a lost soul. With few job skills, she gets a job as what she calls a floozy in the local whorehouse, despite her openly headstrong demeanor not making her well suited to the work. Doc and Suzy are immediately attracted to each other, but theirs is a clash of personalities, despite each truly liking the other. The other residents of Cannery Row do their part for a Doc/Suzy coupling, not always with successful results. Doc and Suzy will first have to find their own lot in life before they can commit to someone else, be it the other or anyone else.",1982-02-12,Drama Romance,,120,5301539.0,,5301539,1500000.0,Metro-Goldwyn-Mayer (MGM)
Venom (1981),Terrorists in the process of kidnapping a child get trapped in a house with an extremely deadly snake.,1982-01-29,Horror Thriller,,93,5229643.0,,5229643,,Paramount Pictures
Inchon (1981),"During the Korean War, General Douglas MacArthur masterminds the amphibious invasion of Inchon in September 1950.",1982-09-17,Drama History War,,140,5200986.0,,5200986,2326112.0,Metro-Goldwyn-Mayer (MGM)
Heidi's Song (1982),"Orphan Heidi lives with her grandpa in Swiss Alps. She brings joy to all there. However, her aunt takes her to the city to live as a servant girl to a cold rich strict family and their nice but sad handicapped daughter.",1982-11-19,Adventure Animation Drama Family Fantasy Musical,,94,5124391.0,,5124391,1416713.0,Paramount Pictures
Tempest (1982),"Unhappy middle-aged architect Philip Dimitrius leaves his wife Antonia and career for a spiritual awakening on a Greek island with his new girlfriend Aretha and teenage daughter, leading to extraordinary results for everyone around him.",1982-09-03,Comedy Drama Fantasy Romance,PG,142,5005245.0,,5005245,80492.0,Columbia Pictures
Summer Lovers (1982),A young American couple and a French woman engage in a threesome in the Greek Islands.,1982-07-16,Comedy Drama Romance,,98,4968000.0,,4968000,,Filmways Pictures
Honkytonk Man (1982),A boy with a music talent goes on a journey with his uncle for a stage concert.,1982-12-17,Comedy Drama Music Western,,122,4484991.0,,4484991,667727.0,Warner Bros.
Jekyll and Hyde... Together Again (1982),"Dr. Jekyll's research on a drug to avoid surgery yields a powder that transforms his timid self into a sexually uninhibited party animal, complicating his relationships with his fiancée and stripper girlfriend.",1982-10-01,Comedy Music Sci-Fi,,87,3792188.0,,3792188,819476.0,Paramount Pictures
Wrong Is Right (1982),"A TV reporter finds himself in the middle of an Arab leader buying two portable nukes, terrorists, arms dealer, a reporter/CIA spy killed, a US president ordering a K-I-L-L etc.",1982-05-14,Comedy Drama Thriller,,117,3583513.0,,3583513,1412646.0,Columbia Pictures
Fighting Back (1982),"A Philadelphia shop owner forms a civilian patrol to stop neighborhood crime. The patrol's actions are seen as racially discriminatory, leading to escalating conflict.",1982-05-21,Action Crime Drama Thriller,,98,3355948.0,,3355948,1624381.0,Paramount Pictures
Penitentiary II (1982),"An ex-con, on parole and trying to straighten his life out, decides to resume his boxing career when one of his prison enemies escapes and kills his girlfriend.",1982-04-02,Crime Drama Sport,,108,3178542.0,,3178542,662896.0,Metro-Goldwyn-Mayer (MGM)
The Challenge (1982),A down-and-out American boxer becomes involved in a feud between two Japanese brothers.,1982-07-23,Action Drama,,113,2977706.0,,2977706,,Embassy Pictures
Homework (1982),"Good-looking but virginal ""rockstar"" teen Tommy tries to score with some of the local high school girls. But a classmate's mom decides to make a man out of him.",1982-08-27,Comedy Drama,,89,2914328.0,,2914328,1366535.0,Jensen Farley Pictures
Jinxed! (1982),"Bette Midler is on a roll through Reno, Vegas, and Tahoe with Rip Torn as her semi-professional gambler husband, and Ken Wahl as a seductive blackjack dealer. In HD.",1982-10-22,Comedy,,103,2869638.0,,2869638,1209311.0,Metro-Goldwyn-Mayer (MGM)
It Came from Hollywood (1982),Popular comedians watch and give comments about the worst and silliest films from Hollywood.,1982-10-29,Comedy Documentary,,80,2573342.0,,2573342,1095003.0,Paramount Pictures
A Stranger Is Watching (1982),"The 11-year old daughter and girlfriend of a man whose wife had been raped and killed in front of his daughter three years earlier are kidnapped by the same killer. Held captive in a bunker below Grand Central Station, the two plot their escape while the police try to track the kidnapper.",1982-01-22,Crime Horror Thriller,,92,2519559.0,,2519559,,Metro-Goldwyn-Mayer (MGM)
A Little Sex (1982),The story of Michael Donovan's amusing - and doomed - attempts to wield life's ultimate double-edged sword: infidelity.,1982-04-02,Comedy Romance,,95,2370376.0,,2370376,1030070.0,Universal Pictures
"Yes, Giorgio (1982)",Famous opera singer Giorgio Fini loses his voice during an American tour. He goes to female throat specialist Pamela Taylor and falls in love with her.,1982-09-24,Comedy Musical Romance,,110,2279543.0,,2279543,,Metro-Goldwyn-Mayer (MGM)
Barbarosa (1982),"An inexperienced farm boy hooks up with a legendary outlaw in Mexico and both are soon on the run from the law, Mexican bandits, and two families bent on revenge.",1982-02-19,Comedy Drama Romance Western,,90,1736123.0,,1736123,285312.0,Universal Pictures
"I, the Jury (1982)","A PI investigates the murder of his one-armed friend, a PI working on a case. Clues lead to a sex clinic. Bodies pile up.",1982-01-09,Crime Drama Mystery Romance Thriller,,111,1515578.0,,1515578,,Twentieth Century Fox
Endangered Species (1982),"A former New York City cop relocates to rural Colorado, where he teams with a sheriff investigating a series of bizarre cattle mutilations occurring in the region.",1982-09-10,Drama Mystery Thriller,,97,1474249.0,,1474249,,Metro-Goldwyn-Mayer (MGM)
The Sender (1982),"A disturbed telepathic man is unable to fully control his ability to transmit his dreams and visions into the minds of the people around him, or even influence reality. A female therapist tries to help him, but his mother gets in the way.",1982-10-22,Drama Horror Sci-Fi Thriller,,91,1054328.0,,1054328,434884.0,Paramount Pictures
Lookin' to Get Out (1982),"Alex has had a good day at the track, a bad night at the poker game and hell have a worse time if the guys he owes catch up with him. So Alex and go-along pal Jerry split for Las Vegas...",1982-10-08,Comedy,R,105,946461.0,,946461,528559.0,Paramount Pictures
"Come Back to the 5 & Dime Jimmy Dean, Jimmy Dean (1982)","A fan club of die-hard James Dean fans meet on the 20th anniversary of his death and reconnect, opening old wounds and facing new ones.",1982-11-12,Comedy Drama,,109,840958.0,,840958,,Cinecom Pictures
The House Where Evil Dwells (1982),"A young American family moves to a House in Kyoto, Japan. It turns out to be haunted by the ghosts of a woman and her lover, who were killed by the woman's husband, as well as the ghost of the husband, who killed himself afterward.",1982-05-14,Drama Horror,,88,667863.0,,667863,,Metro-Goldwyn-Mayer (MGM)
One from the Heart (1981),"A couple has a fight after living together 5 years in Las Vegas. They go out and celebrate 4th of July, each with a new partner. Breakup?",1982-02-12,Drama Musical Romance,,107,697872.0,21662.0,719534,389249.0,Columbia Pictures
The Weavers: Wasn't That a Time (1981),"Documentary about the blacklisted folk group, ""The Weavers,"" and the events leading up to their triumphant return to Carnegie Hall.",1982-03-03,Documentary Music,,78,524203.0,,524203,,Metro-Goldwyn-Mayer (MGM)
Monty Python Live at the Hollywood Bowl (1982),The Monty Python troupe perform a combination of classic sketches and new material at the Hollywood Bowl.,1982-06-25,Comedy Documentary Musical,,81,327958.0,,327958,,Columbia Pictures
I'm Dancing as Fast as I Can (1982),A true story about Emmy-winning documentary filmmaker Barbara Gordon's Valium addiction and her desperate attempts to kick the habit.,1982-03-05,Biography Drama,,107,291390.0,,291390,,Paramount Pictures
Split Image (1982),A rising star young gymnast is lured into a religious cult by a beautiful girl. Every moment with the group brings him more and more under the control of the cult's leader.,1982-10-01,Drama Romance,,111,263635.0,,263635,,Orion Pictures
Five Days One Summer (1982),"An aging doctor takes his beautiful young mistress on an alpine walking holiday only to find that she is falling for the charms of a dashing tour guide, but there is a dark secret that looms over the couple.",1982-11-12,Drama,,96,199078.0,,199078,43891.0,Warner Bros.
The Escape Artist (1982),"Teenager Danny Masters, the son of the late Harry Masters, considered the second best escape artist in history, wants to follow in his father's footsteps, he already a skilled but untested magician. As far as Danny knows, his father died in a dangerous escape routine. Escaping from under his grandmother's roof, Danny, in a step to achieve his goal as they have all his father's old professional paraphernalia, reunites with his Aunt Sibyl and Uncle Burke in the town of Harding where they have a mind-reading act, she who actually can read minds but which only impinges on the smoke and mirrors they've developed with the act itself. In his wanderings around Harding, Danny gets involved with corrupt Stu Quiñones, and indirectly with Stu's equally corrupt father, the town's mayor, Leon Quiñones. This father/son pair no longer associate with each other as although Stu aspires to be as corrupt as his father, Stu's activities are a little too brazen and public for a politician with which to deal. In those dealings, Danny devises what is largely seen as a publicity stunt in reality to get the one up on the Quiñoneses, but in which he will have to show his true mettle as a great escape artist. In the process, Danny may also provide some justice for his father, the true nature of his death which Danny learns along the way.",1982-05-28,Comedy Crime Drama,,94,143369.0,,143369,23323.0,Warner Bros.
Bugs Bunny's 3rd Movie: 1001 Rabbit Tales (1982),"Rival book salesmen Bugs Bunny and Daffy Duck are forced by Sultan Yosemite Sam to read fairy tales to his spoiled, selfish son, Prince Abba-Dabba.",1982-11-19,Adventure Animation Comedy Family Music,,74,78350.0,,78350,78350.0,Warner Bros.
Movie Madness (1982),"An anthology parody of film genres composed of three shorts, spoofing personal growth films, glossy soap operas, and police stories.",1982-04-23,Comedy,,89,63405.0,,63405,,United Artists
White Dog (1982),A trainer attempts to retrain a vicious dog that's been raised to attack black people.,1982-11-12,Drama Horror,,90,46509.0,,46509,,Paramount Pictures
Hammett (1982),"Fictional account of real-life mystery writer Dashiell Hammett, and his involvement in the investigation of a beautiful Chinese cabaret actress' mysterious disappearance in San Francisco.",1982-09-17,Crime Drama Mystery,,97,42914.0,,42914,,Warner Bros.
"Ladies and Gentlemen, the Fabulous Stains (1982)","The media and disaffected teens mistake the acerbic rants of an obnoxious teenage punk rocker as a rallying cry for the women of America, launching her and her talentless group to national stardom.",1982-10-15,Comedy Drama Music,,87,25728.0,,25728,,Paramount Pictures
Love & Money (1981),A billionaire businessman hires a man to influence a South American dictator. He winds up having an affair with the billionaire's wife.,1982-02-12,Drama Romance,,90,14009.0,,14009,,Paramount Pictures
Parasite (1982),"In a post-apocalyptic USA, a doctor/scientist infected with a new strain of parasite ends up in a small desert town, trying to find a cure.",1982-03-12,Horror Sci-Fi,,85,,2270.0,2270,,Embassy Pictures
