movie_title,movie_summary,release_date,genres,indicative_rating,running_time,domestic_gross,international_gross,total_gross,domestic_opening,domestic_distributor
What Happened to Monday (2017),"In a world where families are limited to one child due to overpopulation, a set of identical septuplets must avoid being put to a long sleep by the government and dangerous infighting while investigating the disappearance of one of their own.",2017-08-17,Action Crime Fantasy Mystery Sci-Fi Thriller,,123,,27975429,27975429,,
Monster Family (2017),"Despite the title, the Wishbone family are far from happy. In an attempt to reconnect as a family, Mum Emma plan a fun night out. However, her plan backfires when an evil witch curses them, and they're all turned into Monsters.",2017-08-17,Animation Comedy Family Fantasy Horror,PG,93,127259.0,29103436,29230695,576.0,Viva Pictures
The Beguiled (2017),The unexpected arrival of a wounded Union soldier at a girls school in Virginia during the American Civil War leads to jealousy and betrayal.,2017-06-23,Drama History Thriller War Western,R,93,10709995.0,17159134,27869129,229292.0,Focus Features
CHIPS (2017),An inexperienced rookie is teamed up with a hardened pro at the California Highway Patrol in Los Angeles; the newbie officer soon learns his partner is really an undercover Fed investigating a heist which may involve some crooked cops.,2017-03-23,Action Comedy Crime,R,100,18600152.0,8200000,26800152,7722802.0,Warner Bros.
A Cure for Wellness (2016),A stockbroker unravels the terrifying secrets of a mysterious Swiss spa where guests never leave.,2017-02-15,Drama Fantasy Horror Mystery Sci-Fi Thriller,R,146,8106986.0,18513016,26620002,4356941.0,Twentieth Century Fox
Only the Brave (2017),"Based on the true story of the Granite Mountain Hotshots, a group of elite firefighters who risk everything to protect a town from a historic wildfire.",2017-10-18,Action Biography Drama,PG-13,134,18343983.0,8007339,26351322,6002665.0,Sony Pictures Releasing
Twenty Two (2015),"An estimated 200,000 Chinese women were forced into prostitution by the Japanese army during WWII. Only 22 of them remain today to speak out publicly. This documentary is not a film for political gains or narrow nationalistic purposes. For the director and the crew, each and every one of those elderly women is a brave and strong individual with similar yet distinctive experiences. This is a group that deserves to be known and correctly understood by more people and a history worth being preserved in a most accurate yet sensitive way. In the documentary, the current situation of those 22 elderly women will be presented in an impersonal way. There's no interrogation, sympathy, nor exaggeration in our film. You will hear them talk about their own experiences, and you will also learn about their perspectives on life, sufferings and happiness. Now all over 80 or 90 years old, those elderly ladies are at the very last stage of their life. This is probably the last chance for the public to actually see their situations and hear their own words while they are still alive. It should not be a history just written on pages.",2017-08-14,Crime Documentary History War,,112,46796.0,26242582,26289378,22222.0,China Lion Film Distribution
The Zookeeper's Wife (2017),"Keepers of the Warsaw Zoo, Antonina and Jan Zabinski, must save hundreds of people and animals during the Nazi invasion in WWII Poland.",2017-03-24,Biography Drama History War,PG-13,127,17571660.0,8581175,26152835,3288835.0,Focus Features
The Bride of Badrinath (2017),Badrinath is looking for a typical bride; Vaidehi is looking for an independent life. Together they must break with tradition and redefine their role.,2017-03-09,Comedy Drama Romance,,139,1993259.0,24141050,26134309,862008.0,FIP
A Chinese Odyssey: Part 2 - Cinderella (1995),"The convoluted continuation of the adventures of the time-traveling, now-human Monkey King, who attempts to fulfill his divine destiny.",2010-06-01,Action Adventure Comedy Drama Fantasy Romance,,98,,25967935,25967935,,
Love Off the Cuff (2017),A couple who have been together for several years try to decide if they should stay together.,2017-04-27,Comedy Drama Romance,,121,,25959989,25959989,,
Father Figures (2017),"Upon learning that their mother has been lying to them for years about their allegedly deceased father, fraternal twin brothers hit the road to search for him.",2017-12-21,Comedy Drama,R,113,17501244.0,8200000,25701244,3287451.0,Warner Bros.
Fireworks (2017),"In this sci-fi tinged story of young love and teenage turmoil, a mysterious glowing ball offers Norimichi a second chance at securing his dream date.",2017-08-18,Animation Drama Fantasy Romance Sci-Fi,,90,525280.0,25147126,25672406,138014.0,GKIDS
Money (2017),The lives of three thieves attempting to rob a house are altered by what they see inside.,2017-09-27,Thriller,,90,,25403753,25403753,,
Leap! (2016),"An orphan girl dreams of becoming a ballerina and flees her rural Brittany for Paris, where she passes for someone else and accedes to the position of pupil at the Grand Opera House.",2016-12-14,Adventure Animation Comedy Family Music,PG,89,24702560.0,84870951,109573511,181091.0,Entertainment One
The Death of Stalin (2017),"Moscow, 1953. After being in power for nearly 30 years, Soviet dictator, Joseph Vissarionovich Stalin, takes ill and quickly dies. Now the members of the Council of Ministers scramble for power.",2017-10-20,Comedy Drama History,R,107,8047856.0,16598199,24646055,184805.0,IFC Films
The 8-Year Engagement (2017),"Hisashi and Mai are set to have their wedding ceremony in three months. Unfortunately, Mai falls ill and lapses into a coma.",2017-12-16,Drama Romance,,119,,24425963,24425963,,
Jolly LLB 2 (2017),Jolly is a clumsy lawyer who is faced with representing the most critical court case of his career.,2017-02-09,Comedy Crime Drama,,137,1654254.0,22559932,24214186,774355.0,FIP
I Can Speak (2017),"An elderly woman who constantly files complaints with the local office about the wrongs that she sees around her each day, forms an unlikely friendship with a junior civil service officer, who begins to teach her English.",2017-09-21,Comedy Drama,,119,63239.0,23961205,24024444,,CJ Entertainment
Wish Upon (2017),A teenage girl discovers a box that carries magic powers and a deadly price for using them.,2017-07-13,Drama Fantasy Horror Mystery Thriller,PG-13,90,14301505.0,9167081,23468586,5467084.0,Broad Green Pictures
Detroit (2017),Fact-based drama set during the 1967 Detroit riots in which a group of rogue police officers respond to a complaint with retribution rather than justice on their minds.,2017-07-28,Crime Drama History Thriller,R,143,16790139.0,6564961,23355100,350190.0,Annapurna Pictures
Extraordinary Mission (2017),An undercover police officer attempts to take down a drug trafficking syndicate from the inside.,2017-03-31,Action Crime,,117,54174.0,22703590,22757764,28649.0,Crimson Forest Films
The Glass Castle (2017),A young girl comes of age in a dysfunctional family of nonconformist nomads with a mother who's an eccentric artist and an alcoholic father who would stir the children's imagination with hope as a distraction to their poverty.,2017-08-10,Biography Drama,PG-13,127,17273059.0,4815474,22088533,4678548.0,Lionsgate
Épouse-moi mon pote (2017),"To avoid deportation, Yassine asks his best friend Fred to marry him.",2017-10-25,Comedy Romance,,92,,21571464,21571464,,
The Prison (2017),A troubled ex-cop imprisoned for a hit-and-run accident discovers that the entire penitentiary is controlled by an inmate who has been running a crime syndicate with the help of the warden and guards which provides them 100% alibi.,2017-03-23,Action Crime,,125,207481.0,20997848,21205329,80376.0,Well Go USA Entertainment
One Hundred Thousand Bad Jokes 2 (2017),,2017-08-18,,,125,,20460352,20460352,,
