movie_title,movie_summary,release_date,genres,indicative_rating,running_time,domestic_gross,international_gross,total_gross,domestic_opening,domestic_distributor
Inside Out 2 (2024),"A sequel that features Riley entering puberty and experiencing brand new, more complex emotions as a result. As Riley tries to adapt to her teenage years, her old emotions try to adapt to the possibility of being replaced.",2024-06-12,Adventure Animation Comedy Drama Family Fantasy Sport,PG,96,652980194.0,1045883622.0,1698863816,154201673.0,Walt Disney Studios Motion Pictures
Deadpool & Wolverine (2024),"Deadpool is offered a place in the Marvel Cinematic Universe by the Time Variance Authority, but instead recruits a variant of Wolverine to save his universe from extinction.",2024-07-18,Action Adventure Comedy Sci-Fi,R,128,636745858.0,701327787.0,1338073645,211435291.0,Walt Disney Studios Motion Pictures
Moana 2 (2024),"After receiving an unexpected call from her wayfinding ancestors, Moana must journey to the far seas of Oceania and into dangerous, long-lost waters for an adventure unlike anything she's ever faced.",2024-11-27,Adventure Animation Comedy Family Fantasy Musical,PG,100,460405297.0,598836867.0,1059242164,139787385.0,Walt Disney Studios Motion Pictures
Despicable Me 4 (2024),"Gru, Lucy, Margo, Edith, and Agnes welcome a new member to the family, Gru Jr., who is intent on tormenting his dad. Gru faces a new nemesis in Maxime Le Mal and his girlfriend Valentina, and the family is forced to go on the run.",2024-06-20,Adventure Animation Comedy Crime Family Sci-Fi,PG,94,361004205.0,608775327.0,969779532,75009210.0,Universal Pictures
Wicked (2024),"Elphaba, a young woman ridiculed for her green skin, and Galinda, a popular girl, become friends at Shiz University in the Land of Oz. After an encounter with the Wonderful Wizard of Oz, their friendship reaches a crossroads.",2024-11-20,Fantasy Musical Romance,PG,160,473231120.0,283002082.0,756233202,112508890.0,Universal Pictures
Mufasa: The Lion King (2024),"Mufasa, a cub lost and alone, meets a sympathetic lion named Taka, the heir to a royal bloodline. The chance meeting sets in motion an expansive journey of a group of misfits searching for their destiny.",2024-12-18,Adventure Animation Drama Family Musical,PG,118,254567693.0,468064063.0,722631756,35409365.0,Walt Disney Studios Motion Pictures
Dune: Part Two (2024),"Paul Atreides unites with the Fremen while on a warpath of revenge against the conspirators who destroyed his family. Facing a choice between the love of his life and the fate of the universe, he endeavors to prevent a terrible future.",2024-02-28,Action Adventure Drama Sci-Fi,PG-13,166,282144358.0,432700000.0,714844358,82505391.0,Warner Bros.
Godzilla x Kong: The New Empire (2024),"Two ancient titans, Godzilla and Kong, clash in an epic battle as humans unravel their intertwined origins and connection to Skull Island's mysteries.",2024-03-27,Action Adventure Fantasy Sci-Fi Thriller,PG-13,115,196350016.0,375700000.0,572050016,80006561.0,Warner Bros.
Kung Fu Panda 4 (2024),"After Po is tapped to become the Spiritual Leader of the Valley of Peace, he needs to find and train a new Dragon Warrior, while a wicked sorceress plans to re-summon all the master villains whom Po has vanquished to the spirit realm.",2024-03-06,Action Adventure Animation Comedy Family Fantasy Thriller,PG,94,193590620.0,354355808.0,547946428,57989905.0,Universal Pictures
Sonic the Hedgehog 3 (2024),"Sonic, Knuckles, and Tails reunite against a powerful new adversary, Shadow, a mysterious villain with powers unlike anything they have faced before. With their abilities outmatched, Team Sonic must seek out an unlikely alliance.",2024-12-20,Action Adventure Comedy Family Fantasy Sci-Fi,PG,110,236115100.0,256047504.0,492162604,60102146.0,Paramount Pictures
Venom: The Last Dance (2024),Eddie Brock and Venom must make a devastating decision as they're pursued by a mysterious military man and alien monsters from Venom's home world.,2024-10-23,Action Adventure Sci-Fi Thriller,PG-13,110,139755882.0,339181736.0,478937618,51012404.0,Sony Pictures Releasing
Gladiator II (2024),"After his home is conquered by the tyrannical emperors who now lead Rome, Lucius is forced to enter the Colosseum and must look to his past to find strength to return the glory of Rome to its people.",2024-11-06,Action Adventure Drama,R,148,172438016.0,289742701.0,462180717,55034715.0,Paramount Pictures
Beetlejuice Beetlejuice (2024),"After a family tragedy, three generations of the Deetz family return home to Winter River. Still haunted by Beetlejuice, Lydia's life is turned upside down when her teenage daughter, Astrid, accidentally opens the portal to the Afterlife.",2024-09-04,Comedy Fantasy Horror,PG-13,105,294100435.0,157900000.0,452000435,111003345.0,Warner Bros.
Yolo (2024),"After an argument with her younger sister, Le Ying moves out on her own. She meets a boxing trainer and starts boxing.",2024-02-10,Action Comedy Drama Sport,PG-13,129,2001584.0,431598753.0,433600337,827632.0,Sony Pictures Releasing
Pegasus 2 (2024),"A former rally driving champion, now down on his luck, finds new partners to re-enter a famed rally race.",2024-02-08,Comedy Drama Sport,,121,,422878491.0,422878491,,
Successor (2024),"Ma Chenggang and Chunlan, who have ""no oil in their soup and no money in their pockets"", ride a donkey to work and have a poor family. Their son Ma Jiye is the only hope who can change their fate.",2024-07-16,Comedy Drama,,133,,422307398.0,422307398,,
Bad Boys: Ride or Die (2024),"When their late police captain gets linked to drug cartels, wisecracking Miami cops Mike Lowrey and Marcus Burnett embark on a dangerous mission to clear his name.",2024-06-05,Action Adventure Comedy Crime Thriller,R,115,193573217.0,210976967.0,404550184,56527324.0,Sony Pictures Releasing
Kingdom of the Planet of the Apes (2024),"Many years after the reign of Caesar, a young ape goes on a journey that will lead him to question everything he's been taught about the past and make choices that will define a future for apes and humans alike.",2024-05-08,Action Adventure Drama Sci-Fi Thriller,PG-13,145,171130165.0,226247985.0,397378150,58400788.0,20th Century Studios
Twisters (2024),"Kate Carter, a retired tornado-chaser and meteorologist, is persuaded to return to Oklahoma to work with a new team and new technologies.",2024-07-10,Action Adventure Thriller,PG-13,122,267762265.0,104500000.0,372262265,81251415.0,Universal Pictures
It Ends with Us (2024),"When a woman's first love suddenly reenters her life, her relationship with a charming, but abusive neurosurgeon is upended and she realizes she must learn to rely on her own strength to make an impossible choice for her future.",2024-08-07,Drama Romance,PG-13,130,148518266.0,202922778.0,351441044,50016652.0,Sony Pictures Releasing
Alien: Romulus (2024),"While scavenging the deep ends of a derelict space station, a group of young space colonists come face to face with the most terrifying life form in the universe.",2024-08-14,Horror Sci-Fi Thriller,R,119,105313091.0,245552251.0,350865342,42003361.0,Walt Disney Studios Motion Pictures
The Wild Robot (2024),"After a shipwreck, an intelligent robot called Roz is stranded on an uninhabited island. To survive the harsh environment, Roz bonds with the island's animals and cares for an orphaned baby goose.",2024-09-19,Adventure Animation Family Sci-Fi,PG,102,143901945.0,190635242.0,334537187,35790150.0,Universal Pictures
Article 20 (2024),"A prosecutor on his last case deals with a colleague to exonerate a suspect, making the law just.",2024-02-10,Drama,,141,,306899794.0,306899794,,
A Quiet Place: Day One (2024),A young woman named Sam finds herself trapped in New York City during the early stages of an invasion by alien creatures with ultra-sensitive hearing.,2024-06-26,Drama Horror Sci-Fi Thriller,PG-13,99,139051884.0,122855769.0,261907653,52202495.0,Paramount Pictures
Boonie Bears: Time Twist (2024),"When Vick gets a chance to start his life again as a logger, he must save his friends by embarking on an adventure through time and space.",2024-02-10,Animation,PG,105,,250921235.0,250921235,,Viva Pictures
The Garfield Movie (2024),"After Garfield's unexpected reunion with his long-lost father, ragged alley cat Vic, he and his canine friend Odie are forced from their perfectly pampered lives to join Vic on a risky heist.",2024-05-01,Adventure Animation Comedy Family Fantasy,PG,101,91956547.0,142734454.0,257211519,24006629.0,Sony Pictures Releasing
Joker: Folie à Deux (2024),"Struggling with his dual identity, failed comedian Arthur Fleck meets the love of his life, Harley Quinn, while incarcerated at Arkham State Hospital.",2024-10-01,Drama Musical Thriller,R,138,58300287.0,149200000.0,207500287,37678467.0,Warner Bros.
Ghostbusters: Frozen Empire (2024),"When the discovery of an ancient artifact unleashes an evil force, Ghostbusters new and old must join forces to protect their home and save the world from a second ice age.",2024-03-20,Adventure Comedy Fantasy Sci-Fi,PG-13,115,113376590.0,88590931.0,201967521,45004673.0,Sony Pictures Releasing
IF (2024),A young girl who goes through a difficult experience begins to see everyone's imaginary friends who have been left behind as their real-life friends have grown up.,2024-05-08,Animation Comedy Drama Family Fantasy,PG,104,111375918.0,79159790.0,190535708,33715801.0,Paramount Pictures
Red One (2024),"After Santa Claus is kidnapped, the North Pole's Head of Security must team up with a notorious hacker in a globe-trotting, action-packed mission to save Christmas.",2024-11-06,Action Adventure Comedy Fantasy Mystery,PG-13,123,97000759.0,89000000.0,186000759,32106112.0,Amazon MGM Studios
Nosferatu (2024),"A gothic tale of obsession between a haunted young woman and the terrifying vampire infatuated with her, causing untold horror in its wake.",2024-12-25,Fantasy Horror Mystery,R,132,95608235.0,86149766.0,181758001,21652560.0,Focus Features
The Fall Guy (2024),"A stuntman, fresh off an almost career-ending accident, has to track down a missing movie star, solve a conspiracy and try to win back the love of his life while still doing his day job.",2024-04-24,Action Comedy Drama Romance,PG-13,126,92900355.0,88172936.0,181073291,27747035.0,Universal Pictures
Bob Marley: One Love (2024),"The story of how reggae icon Bob Marley overcame adversity, and the journey behind his revolutionary music.",2024-02-14,Biography Drama Music,PG-13,107,96981216.0,83935386.0,180916602,28659004.0,Paramount Pictures
Furiosa: A Mad Max Saga (2024),"After being snatched from the Green Place of Many Mothers, while the tyrants Dementus and Immortan Joe fight for power and control, the young Furiosa must survive many trials as she puts together the means to find her way home.",2024-05-22,Action Adventure Sci-Fi,R,148,67475791.0,106900000.0,174375791,26326462.0,Warner Bros.
A Place Called Silence (2024),"Chen Yutong, a girl's middle school student, was bullied at school, but her mother Li Han was unable to save her daughter from the ""hell"". Everyone around her turned a blind eye, and a collective silence brewed greater violence.",2024-07-03,Crime Drama Mystery,,119,,174308156.0,174308156,,
Paddington in Peru (2024),"Paddington returns to Peru to visit his beloved Aunt Lucy, who now resides at the Home for Retired Bears. With the Brown family in tow, a thrilling adventure ensues when a mystery plunges them into an unexpected journey.",2024-11-08,Adventure Comedy Family Mystery,PG,106,45770312.0,125031664.0,170801976,12761398.0,Sony Pictures Releasing
The Beekeeper (2024),A former operative of a powerful organization embarks on a brutal campaign for vengeance.,2024-01-10,Action Crime Thriller,R,105,66220535.0,96399000.0,162619535,16576007.0,Metro-Goldwyn-Mayer (MGM)
Pushpa: The Rule - Part 2 (2024),"A smuggling kingpin faces off against a vengeful rival while manipulating politics, making big deals, and navigating tense confrontations. A public apology leads to a dramatic showdown, ending with challenge.",2024-12-04,Action Crime Drama Thriller,,201,13000000.0,141621981.0,154621981,9300000.0,AA Films
The Volunteers: The Battle of Life and Death (2024),"It tells the story of the third to fifth battles in the War to Resist U.S. Aggression and Aid Korea, among which Battle of Cheorwon will be the highlight. Li Xiang , Fu Chongbi, Cai Changyuan from 63rd Army and others will come on Stage.",2024-09-30,Drama History War,,144,,153429899.0,153429899,,
A Complete Unknown (2024),"In 1961, an unknown 19-year-old Bob Dylan arrives in New York City with his guitar and forges relationships with musical icons on his meteoric rise, culminating in a groundbreaking performance that reverberates around the world.",2024-12-25,Biography Drama Music,R,141,75001720.0,65506932.0,140508652,11655553.0,Searchlight Pictures
Smile 2 (2024),"About to embark on a world tour, global pop sensation Skye Riley begins experiencing increasingly terrifying and inexplicable events. Overwhelmed by the escalating horrors and the pressures of fame, Skye is forced to face her past.",2024-10-16,Horror Mystery Thriller,R,127,69012586.0,69116268.0,138128854,23021692.0,Paramount Pictures
Transformers One (2024),"The untold origin story of Optimus Prime and Megatron, better known as sworn enemies, but who once were friends bonded like brothers who changed the fate of Cybertron forever.",2024-09-11,Action Adventure Animation Family Fantasy Sci-Fi,PG,104,59098421.0,70309971.0,129408392,24613970.0,Paramount Pictures
Longlegs (2024),"In pursuit of a serial killer, an FBI agent uncovers a series of occult clues that she must solve to end his terrifying killing spree.",2024-07-10,Crime Horror Mystery Thriller,R,101,74346140.0,53615796.0,127961936,22400119.0,Neon
Civil War (2024),"In a dystopian future, four journalists travel across the United States during a nation-wide conflict. While trying to survive, they aim to reach the White House to interview the president before he is overthrown.",2024-04-10,Action Thriller,R,109,68756072.0,58511993.0,127268065,25537368.0,A24
Conclave (2024),"When Cardinal Lawrence is tasked with leading one of the world's most secretive and ancient events, selecting a new Pope, he finds himself at the center of a web of conspiracies and intrigue that could shake the very foundation of the Catholic Church.",2024-10-25,Drama Thriller,PG,120,32580655.0,93723246.0,126303901,6601995.0,Focus Features
Kalki 2898 AD (2024),The future of those in the dystopian city of Kasi is altered when the destined arrival of Lord Vishnu's final avatar launches a war against darkness.,2024-06-27,Action Adventure Drama Fantasy Sci-Fi Thriller,,180,18289575.0,107567863.0,125857438,5668275.0,Prathyangira Cinemas
Detective Conan: The Million-Dollar Pentagram (2024),"The ""truth"" hidden in the sword cuts through the dark night and leads us under the moon. Love and incidents unfold in turbulent ways. ? The treasure battle mystery that will divide the world has begun.",2024-04-12,Animation Mystery Romance,,111,,108136957.0,108136957,,
Mean Girls (2024),"Cady Heron is a hit with the Plastics, an A-list girl clique at her new school. But everything changes when she makes the mistake of falling for Aaron Samuels, the ex-boyfriend of alpha Plastic Regina George.",2024-01-10,Comedy Musical,PG-13,112,72581770.0,32389183.0,104970953,28635307.0,Paramount Pictures
Madame Web (2024),"Forced to confront her past, Cassandra Webb, a Manhattan paramedic that may have clairvoyant abilities, forms a relationship with three young women destined for powerful futures, if they can survive their threatening present.",2024-02-14,Action Thriller,PG-13,116,43817106.0,56681658.0,100498764,15335860.0,Columbia Pictures
Haikyu!! The Dumpster Battle (2024),"Despite a strong field, the Karasuno High volleyball team advances past the preliminary round of the Harutaka tournament in Miyagi prefecture to reach the third round.",2024-02-16,Animation Comedy Drama Sport,PG-13,85,7071622.0,92978876.0,100050498,3645301.0,Crunchyroll
Argylle (2024),A reclusive author who writes espionage novels about a secret agent and a global spy syndicate realizes that the plot of the new book she's writing starts to mirror real-world events in real time.,2024-01-31,Action Comedy Thriller,PG-13,139,45207275.0,51013786.0,96221061,17473540.0,Universal Pictures
Challengers (2024),"Tashi, a former tennis prodigy turned coach, transformed her husband into a champion. But to overcome a recent losing streak and redeem himself, he'll need to face off against his former best friend and Tashi's ex-boyfriend.",2024-04-18,Comedy Drama Romance Sport,R,131,50119408.0,46000000.0,96119408,15011061.0,Amazon MGM Studios
Exhuma (2024),The process of excavating an ominous grave unleashes dreadful consequences buried underneath.,2024-02-22,Horror Mystery,,134,2310900.0,91563946.0,93874846,60512.0,Well Go USA Entertainment
Terrifier 3 (2024),Art the Clown is set to unleash chaos on the unsuspecting residents of Miles County as they peacefully drift off to sleep on Christmas Eve.,2024-10-09,Horror,,125,53981071.0,36341032.0,90322103,18928113.0,Cineverse
A Little Something Extra (2024),"To escape the police, a son and his father find refuge in a summer camp for young adults with disabilities, posing as a resident and his educator. The beginning of trouble and a wonderful human experience that will change them forever.",2024-05-01,Comedy,,99,,84229678.0,84229678,,
Trap (2024),A father and his teen daughter attend a pop concert only to realize they've entered the center of a dark and sinister event.,2024-07-31,Crime Horror Mystery Thriller,PG-13,105,42777281.0,40900000.0,83677281,15454146.0,Warner Bros.
The Roundup: Punishment (2024),"Detective Ma Seok-do joins the Cyber Investigation Team to nab Baek Chang-ki, a former mercenary and the head of an online gambling organization.",2024-01-05,Action Crime Thriller,,109,1154475.0,79272373.0,80426848,55684.0,Capelight Pictures
The Count of Monte-Cristo (2024),"After escaping from an island prison where he spent 14 years for being wrongly accused of state treason, Edmond Dantès returns as the Count of Monte Cristo to exact revenge on the men who betrayed him.",2024-06-26,Action Adventure Drama Romance Thriller,,178,529830.0,78043553.0,78573383,17426.0,The Samuel Goldwyn Company
The Substance (2024),"A fading celebrity takes a black-market drug: a cell-replicating substance that creates a younger, better version of herself.",2024-08-31,Drama Horror Sci-Fi,R,141,17584795.0,59732017.0,77316812,3205212.0,MUBI
Speak No Evil (2024),"A family is invited to spend a whole weekend in a lonely home in the countryside, but as the weekend progresses, they realize that a dark side lies within the family who invited them.",2024-09-11,Drama Horror Thriller,R,110,36931420.0,39824689.0,76756109,11397595.0,Universal Pictures
Babygirl (2024),A high-powered CEO puts her career and family on the line when she begins a torrid affair with her much-younger intern.,2024-12-25,Drama Romance Thriller,R,114,28196732.0,36414630.0,64611362,4490145.0,A24
Kraven the Hunter (2024),"Kraven's complex relationship with his ruthless father, Nikolai Kravinoff, starts him down a path of vengeance with brutal consequences, motivating him to become not only the greatest hunter in the world, but also one of its most feared.",2024-12-11,Action Adventure Thriller,R,127,25026310.0,37050223.0,62076533,11001109.0,Sony Pictures Releasing
Heretic (2024),Two young religious women are drawn into a game of cat-and-mouse in the house of a strange man.,2024-11-01,Horror Thriller,R,111,27986380.0,31791590.0,59777970,10829810.0,A24
We Live in Time (2024),"After an unusual encounter, a talented chef and a recently divorcée fall in love and build the home and family they've always dreamed of, until a painful truth puts their love story to the test.",2024-10-10,Drama Romance,R,108,24692924.0,32773710.0,57466634,232615.0,A24
Anora (2024),"A young stripper from Brooklyn meets and impulsively marries the son of a Russian oligarch. Once the news reaches Russia, her fairy tale is threatened as his parents set out for New York to get the marriage annulled.",2024-10-17,Comedy Drama Romance,R,139,20474295.0,36736767.0,57211062,550503.0,Neon
Night Swim (2024),"A family moves into a new home, unaware that a dark secret from the house's past will unleash a malevolent force in the backyard pool.",2024-01-03,Horror Mystery Thriller,PG-13,98,32494740.0,22273577.0,54768317,11797155.0,Universal Pictures
Kingdom 4: Return of the Great General (2024),"While Qin continues to fight for the unification of the region, its neighboring country invades Qin from the north.",2024-07-12,Action Drama History,,145,,54114815.0,54114815,,
The First Omen (2024),"A young American woman is sent to Rome to begin a life of service to the church, but encounters a darkness that causes her to question her faith and uncovers a terrifying conspiracy that hopes to bring about the birth of evil incarnate.",2024-04-03,Horror,R,119,20092802.0,33753078.0,53845880,8353710.0,Walt Disney Studios Motion Pictures
"I, the Executioner (2024)","Rookie detective Park Sun Woo and Seo Do-Cheol, a veteran of the Violent Crimes Investigation Division team, chase after a serial killer who shakes up their world.",2024-09-13,Action Adventure Comedy Crime Thriller,,118,388067.0,53091267.0,53479334,124099.0,Blue Fox Entertainment
Coraline (2009),"Wandering her rambling old house in her boring new town, a young girl discovers a hidden door to a strangely idealized version of her life that seems too good to be true.",2009-02-05,Animation Drama Family Fantasy,PG,100,116896576.0,68952667.0,185860104,16849640.0,Focus Features
Back to Black (2024),"The life and music of Amy Winehouse, through the journey of adolescence to adulthood and the creation of one of the best-selling albums of our time.",2024-04-11,Biography Drama Music,R,122,6178165.0,44848450.0,51026615,2835720.0,Focus Features
The Brutalist (2024),A visionary architect flees post-war Europe in 1947 for a brighter future in the United States and finds his life forever changed by a wealthy client.,2024-12-20,Drama,R,216,16279129.0,34078017.0,50357146,266791.0,A24
Tarot (2024),"When a group of friends recklessly violates the sacred rule of Tarot readings, they unknowingly unleash an unspeakable evil trapped within the cursed cards. One by one, they come face to face with fate and end up in a race against death.",2024-05-01,Horror,PG-13,92,18771004.0,30485235.0,49256239,6503012.0,Screen Gems
The Strangers: Chapter 1 (2024),"After their car breaks down in an eerie small town, a young couple is forced to spend the night in a remote cabin. Panic ensues as they are terrorized by three masked strangers who strike with no mercy and seemingly no motive.",2024-05-15,Horror,R,91,35202562.0,12963886.0,48166448,11825058.0,Lionsgate
Blink Twice (2024),"When tech billionaire Slater King meets cocktail waitress Frida at his fundraising gala, he invites her to join him and his friends on a dream vacation on his private island. As strange things start to happen, Frida questions her reality.",2024-08-21,Mystery Thriller,R,102,23093906.0,25000000.0,48093906,7301894.0,Amazon MGM Studios
Demon Slayer: Kimetsu No Yaiba - To the Hashira Training (2024),"Tanjiro undergoes rigorous training with the Stone Hashira, Himejima, in his quest to become a Hashira. Meanwhile, Muzan continues to search for Nezuko and Ubuyashiki.",2024-02-02,Action Adventure Animation Fantasy Thriller,R,104,17657658.0,26697167.0,44354825,11505414.0,Sony Pictures Releasing
Imaginary (2024),A woman returns to her childhood home to discover that the imaginary friend she left behind is very real and unhappy that she abandoned him.,2024-03-06,Horror Mystery Thriller,PG-13,104,28009161.0,15777873.0,43787034,9912713.0,Lionsgate
Abigail (2024),"After a group of criminals kidnap the ballerina daughter of a powerful underworld figure, they retreat to an isolated mansion, unaware that they're locked inside with no normal little girl.",2024-04-17,Action Comedy Crime Horror Thriller,R,109,25867515.0,16923934.0,42791449,10297110.0,Universal Pictures
Fly Me to the Moon (2024),"Marketing maven Kelly Jones wreaks havoc on NASA launch director Cole Davis's already difficult task. When the White House deems the mission too important to fail, the countdown truly begins.",2024-04-11,Comedy Romance,PG-13,132,20532222.0,21728312.0,42260534,9402176.0,Columbia Pictures
Arthur the King (2024),An adventure racer adopts a stray dog named Arthur to join him in an epic endurance race.,2024-03-15,Adventure Drama Sport,PG-13,107,25049006.0,15812758.0,40861764,7633898.0,Lionsgate
The Forge (2024),"After graduating from high school without any plans for the future, Isaiah receives a push to start making better life decisions.",2024-08-22,Drama Family,PG,124,29123632.0,11271419.0,40395051,6659508.0,Affirm Films
The Best Christmas Pageant Ever (2024),Nobody is ready for the mayhem and surprises that ensue when six of the worst youngsters disrupt the town's yearly Christmas performance.,2024-11-08,Adventure Comedy Drama Fantasy Mystery Romance,PG,99,40048808.0,213359.0,40262167,10773559.0,Lionsgate
Cells at Work! (2024),"Each and every body is a legion of cells, all performing their function to keep their owner operating.",2024-12-13,Action Adventure Comedy Fantasy,,109,,39618125.0,39618125,,
Horizon: An American Saga - Chapter 1 (2024),"Chronicles a multi-faceted, 15-year span of pre-and post-Civil War expansion and settlement of the American west.",2024-06-26,Drama Western,R,181,29035702.0,9800000.0,38835702,11052561.0,Warner Bros.
